"id","query","language","intent","terminal","entities","expected_response","notes"
"1","What is the baggage allowance for economy class?","en","baggage","departure","{}","Economy class passengers are allowed 20kg checked baggage and 7kg cabin baggage","Common query"
"2","How much does excess baggage cost?","en","baggage","departure","{}","Excess baggage costs PKR 800 per kg for domestic flights and USD 15 per kg for international flights","Pricing query"
"3","Can I carry a laptop bag along with my hand luggage?","en","baggage","departure","{}","Yes, you can carry one laptop bag or handbag in addition to your cabin baggage","Cabin baggage rules"
"4","What items are not allowed in checked baggage?","en","baggage","departure","{}","Prohibited items include lithium batteries, power banks, lighters, sharp objects, and flammable materials","Safety regulations"
"5","Is there a weight limit for cabin baggage?","en","baggage","departure","{}","Cabin baggage must not exceed 7kg and dimensions should be 56cm x 36cm x 23cm","Standard IATA limits"
"6","Where is the baggage drop-off counter?","en","baggage","departure","{}","Baggage drop-off counters are located at your airline's check-in area in the departure hall","Location query"
"7","Can I check in extra baggage at the airport?","en","baggage","departure","{}","Yes, you can purchase additional baggage allowance at the check-in counter subject to availability","Last-minute purchase"
"8","What is the baggage allowance for infants?","en","baggage","departure","{""passenger_type"":""infant""}","Infants are allowed 10kg checked baggage plus one collapsible stroller or car seat","Family travel"
"9","Are musical instruments allowed as cabin baggage?","en","baggage","departure","{""item"":""musical instrument""}","Small musical instruments that fit in overhead bins are allowed; larger ones must be checked or require an extra seat","Special items"
"10","How early should I arrive for baggage check-in?","en","baggage","departure","{}","Arrive at least 3 hours before international flights and 2 hours before domestic flights","Time recommendation"
"11","Can I lock my checked baggage?","en","baggage","departure","{}","Yes, you can use TSA-approved locks; avoid regular locks as security may need to inspect your bag","Security advice"
"12","What happens if my baggage is overweight?","en","baggage","departure","{}","You'll need to pay excess baggage fees or remove items to meet the weight limit","Common concern"
"13","Is sports equipment allowed in checked baggage?","en","baggage","departure","{""item"":""sports equipment""}","Yes, sports equipment like golf clubs and skis are allowed but may incur additional charges","Special baggage"
"14","Can I carry liquids in my cabin bag?","en","baggage","departure","{""item"":""liquids""}","Liquids must be in containers of 100ml or less, placed in a clear plastic bag (max 1 liter)","Security rule"
"15","What is the business class baggage allowance?","en","baggage","departure","{""class"":""business""}","Business class passengers are allowed 30kg checked baggage and 7kg cabin baggage","Premium class"
"16","Are power banks allowed in checked luggage?","en","baggage","departure","{""item"":""power bank""}","No, power banks must be carried in cabin baggage only due to fire safety regulations","Important restriction"
"17","Can I wrap my luggage at the airport?","en","baggage","departure","{}","Yes, baggage wrapping service is available near the check-in area for a fee","Additional service"
"18","What size bag is allowed as cabin luggage?","en","baggage","departure","{}","Maximum dimensions are 56cm x 36cm x 23cm (22in x 14in x 9in)","Size restrictions"
"19","How many bags can I check in for free?","en","baggage","departure","{}","This depends on your airline and ticket class; economy typically allows 1-2 bags","Varies by airline"
"20","Are duty-free items included in cabin baggage allowance?","en","baggage","departure","{""item"":""duty-free""}","Duty-free purchases are usually allowed in addition to your cabin baggage allowance","Shopping exception"
"21","Can I carry food items in my checked baggage?","en","baggage","departure","{""item"":""food""}","Most non-liquid food items are allowed; check destination country restrictions for fresh produce","Varies by destination"
"22","What if my baggage exceeds size restrictions?","en","baggage","departure","{}","Oversized baggage must be checked and may incur additional fees","Size violations"
"23","Is there a separate queue for baggage drop?","en","baggage","departure","{}","Some airlines offer dedicated baggage drop counters for passengers who checked in online","Fast track option"
"24","Can I carry electronics in checked baggage?","en","baggage","departure","{""item"":""electronics""}","It's recommended to carry valuable electronics in cabin baggage to prevent damage or theft","Safety recommendation"
"25","What items must be declared at baggage check-in?","en","baggage","departure","{}","Declare valuable items, fragile goods, lithium batteries, and any restricted items","Declaration requirements"
"26","Are there storage facilities for oversized baggage?","en","baggage","departure","{}","Oversized baggage is handled at special counters; contact your airline for specific procedures","Special handling"
"27","Can I add baggage allowance after online check-in?","en","baggage","departure","{}","Yes, you can purchase additional allowance at the airport counter before baggage drop","Post check-in purchase"
"28","What is not allowed in cabin baggage?","en","baggage","departure","{}","Sharp objects, tools, liquids over 100ml, and sporting goods are not allowed in cabin","Security restrictions"
"29","How do I report damaged baggage?","en","baggage","departure","{}","Report damaged baggage immediately at the airline's baggage service counter before leaving the airport","Damage claims"
"30","Can I carry my wedding dress as cabin baggage?","en","baggage","departure","{""item"":""wedding dress""}","Wedding dresses can be carried as cabin baggage if they fit in overhead bins or you can request a garment bag","Special occasion"
"31","Are there lockers to store baggage temporarily?","en","baggage","departure","{}","Temporary baggage storage lockers are available in the departure hall for a fee","Storage option"
"32","What documents do I need for baggage check-in?","en","baggage","departure","{}","You need your boarding pass and valid ID/passport for baggage check-in","Required documents"
"33","Can I split my baggage allowance between bags?","en","baggage","departure","{}","Yes, you can distribute your total weight allowance across multiple bags as long as each doesn't exceed individual bag limits","Weight distribution"
"34","Are fragile items allowed in checked baggage?","en","baggage","departure","{""item"":""fragile""}","Fragile items can be checked but should be properly packed; it's recommended to carry valuables in cabin","Risk advisory"
"35","What is the baggage allowance for students?","en","baggage","departure","{""passenger_type"":""student""}","Some airlines offer additional baggage allowance for students; check with your airline for specific policies","Special category"
"36","Can I carry medicines in cabin baggage?","en","baggage","departure","{""item"":""medicines""}","Yes, prescription medicines are allowed in cabin baggage with proper documentation","Medical exception"
"37","How strict are airlines about cabin baggage weight?","en","baggage","departure","{}","Most airlines strictly enforce the 7kg limit, especially during peak seasons","Enforcement level"
"38","Can I check in pet carriers as baggage?","en","baggage","departure","{""item"":""pet carrier""}","Small pets in approved carriers may be allowed in cabin; larger pets must travel as checked baggage or cargo","Pet travel"
"39","What should I remove before checking my bag?","en","baggage","departure","{}","Remove all valuables, documents, keys, medicines, electronics, and perishables","Pre-check preparation"
"40","Are camping equipment and tents allowed?","en","baggage","departure","{""item"":""camping equipment""}","Camping equipment is allowed in checked baggage; sharp items like knives must be properly packed","Outdoor gear"
"41","Can I carry baby food in cabin baggage?","en","baggage","departure","{""item"":""baby food""}","Baby food and milk are exempt from liquid restrictions for passengers traveling with infants","Family exception"
"42","What happens if I don't collect my baggage tag?","en","baggage","departure","{}","The baggage tag is essential for claiming your luggage; report immediately if you lose it","Important document"
"43","Are there weight restrictions for premium economy?","en","baggage","departure","{""class"":""premium economy""}","Premium economy passengers typically get 25kg checked baggage allowance","Mid-tier class"
"44","Can I consolidate baggage with other passengers?","en","baggage","departure","{}","Baggage pooling depends on airline policy; some allow it for passengers on same booking","Group travel"
"45","What packaging is recommended for checked bags?","en","baggage","departure","{}","Use hard-shell suitcases for fragile items, secure all zippers, and use TSA locks","Packing advice"
"46","Are batteries allowed in checked luggage?","en","baggage","departure","{""item"":""batteries""}","Spare lithium batteries must be in cabin baggage; installed batteries in devices can be checked","Battery rules"
"47","Can I change my baggage allowance after booking?","en","baggage","departure","{}","Yes, you can purchase additional allowance online before check-in or at the airport counter","Post-booking changes"
"48","What is the liability limit for lost baggage?","en","baggage","departure","{}","Airlines' liability is limited to approximately USD 1,500-2,000 per passenger for international flights","Compensation limits"
"49","Are there any color-coded baggage tags?","en","baggage","departure","{}","Airlines use color-coded tags to identify destination and routing; priority tags may be different colors","Tag system"
"50","Can I carry Christmas decorations in checked baggage?","en","baggage","departure","{""item"":""decorations""}","Non-fragile decorations are allowed; avoid glass ornaments or properly pack them to prevent breakage","Seasonal items"
"51","I'm traveling with my elderly mother, can we get assistance with baggage?","en","baggage","departure","{""passenger"":""elderly""}","Yes, Islamabad International Airport provides comprehensive assistance services for elderly passengers and their baggage. You can request wheelchair and porter services free of charge at the check-in counter. Our trained staff will assist your mother from the check-in area all the way through security screening, and they will also help carry and manage your baggage throughout the process. The porter service includes loading bags onto the check-in belt, accompanying you to the security area, and ensuring all your belongings are properly handled. For the smoothest experience, inform the airline staff about your assistance needs when you first arrive at the check-in counter, and they will arrange immediate support. If you need a wheelchair, these are available at the entrance and throughout the terminal.","Elderly assistance"
"52","What if my connecting flight is with a different airline?","en","baggage","departure","{""flight_type"":""connecting""}","When you have connecting flights with different airlines at Islamabad International Airport, you will need to collect your checked baggage from the first flight's baggage claim area and then re-check it with your second airline at their designated check-in counter. This is standard procedure for inter-airline connections because each airline has separate baggage handling systems and liability. Before your first flight departs, confirm the complete transfer procedure with your initial airline's check-in staff, as they can provide specific guidance about timing and which counter to use for your connecting airline. Make sure to allow sufficient time between flights - we recommend at least 3-4 hours for domestic connections and 4-5 hours for international connections when switching airlines. Keep your baggage claim tags from both flights safe, and ensure your connecting flight boarding pass is ready when you re-check your bags.","Different airline transfer"
"53","Can I take dried fruits and nuts in my hand luggage?","en","baggage","departure","{""item"":""dried fruits""}","Yes, you can absolutely carry dried fruits, nuts, seeds, and other packaged snacks in your hand luggage without any quantity restrictions or special permissions required. These items are not classified as liquids or restricted goods, so they pass through security screening without issues. For convenience and to speed up security checks, it's best to keep these food items in their original sealed packaging or place them in clear, transparent plastic bags or containers. This makes it easier for security personnel to identify the contents quickly during X-ray screening. Popular items like almonds, cashews, pistachios, dried apricots, dates, raisins, and trail mixes are commonly carried by passengers and are perfectly acceptable. However, avoid carrying items with excessive moisture or those that might leak, as these could cause inconvenience during your flight.","Snacks allowed"
"54","My flight is delayed by 5 hours, where can I store my baggage?","en","baggage","departure","{""issue"":""delayed flight""}","For significant flight delays, Islamabad International Airport offers left luggage storage facilities located near the main entrance of the departure hall, making it convenient for passengers who want to move around freely without carrying heavy bags. The storage service operates 24/7 and charges approximately PKR 300-500 per bag per day, depending on the size and weight of your luggage. This facility is secure, monitored by CCTV cameras, and staffed by trained personnel who will provide you with a claim ticket that you must present when retrieving your bags. Alternatively, you should check with your airline at their customer service desk, as many airlines offer complimentary temporary baggage storage for passengers affected by significant delays, especially if the delay is due to the airline's operational issues. When using any storage service, make sure to remove valuable items, important documents, medications, and electronic devices from your checked bags and keep them with you.","Delay storage"
"55","Is there a machine to print baggage tags myself?","en","baggage","departure","{""service"":""tag printing""}","No, Islamabad International Airport does not currently have self-service baggage tag printing kiosks available for passenger use. All baggage tags must be printed and attached by authorized airline staff at the check-in counters to ensure proper routing, weight compliance, and security protocols are followed. This system is in place because baggage tags contain specific barcodes and routing information that must be accurately entered into the airline's baggage handling system, and they must be securely attached to prevent loss or misplacement during transit. The airline staff are trained to print tags with correct destination codes, flight numbers, and handling instructions, and they verify that the tag matches your boarding pass and identification before attaching it to your luggage. After your bag is tagged, you'll receive a baggage claim receipt that you should keep safe until you collect your luggage at your destination.","Tag service"
"56","Can I carry my Quran and prayer beads in hand luggage?","en","baggage","departure","{""item"":""religious items""}","Yes, religious items including the Holy Quran, prayer beads (tasbih), prayer mats (janamaz), Islamic books, and other religious articles are completely allowed in both cabin baggage and checked luggage at Islamabad International Airport and all Pakistani airports. These items are considered personal religious materials and are respected and accommodated under airport security regulations. You can carry your Quran in any format - whether it's a physical book, a digital copy on your tablet or phone, or even audio recordings. Prayer beads of any material including wood, stone, or plastic are permitted without restriction. If you're carrying a prayer mat, the folding type fits easily in cabin baggage, or you can place it in checked luggage. Many Muslim passengers also carry small bottles of zamzam water, attar (fragrance), or miswak, and these are generally allowed following standard liquid restrictions for cabin baggage.","Religious items"
"57","I need to carry baby milk powder for my infant, is that allowed?","en","baggage","departure","{""item"":""baby milk powder""}","Yes, baby milk formula powder, infant food, and related feeding supplies are fully permitted in cabin baggage in reasonable quantities necessary for your infant's needs during the journey. Pakistani airport security makes special accommodations for traveling parents with babies, understanding that infant nutrition is essential and time-sensitive. You can carry enough formula to last your entire trip, including extra portions for potential delays. Unlike regular powder restrictions which apply to adult passengers on some international routes, baby formula is exempt from powder quantity limits when traveling with an infant. It's helpful to keep the formula in its original branded container with labels visible, as this speeds up security screening. Along with formula powder, you're also allowed to carry pre-made liquid formula, baby food jars, breast milk, and sterilized water in quantities exceeding the normal 100ml liquid limit for cabin baggage.","Baby feeding items"
"58","My suitcase wheel is broken, will the airline accept it?","en","baggage","departure","{""issue"":""damaged luggage""}","Yes, airlines at Islamabad International Airport will accept luggage with broken wheels or other external damage for check-in, as the primary concern is the contents being properly secured rather than the cosmetic condition of the bag itself. However, it's strongly recommended that you get your damaged luggage wrapped at the professional wrapping service located near the check-in counters, which costs approximately PKR 200-300 per bag. Wrapping provides several benefits: it prevents further damage during baggage handling, keeps broken parts from catching on conveyor belts, protects the bag's contents from exposure if the damage worsens, and prevents items from falling out through damaged areas. The wrapping service uses industrial-grade plastic wrap that's specifically designed for luggage protection. If your wheel is completely detached, inform the check-in staff so they can add a 'fragile' or 'handle with care' tag to your bag.","Damaged bag acceptance"
"59","Can I bring my traditional hookah in checked baggage?","en","baggage","departure","{""item"":""hookah""}","Yes, traditional hookahs (sheesha/huqqa) are permitted in checked baggage at Pakistani airports, as they are recognized cultural items that many travelers transport between cities or take as gifts abroad. However, there are important preparation requirements you must follow. The hookah must be completely clean with absolutely no tobacco residue remaining - clean all chambers, hoses, and the bowl thoroughly before packing. Tobacco, flavored molasses, or charcoal for hookah use cannot be carried in cabin baggage and have restrictions in checked baggage too, so verify specific airline policies. Pack your hookah carefully with adequate cushioning to prevent the glass base from breaking during handling - bubble wrap, foam, or thick clothing works well for padding. If the hookah has multiple parts, consider packing them separately and securing loose components so they don't move around and cause damage.","Traditional items"
"60","Is there a special counter for families with small children?","en","baggage","departure","{""passenger"":""family""}","Yes, Islamabad International Airport has dedicated family check-in lanes specifically designed for passengers traveling with young children and infants, located at counters 15-18 in the main departure hall. These priority lanes are clearly marked with family signage and are designed to make the check-in process faster and less stressful for parents managing children and luggage simultaneously. The family lanes typically have shorter queues and the staff working these counters are trained to assist with family-specific needs such as checking strollers, car seats, and extra baby equipment. When you arrive at the airport, look for the signage indicating family lanes or ask any airport staff member to direct you to the appropriate counters. Besides check-in, the airport also has family-friendly facilities throughout the terminal including baby changing rooms, nursing rooms for mothers, children's play areas, and family restrooms.","Family services"
"61","I forgot to remove my laptop during security screening, what happens?","en","baggage","departure","{""item"":""laptop""}","If you forget to remove your laptop during security screening, the security personnel will politely ask you to return and resubmit your bag for scanning with the laptop placed separately in a dedicated screening tray. This is standard security protocol at all airports including Islamabad International Airport, as laptops and other large electronic devices need individual X-ray examination to ensure they don't contain prohibited items or pose security threats. The screening process requires laptops, tablets larger than phone size, and sometimes even large power banks to be removed from bags and placed flat in separate trays so the X-ray machine can clearly image all internal components. This delay is minor but can cause queues behind you, so it's best to prepare before reaching the conveyor belt. Take out your laptop while waiting in line and have it ready in your hands or an easily accessible pocket of your carry-on. The same rule applies to cameras, portable DVD players, and gaming consoles. Remember to collect all your items after screening, including the laptop tray and your main bag.","Security procedure"
"62","Can I carry blood pressure medicine without a prescription?","en","baggage","departure","{""item"":""medication""}","While it's technically possible to carry common medications including blood pressure tablets without a prescription at Pakistani airports, having proper documentation is strongly recommended for several important reasons. Airport security and customs officials may ask about medications, especially if carrying large quantities or controlled substances, and a prescription serves as immediate proof that these are legitimate medical supplies for personal use. Keep medicines in their original pharmacy packaging with labels showing your name, medication name, dosage, and prescribing doctor - this is the best form of documentation. If you've lost the original packaging, carrying a doctor's letter or prescription photocopy is very helpful. For blood pressure medication specifically, which is usually not a controlled substance, you're unlikely to face issues, but documentation prevents any potential delays or questions at security or customs. The prescription is particularly important for international travel, as different countries have varying regulations about importing medications. Carry a sufficient supply for your trip plus a few extra days in case of delays, and always keep essential medications in your cabin baggage rather than checked luggage.","Medication policy"
"63","My bag's zipper broke, what should I do before check-in?","en","baggage","departure","{""issue"":""broken zip""}","If your bag's zipper breaks before check-in, you have several immediate options to handle the situation at Islamabad International Airport. The best solution is to use the professional baggage wrapping service located near the check-in counters in the departure hall, which costs PKR 200-300 per bag. This industrial-strength plastic wrapping will completely secure your bag, preventing it from opening during transit and protecting your belongings even with a broken zipper. The wrapping also adds an extra layer of security against tampering and weather exposure. Alternatively, if you have a spare bag or an empty suitcase, you can transfer your contents to the intact luggage - though this might be time-consuming if you're running late. Some passengers use luggage straps or belts to secure broken zippers, which can work for minor zip issues but isn't reliable for completely non-functional zippers. Airport shops sometimes sell basic duffel bags or travel bags if you need an emergency replacement. Whatever solution you choose, don't attempt to check in a bag that's likely to open during handling, as this violates baggage safety regulations and risks losing your belongings.","Zipper issue"
