"id","query","language","intent","terminal","entities","expected_response","notes"
"160","Is perfume allowed in cabin baggage or must it be checked? Please advise.","en","baggage","departure","{""passenger"":""family""}","Yes, Islamabad International Airport has dedicated family check-in lanes specifically designed for passengers traveling with young children and infants, located at counters 15-18 in the main departure hall. These priority lanes are clearly marked with family signage and are designed to make the check-in process faster and less stressful for parents managing children and luggage simultaneously. The family lanes typically have shorter queues and the staff working these counters are trained to assist with family-specific needs such as checking strollers, car seats, and extra baby equipment. When you arrive at the airport, look for the signage indicating family lanes or ask any airport staff member to direct you to the appropriate counters. Besides check-in, the airport also has family-friendly facilities throughout the terminal including baby changing rooms, nursing rooms for mothers, children's play areas, and family restrooms.","Family services | Auto-generated"
"161","Please tell me: can i purchase extra allowance for laptop online or at the airport?","en","baggage","departure","{""item"":""laptop""}","If you forget to remove your laptop during security screening, the security personnel will politely ask you to return and resubmit your bag for scanning with the laptop placed separately in a dedicated screening tray. This is standard security protocol at all airports including Islamabad International Airport, as laptops and other large electronic devices need individual X-ray examination to ensure they don't contain prohibited items or pose security threats. The screening process requires laptops, tablets larger than phone size, and sometimes even large power banks to be removed from bags and placed flat in separate trays so the X-ray machine can clearly image all internal components. This delay is minor but can cause queues behind you, so it's best to prepare before reaching the conveyor belt. Take out your laptop while waiting in line and have it ready in your hands or an easily accessible pocket of your carry-on. The same rule applies to cameras, portable DVD players, and gaming consoles. Remember to collect all your items after screening, including the laptop tray and your main bag.","Security procedure | Auto-generated"
"162","Hi, If my medication is overweight, what are the next steps?","en","baggage","departure","{""item"":""medication""}","While it's technically possible to carry common medications including blood pressure tablets without a prescription at Pakistani airports, having proper documentation is strongly recommended for several important reasons. Airport security and customs officials may ask about medications, especially if carrying large quantities or controlled substances, and a prescription serves as immediate proof that these are legitimate medical supplies for personal use. Keep medicines in their original pharmacy packaging with labels showing your name, medication name, dosage, and prescribing doctor - this is the best form of documentation. If you've lost the original packaging, carrying a doctor's letter or prescription photocopy is very helpful. For blood pressure medication specifically, which is usually not a controlled substance, you're unlikely to face issues, but documentation prevents any potential delays or questions at security or customs. The prescription is particularly important for international travel, as different countries have varying regulations about importing medications. Carry a sufficient supply for your trip plus a few extra days in case of delays, and always keep essential medications in your cabin baggage rather than checked luggage.","Medication policy | Auto-generated"
"163","If my telescope is overweight, what are the next steps?","en","baggage","departure","{""issue"":""broken zip""}","If your bag's zipper breaks before check-in, you have several immediate options to handle the situation at Islamabad International Airport. The best solution is to use the professional baggage wrapping service located near the check-in counters in the departure hall, which costs PKR 200-300 per bag. This industrial-strength plastic wrapping will completely secure your bag, preventing it from opening during transit and protecting your belongings even with a broken zipper. The wrapping also adds an extra layer of security against tampering and weather exposure. Alternatively, if you have a spare bag or an empty suitcase, you can transfer your contents to the intact luggage - though this might be time-consuming if you're running late. Some passengers use luggage straps or belts to secure broken zippers, which can work for minor zip issues but isn't reliable for completely non-functional zippers. Airport shops sometimes sell basic duffel bags or travel bags if you need an emergency replacement. Whatever solution you choose, don't attempt to check in a bag that's likely to open during handling, as this violates baggage safety regulations and risks losing your belongings.","Zipper issue | Auto-generated"
"164","If my telescope is overweight, what are the next steps? [64]","en","baggage","departure","{""service"":""trolley""}","Free luggage trolleys are readily available throughout Islamabad International Airport at multiple convenient locations to help passengers transport their baggage easily. You'll find trolley bays at the main terminal entrance where passengers first arrive, in the parking area near the drop-off zones, throughout the departure hall near check-in counters, and in the arrival area near baggage claim belts. The trolleys are designed to hold multiple bags and are free to use without requiring any deposit or coins, unlike some international airports. To locate the nearest trolley bay, look for signage or ask any airport staff member wearing a uniform or information desk personnel. After using a trolley, you're encouraged to return it to designated collection areas to keep walkways clear and ensure availability for other passengers. If you're unable to find an available trolley during peak times, airport porter services are also available for a small fee to assist with carrying luggage. The trolleys are regularly maintained and cleaned, though occasionally wheels might be stiff or squeaky - if you encounter a faulty trolley, simply exchange it for another one from the bay.","Trolley location | Auto-generated"
"165","What are the packing recommendations for shawls? Please advise.","en","baggage","departure","{""item"":""shawls""}","Yes, you can absolutely carry Pakistani embroidered shawls, traditional textiles, and fabric items in your hand luggage without any restrictions. Items like pashmina shawls, silk dupattas, embroidered suits, handwoven fabrics, and other textile products are perfectly acceptable in cabin baggage and are actually ideal carry-on items because they're lightweight, don't take much space when folded, and won't be damaged by the pressure or handling that checked luggage endures. Many passengers prefer keeping valuable or delicate embroidered items in cabin baggage to prevent crushing, soiling, or potential loss that might occur in checked bags. Traditional Pakistani handicrafts including embroidered shawls from Swat, Kashmiri shawls, Multani khes, Sindhi ajrak, and Balochi needlework are commonly transported by travelers as personal items or gifts. If you're carrying multiple shawls or larger quantities of fabric, security might briefly inspect them to ensure nothing is concealed within the folds, but this is a quick visual check. For international travel, textile gifts are generally duty-free for personal use, though commercial quantities might face customs questions at your destination.","Cultural items | Auto-generated"
"166","If my laptop is overweight, what are the next steps?","en","baggage","departure","{""flight_type"":""international""}","For Emirates flights departing from Islamabad International Airport to Dubai, the standard cabin baggage allowance is 7 kilograms for Economy Class passengers, though this can vary based on your specific ticket type and frequent flyer status. Business and First Class passengers typically have higher allowances, often up to 14 kilograms across two pieces. The cabin bag dimensions must not exceed 55cm x 38cm x 20cm to fit in overhead compartments or under the seat in front of you. In addition to your main cabin bag, Emirates allows one personal item such as a laptop bag, handbag, or small backpack, which generally isn't weighed separately if it's reasonably sized. However, it's crucial to verify your specific allowance on your Emirates ticket booking or by calling Emirates customer service, as allowances can differ for special fare types, codeshare flights, or if you've purchased extra baggage options. Check-in staff at the airport will weigh cabin bags if they appear oversized, and excess weight can result in being required to check the bag with applicable fees. To be safe, pack a lightweight cabin bag and keep heavier items in checked luggage.","International query | Auto-generated"
"167","How early should I get to the airport to drop off telescope — can you confirm?","en","baggage","departure","{""issue"":""oversized""}","Airlines at Islamabad International Airport may show some flexibility for cabin baggage that's slightly oversized by an inch or two, but this is entirely at the discretion of the check-in staff and gate agents, and there's no guarantee your bag will be accepted. The official size restrictions exist because overhead compartments and under-seat spaces in aircraft have fixed dimensions, and bags exceeding these measurements genuinely cannot fit safely. If your bag is only marginally larger - especially if it's a soft-sided bag that can compress when placed in the sizing frame - you may be allowed to proceed, particularly if the flight isn't fully booked and overhead bin space is available. However, during busy flights or with strict airline policies, even slightly oversized bags will be required to be checked at the gate or counter, often incurring additional fees. Hard-shell cases have no flexibility, so if they exceed dimensions, they must be checked. To avoid last-minute stress, if you know your bag is borderline, consider checking it voluntarily at the counter rather than risking gate-checking, as voluntary check-in is often free while gate-checking might have fees.","Size flexibility | Auto-generated"
"168","What is the domestic flights allowance for passengers — can you confirm?","en","baggage","departure","{""item"":""pickles""}","Yes, you can pack homemade mango pickle (achaar) and other traditional Pakistani pickles in your checked luggage, as these are food items allowed in checked baggage both for domestic and international flights from Pakistan. Homemade pickles are a popular item for travelers to carry between cities or take abroad as gifts or personal supplies. To pack pickles safely, use plastic containers or jars rather than glass, as glass can break during baggage handling, creating a mess and potentially damaging other bags. Make sure containers are completely sealed and leak-proof - double-bag them in plastic bags as an extra precaution, because pickle oil can seep through weak seals and stain clothing and other items in your suitcase. If you must use glass jars, wrap them very carefully in bubble wrap, towels, or clothing for cushioning, and place them in the center of your bag surrounded by soft items. For international travel, check your destination country's customs regulations regarding bringing in food products, as some countries restrict agricultural imports including pickles, oils, and preserved foods. Generally, small quantities for personal consumption are acceptable, but commercial quantities may face restrictions or require declaration.","Homemade food | Auto-generated"
"169","Hi, If my medical equipment is overweight, what are the next steps?","en","baggage","departure","{""item"":""medical equipment""}","No, wheelchairs, mobility scooters, walkers, crutches, canes, and other mobility aids do not count toward your baggage allowance at Islamabad International Airport or on any airline operating from Pakistan. These assistive devices are transported completely free of charge regardless of size or weight, as they're classified as essential medical equipment under international aviation regulations. When you arrive at the airport, inform the check-in staff about your wheelchair so they can make appropriate arrangements - you can use your personal wheelchair throughout the terminal until reaching the aircraft door, where it will be tagged and stored in the aircraft hold. The airline will return your wheelchair to you at the aircraft door upon arrival, or you can request to have it delivered to the baggage claim area. If your wheelchair is battery-powered, special procedures apply depending on battery type - inform the airline in advance as lithium batteries require specific handling and documentation. Airlines provide manual wheelchairs free of charge if you need assistance moving through the airport. Besides wheelchairs, prosthetic limbs, portable oxygen concentrators (with prior approval), and other medical devices also travel free and don't affect your baggage allowance.","Medical equipment | Auto-generated"
"170","How much oversize fee will I pay for telescope?","en","baggage","departure","{}","No, the passenger whose name is on the ticket must be physically present at the check-in counter with valid identification and boarding pass to check in baggage. This is a strict security regulation at all Pakistani airports including Islamabad International Airport, enforced to prevent unauthorized persons from checking bags and to ensure that the person responsible for the baggage contents is identified. Family members can certainly assist with carrying or pushing luggage to the counter, but the actual ticket holder must appear in person, present their ID (CNIC for domestic, passport for international), and confirm they packed their own bags when asked security questions by check-in staff. This rule exists because the passenger is legally and personally responsible for everything in their checked baggage, and staff need to verify identity and ask mandatory security questions directly to the traveler. If your wife is elsewhere in the airport, she needs to come to the check-in counter to complete the process. Airlines cannot accept baggage from anyone other than the ticketed passenger, even immediate family members, due to aviation security regulations.","Check-in presence | Auto-generated"
"171","Hi, If my sports equipment is overweight, what are the next steps?","en","baggage","departure","{""item"":""sports equipment""}","No special documents or permits are required to carry cricket equipment as checked baggage at Islamabad International Airport - you only need your regular boarding pass and identification. Cricket bats, pads, helmets, gloves, stumps, and other cricket gear are commonly transported by passengers, especially on domestic Pakistani routes where the sport is extremely popular, and airlines are very familiar with handling such equipment. Your cricket kit will count toward your regular checked baggage weight allowance, so if your gear is heavy and you're concerned about exceeding limits, you might want to distribute items between multiple bags or be prepared to pay excess baggage fees. Cricket bats must be in checked luggage and cannot be carried in cabin baggage due to their potential use as a weapon - security will stop you if you attempt to bring them through the security checkpoint in hand luggage. For international travel, cricket equipment typically doesn't face import restrictions at most destinations, though it's wise to check if you're traveling to countries unfamiliar with the sport. If you're carrying valuable signed bats or specialized equipment, consider getting additional insurance coverage as airline liability for checked baggage is limited.","Sports documents | Auto-generated"
"172","If my sewing machine is overweight, what are the next steps? Please advise.","en","baggage","departure","{""item"":""sewing machine""}","Yes, you can check in a sewing machine as baggage at Islamabad International Airport, as household items and appliances are generally permitted in checked luggage provided they're properly packed and fall within size and weight restrictions. Sewing machines, whether traditional foot-pedal models or modern electric ones, are common items transported by passengers moving between cities, sending to relatives, or taking abroad. Before packing, remove the power cord if it's an electric model and pack it separately or wrap it securely around the machine, ensuring no loose parts can move around during transit. Remove or secure the needle, as loose needles can cause injury to baggage handlers. Pack the machine in its original box if available, or use a sturdy cardboard box or hard-shell suitcase with plenty of cushioning material like bubble wrap, foam, or thick clothing to prevent damage from impact during handling. The machine will count toward your checked baggage weight allowance - sewing machines can be heavy, so verify your weight limit and be prepared for excess fees if you exceed it. If the sewing machine is particularly valuable or antique, take photos before packing as documentation for insurance purposes, though airline liability for checked items is limited.","Household appliances | Auto-generated"
"173","Who should I contact if my hookah is damaged during handling? [73]","en","baggage","departure","{""issue"":""late check-in""}","You are cutting it extremely close to the baggage check-in deadline, and whether you can check baggage depends on your flight type and airline. For domestic flights within Pakistan, baggage check-in typically closes 45 minutes before departure, while international flights close 60 minutes before departure. With only 40 minutes until boarding time, you're likely past the deadline for international flights and right at the limit for domestic flights. Rush immediately to the check-in counter and explain your situation - some airlines may make exceptions if the queue isn't long and your documentation is ready, but they're not obligated to accept late baggage as it risks missing the flight's baggage loading deadline. If check-in has officially closed, you'll be offered the option to fly with cabin baggage only if your bags meet size limits, or you may need to rebook on a later flight. To avoid this situation, airports recommend arriving 3 hours early for international flights and 2 hours for domestic flights. The check-in deadline exists because checked bags must go through security screening, be transported to the aircraft, loaded in the cargo hold, and all documentation processed - this sequence requires time that can't be compressed.","Urgent timing | Auto-generated"
"174","What is the domestic flights allowance for passengers — can you confirm? [74]","en","baggage","departure","{""item"":""honey""}","Honey is classified as a liquid substance for aviation security purposes, so it must follow liquid restrictions depending on whether you're carrying it in checked or cabin baggage. For checked luggage, you can pack honey in any quantity without restrictions - it's perfectly acceptable to carry multiple jars or bottles in your checked bag. However, make sure containers are tightly sealed and leak-proof, and wrap them in plastic bags as a precaution, because honey can make a very sticky mess if containers crack or leak during handling. For cabin baggage, honey follows the 100ml liquid rule - you can only carry containers of 100ml or less, and they must be placed in a clear, resealable plastic bag along with other liquids like shampoo and lotion, with the total not exceeding 1 liter. Most passengers prefer to pack honey in checked baggage to avoid these restrictions and because honey bottles are often larger than 100ml. If you're traveling domestically within Pakistan, these rules apply but enforcement may be more relaxed. For international travel, be aware that some countries have agricultural import restrictions on honey due to disease concerns, so check your destination's customs regulations.","Liquid honey rules | Auto-generated"
"175","Please tell me: are there special counters for infants at check-in?","en","baggage","departure","{""item"":""telescope""}","Whether your telescope can go in the overhead bin as cabin baggage depends primarily on its size - it must fit within the standard cabin baggage dimensions of approximately 56cm x 45cm x 25cm (these exact measurements vary slightly by airline). Small portable telescopes, particularly refracting telescopes in compact carrying cases, often meet these requirements and can be carried in the cabin, which is actually preferable for expensive or delicate optical equipment. However, larger reflecting telescopes, dobsonian mounted scopes, or telescopes with extended tube lengths will exceed cabin size limits and must be checked as cargo. If your telescope is cabin-size but valuable, carry it on board to prevent potential damage from checked baggage handling - optical instruments are fragile and can be misaligned by impacts. Consider using a well-padded carrying case designed for telescopes, preferably a hard case for maximum protection. If you must check a larger telescope, pack it extremely carefully with foam padding, mark it as fragile, and consider purchasing additional insurance as airline liability for damaged items is limited. Remove or secure any loose parts like eyepieces, finder scopes, and mounting hardware separately.","Optical gear | Auto-generated"
"176","If my cricket bat is overweight, what are the next steps — can you confirm?","en","baggage","departure","{}","Yes, if your bag weighs exactly 23 kilograms, it will be accepted without any excess baggage charges, as 23kg is the standard checked baggage weight limit for economy class on most airlines. The weighing scales at check-in counters are calibrated and accurate, and you're fortunate to be precisely at the limit. However, be aware that even exceeding the limit by 0.5kg or 1kg can result in excess baggage fees, which vary by airline but typically start around PKR 500-800 per kilogram for domestic flights and USD 15-30 per kilogram for international flights. If during weighing your bag shows 23.2kg or similar minimal excess, you might politely request the check-in agent's discretion, though they're not obligated to waive charges. To avoid excess fees if you're borderline, wear your heaviest items like boots or jacket rather than packing them, or shift some items to your cabin baggage if there's space available within its 7kg limit. Each airline's policy differs - some strictly enforce weight limits while others show flexibility for minor overages, particularly for premium class passengers or frequent flyers. Always pack with a margin below the limit to account for scale variations.","Exact weight | Auto-generated"
"177","Please tell me: is sweets allowed in cabin baggage or must it be checked?","en","baggage","departure","{""item"":""sweets""}","Yes, you can absolutely bring traditional Pakistani sweets like Karachi's famous sohan halwa, Multani sohan halwa, Hafiz's sweets, or any other local mithai in both your checked baggage and cabin baggage. Traditional sweets are among the most commonly transported items by Pakistani travelers visiting family or friends in other cities or abroad, and airports are very familiar with passengers carrying these food gifts. Sohan halwa and similar dry sweets are not considered liquids, so they don't face the liquid restrictions that apply to items like syrup-based sweets. For checked baggage, pack sweets in their original boxes or secure containers to prevent crushing - place them between clothing or in rigid boxes for protection. For cabin baggage, sweets are allowed but keep them accessible as security might want to visually inspect the packaging to confirm contents. The main concern is packaging - avoid anything that could leak or become messy, and if carrying items with syrup or moisture, seal them in plastic bags. For international travel, packaged commercial sweets from recognized sweet shops are generally preferred over homemade items, as they appear more legitimate to customs officials. Most countries allow small quantities of packaged sweets for personal consumption without issues.","Local sweets | Auto-generated"
