"id","query","language","intent","terminal","entities","expected_response","notes"
"99","I'm connecting from Islamabad to Peshawar, will my bag go directly?","en","baggage","departure","{""flight_type"":""domestic connection""}","For connecting domestic flights within Pakistan on the same airline, your checked baggage is typically checked through directly to your final destination (Peshawar), meaning you won't need to collect it at Islamabad and re-check it. When you check in at your origin city, inform the check-in agent that you have a connecting flight and provide both flight details - they will tag your bag with routing labels to Peshawar via Islamabad. You'll receive baggage claim tags and the staff should confirm that your bag is checked through to your final destination. However, it's essential to confirm this explicitly at check-in, as not all domestic connections are set up for through-checked baggage, especially if flights are on different airlines or have long layovers. If your connection is with a different airline, you'll likely need to collect baggage in Islamabad and re-check it with the second airline. For same-airline connections, ensure your layover time is sufficient (at least 2-3 hours recommended) in case your first flight is delayed and you need to catch up with your connecting flight. If your first flight is significantly delayed and you miss your connection, the airline will rebook you and your bag will be rerouted to your next available flight - your baggage tags allow tracking throughout this process.","Domestic transfer"
"100","Can I carry green tea and herbal chai in my hand luggage?","en","baggage","departure","{""item"":""tea""}","Yes, you can carry green tea, herbal chai, black tea, traditional Kashmiri kahwa, and other tea products in your hand luggage without any restrictions at Islamabad International Airport. Tea in its dry form - whether loose tea leaves, tea bags, tea powder, or dried herbs - is not classified as a liquid or restricted substance, so standard baggage rules apply. These items pass through security screening easily and are commonly carried by Pakistani travelers who want their preferred tea brands or traditional varieties that might not be available at their destination. Keep tea in its original packaging when possible, as branded packaging makes identification quick during security screening. If you're carrying loose tea or have transferred it to containers, use clear or transparent packaging so security personnel can visually inspect the contents if needed. Popular items like green tea bags, Tapal Danedar, Lipton tea bags, herbal infusions, and medicinal teas like senna or chamomile are all acceptable. The quantity you can carry is not specifically restricted as long as it fits within your cabin baggage weight limit (typically 7kg). For international travel, be aware that some countries have agricultural restrictions on plant materials including tea, though commercial packaged tea from recognized brands rarely faces issues. Traditional Pakistani chai with mixed spices is also allowed as long as the spices are pre-packaged.","Tea products"
"101","Is camera allowed in cabin baggage or must it be checked — can you confirm?","en","baggage","departure","{}","Economy class passengers are allowed 20kg checked baggage and 7kg cabin baggage","Common query | Auto-generated"
"102","Please tell me: where can i find the left-luggage in the departure hall?","en","baggage","departure","{}","Excess baggage costs PKR 800 per kg for domestic flights and USD 15 per kg for international flights","Pricing query | Auto-generated"
"103","Who should I contact if my baby formula is damaged during handling? Please advise.","en","baggage","departure","{}","Yes, you can carry one laptop bag or handbag in addition to your cabin baggage","Cabin baggage rules | Auto-generated"
"104","How early should I get to the airport to drop off laptop — can you confirm?","en","baggage","departure","{}","Prohibited items include lithium batteries, power banks, lighters, sharp objects, and flammable materials","Safety regulations | Auto-generated"
"105","Hi, What is the domestic flights allowance for passengers?","en","baggage","departure","{}","Cabin baggage must not exceed 7kg and dimensions should be 56cm x 36cm x 23cm","Standard IATA limits | Auto-generated"
"106","Please tell me: what is the economy class allowance for passengers?","en","baggage","departure","{}","Baggage drop-off counters are located at your airline's check-in area in the departure hall","Location query | Auto-generated"
"107","If my perfume is overweight, what are the next steps?","en","baggage","departure","{}","Yes, you can purchase additional baggage allowance at the check-in counter subject to availability","Last-minute purchase | Auto-generated"
"108","Please tell me: are there special counters for infant at check-in?","en","baggage","departure","{""passenger_type"":""infant""}","Infants are allowed 10kg checked baggage plus one collapsible stroller or car seat","Family travel | Auto-generated"
"109","What is the domestic flights allowance for passengers? Please advise.","en","baggage","departure","{""item"":""musical instrument""}","Small musical instruments that fit in overhead bins are allowed; larger ones must be checked or require an extra seat","Special items | Auto-generated"
"110","Can I purchase extra allowance for cricket bat online or at the airport — can you confirm?","en","baggage","departure","{}","Arrive at least 3 hours before international flights and 2 hours before domestic flights","Time recommendation | Auto-generated"
"111","Hi, Are there special counters for elderly passengers at check-in?","en","baggage","departure","{}","Yes, you can use TSA-approved locks; avoid regular locks as security may need to inspect your bag","Security advice | Auto-generated"
"112","Is laptop allowed in cabin baggage or must it be checked — can you confirm?","en","baggage","departure","{}","You'll need to pay excess baggage fees or remove items to meet the weight limit","Common concern | Auto-generated"
"113","What is the business class allowance for passengers? Please advise.","en","baggage","departure","{""item"":""sports equipment""}","Yes, sports equipment like golf clubs and skis are allowed but may incur additional charges","Special baggage | Auto-generated"
"114","Where can I find the tag printing in the departure hall — can you confirm?","en","baggage","departure","{""item"":""liquids""}","Liquids must be in containers of 100ml or less, placed in a clear plastic bag (max 1 liter)","Security rule | Auto-generated"
"115","If my laptop is overweight, what are the next steps? Please advise.","en","baggage","departure","{""class"":""business""}","Business class passengers are allowed 30kg checked baggage and 7kg cabin baggage","Premium class | Auto-generated"
"116","Where can I find the porter in the departure hall? Please advise.","en","baggage","departure","{""item"":""power bank""}","No, power banks must be carried in cabin baggage only due to fire safety regulations","Important restriction | Auto-generated"
"117","Can I purchase extra allowance for baby formula online or at the airport?","en","baggage","departure","{}","Yes, baggage wrapping service is available near the check-in area for a fee","Additional service | Auto-generated"
"118","Who should I contact if my hookah is damaged during handling?","en","baggage","departure","{}","Maximum dimensions are 56cm x 36cm x 23cm (22in x 14in x 9in)","Size restrictions | Auto-generated"
"119","Where can I find the porter in the departure hall — can you confirm?","en","baggage","departure","{}","This depends on your airline and ticket class; economy typically allows 1-2 bags","Varies by airline | Auto-generated"
"120","Hi, Who should I contact if my duty-free is damaged during handling?","en","baggage","departure","{""item"":""duty-free""}","Duty-free purchases are usually allowed in addition to your cabin baggage allowance","Shopping exception | Auto-generated"
"121","Are there special counters for families at check-in? Please advise.","en","baggage","departure","{""item"":""food""}","Most non-liquid food items are allowed; check destination country restrictions for fresh produce","Varies by destination | Auto-generated"
"122","Please tell me: what are the packing recommendations for hookah?","en","baggage","departure","{}","Oversized baggage must be checked and may incur additional fees","Size violations | Auto-generated"
"123","What are the packing recommendations for baby formula? Please advise.","en","baggage","departure","{}","Some airlines offer dedicated baggage drop counters for passengers who checked in online","Fast track option | Auto-generated"
"124","Please tell me: if my electronics is overweight, what are the next steps?","en","baggage","departure","{""item"":""electronics""}","It's recommended to carry valuable electronics in cabin baggage to prevent damage or theft","Safety recommendation | Auto-generated"
"125","Please tell me: how early should i get to the airport to drop off perfume?","en","baggage","departure","{}","Declare valuable items, fragile goods, lithium batteries, and any restricted items","Declaration requirements | Auto-generated"
"126","Can I purchase extra allowance for telescope online or at the airport?","en","baggage","departure","{}","Oversized baggage is handled at special counters; contact your airline for specific procedures","Special handling | Auto-generated"
"127","Hi, What is the business class allowance for passengers?","en","baggage","departure","{}","Yes, you can purchase additional allowance at the airport counter before baggage drop","Post check-in purchase | Auto-generated"
"128","How early should I get to the airport to drop off perfume?","en","baggage","departure","{}","Sharp objects, tools, liquids over 100ml, and sporting goods are not allowed in cabin","Security restrictions | Auto-generated"
"129","Hi, How early should I get to the airport to drop off laptop?","en","baggage","departure","{}","Report damaged baggage immediately at the airline's baggage service counter before leaving the airport","Damage claims | Auto-generated"
"130","How early should I get to the airport to drop off wedding dress? Please advise.","en","baggage","departure","{""item"":""wedding dress""}","Wedding dresses can be carried as cabin baggage if they fit in overhead bins or you can request a garment bag","Special occasion | Auto-generated"
"131","How early should I get to the airport to drop off telescope? Please advise.","en","baggage","departure","{}","Temporary baggage storage lockers are available in the departure hall for a fee","Storage option | Auto-generated"
"132","Are there special counters for families at check-in? Please advise. [32]","en","baggage","departure","{}","You need your boarding pass and valid ID/passport for baggage check-in","Required documents | Auto-generated"
"133","Please tell me: how much excess baggage fee will i pay for cricket bat?","en","baggage","departure","{}","Yes, you can distribute your total weight allowance across multiple bags as long as each doesn't exceed individual bag limits","Weight distribution | Auto-generated"
"134","Hi, How much oversize fee will I pay for fragile?","en","baggage","departure","{""item"":""fragile""}","Fragile items can be checked but should be properly packed; it's recommended to carry valuables in cabin","Risk advisory | Auto-generated"
"135","Hi, If my hookah is overweight, what are the next steps?","en","baggage","departure","{""passenger_type"":""student""}","Some airlines offer additional baggage allowance for students; check with your airline for specific policies","Special category | Auto-generated"
"136","Please tell me: how early should i get to the airport to drop off medicines?","en","baggage","departure","{""item"":""medicines""}","Yes, prescription medicines are allowed in cabin baggage with proper documentation","Medical exception | Auto-generated"
"137","Can I purchase extra allowance for perfume online or at the airport — can you confirm?","en","baggage","departure","{}","Most airlines strictly enforce the 7kg limit, especially during peak seasons","Enforcement level | Auto-generated"
"138","Please tell me: what is the economy class allowance for passengers? [38]","en","baggage","departure","{""item"":""pet carrier""}","Small pets in approved carriers may be allowed in cabin; larger pets must travel as checked baggage or cargo","Pet travel | Auto-generated"
"139","What is the business class allowance for passengers — can you confirm?","en","baggage","departure","{}","Remove all valuables, documents, keys, medicines, electronics, and perishables","Pre-check preparation | Auto-generated"
"140","Where can I find the baggage wrapping in the departure hall?","en","baggage","departure","{""item"":""camping equipment""}","Camping equipment is allowed in checked baggage; sharp items like knives must be properly packed","Outdoor gear | Auto-generated"
"141","Where can I find the tag printing in the departure hall? Please advise.","en","baggage","departure","{""item"":""baby food""}","Baby food and milk are exempt from liquid restrictions for passengers traveling with infants","Family exception | Auto-generated"
"142","Are there special counters for infants at check-in?","en","baggage","departure","{}","The baggage tag is essential for claiming your luggage; report immediately if you lose it","Important document | Auto-generated"
"143","Are there special counters for families at check-in — can you confirm?","en","baggage","departure","{""class"":""premium economy""}","Premium economy passengers typically get 25kg checked baggage allowance","Mid-tier class | Auto-generated"
"144","Hi, How much excess baggage fee will I pay for laptop?","en","baggage","departure","{}","Baggage pooling depends on airline policy; some allow it for passengers on same booking","Group travel | Auto-generated"
"145","Hi, If my cricket bat is overweight, what are the next steps?","en","baggage","departure","{}","Use hard-shell suitcases for fragile items, secure all zippers, and use TSA locks","Packing advice | Auto-generated"
"146","How early should I get to the airport to drop off batteries — can you confirm?","en","baggage","departure","{""item"":""batteries""}","Spare lithium batteries must be in cabin baggage; installed batteries in devices can be checked","Battery rules | Auto-generated"
"147","Hi, Is camera allowed in cabin baggage or must it be checked?","en","baggage","departure","{}","Yes, you can purchase additional allowance online before check-in or at the airport counter","Post-booking changes | Auto-generated"
"148","Hi, Are there special counters for families at check-in?","en","baggage","departure","{}","Airlines' liability is limited to approximately USD 1,500-2,000 per passenger for international flights","Compensation limits | Auto-generated"
"149","How much oversize fee will I pay for telescope? Please advise.","en","baggage","departure","{}","Airlines use color-coded tags to identify destination and routing; priority tags may be different colors","Tag system | Auto-generated"
"150","What is the economy class allowance for passengers? Please advise.","en","baggage","departure","{""item"":""decorations""}","Non-fragile decorations are allowed; avoid glass ornaments or properly pack them to prevent breakage","Seasonal items | Auto-generated"
"151","Hi, Can I purchase extra allowance for cricket bat online or at the airport?","en","baggage","departure","{""passenger"":""elderly""}","Yes, Islamabad International Airport provides comprehensive assistance services for elderly passengers and their baggage. You can request wheelchair and porter services free of charge at the check-in counter. Our trained staff will assist your mother from the check-in area all the way through security screening, and they will also help carry and manage your baggage throughout the process. The porter service includes loading bags onto the check-in belt, accompanying you to the security area, and ensuring all your belongings are properly handled. For the smoothest experience, inform the airline staff about your assistance needs when you first arrive at the check-in counter, and they will arrange immediate support. If you need a wheelchair, these are available at the entrance and throughout the terminal.","Elderly assistance | Auto-generated"
"152","Hi, What is the economy class allowance for passengers?","en","baggage","departure","{""flight_type"":""connecting""}","When you have connecting flights with different airlines at Islamabad International Airport, you will need to collect your checked baggage from the first flight's baggage claim area and then re-check it with your second airline at their designated check-in counter. This is standard procedure for inter-airline connections because each airline has separate baggage handling systems and liability. Before your first flight departs, confirm the complete transfer procedure with your initial airline's check-in staff, as they can provide specific guidance about timing and which counter to use for your connecting airline. Make sure to allow sufficient time between flights - we recommend at least 3-4 hours for domestic connections and 4-5 hours for international connections when switching airlines. Keep your baggage claim tags from both flights safe, and ensure your connecting flight boarding pass is ready when you re-check your bags.","Different airline transfer | Auto-generated"
"153","If my dried fruits is overweight, what are the next steps — can you confirm?","en","baggage","departure","{""item"":""dried fruits""}","Yes, you can absolutely carry dried fruits, nuts, seeds, and other packaged snacks in your hand luggage without any quantity restrictions or special permissions required. These items are not classified as liquids or restricted goods, so they pass through security screening without issues. For convenience and to speed up security checks, it's best to keep these food items in their original sealed packaging or place them in clear, transparent plastic bags or containers. This makes it easier for security personnel to identify the contents quickly during X-ray screening. Popular items like almonds, cashews, pistachios, dried apricots, dates, raisins, and trail mixes are commonly carried by passengers and are perfectly acceptable. However, avoid carrying items with excessive moisture or those that might leak, as these could cause inconvenience during your flight.","Snacks allowed | Auto-generated"
"154","Please tell me: what are the packing recommendations for telescope?","en","baggage","departure","{""issue"":""delayed flight""}","For significant flight delays, Islamabad International Airport offers left luggage storage facilities located near the main entrance of the departure hall, making it convenient for passengers who want to move around freely without carrying heavy bags. The storage service operates 24/7 and charges approximately PKR 300-500 per bag per day, depending on the size and weight of your luggage. This facility is secure, monitored by CCTV cameras, and staffed by trained personnel who will provide you with a claim ticket that you must present when retrieving your bags. Alternatively, you should check with your airline at their customer service desk, as many airlines offer complimentary temporary baggage storage for passengers affected by significant delays, especially if the delay is due to the airline's operational issues. When using any storage service, make sure to remove valuable items, important documents, medications, and electronic devices from your checked bags and keep them with you.","Delay storage | Auto-generated"
"155","If my perfume is overweight, what are the next steps? [55]","en","baggage","departure","{""service"":""tag printing""}","No, Islamabad International Airport does not currently have self-service baggage tag printing kiosks available for passenger use. All baggage tags must be printed and attached by authorized airline staff at the check-in counters to ensure proper routing, weight compliance, and security protocols are followed. This system is in place because baggage tags contain specific barcodes and routing information that must be accurately entered into the airline's baggage handling system, and they must be securely attached to prevent loss or misplacement during transit. The airline staff are trained to print tags with correct destination codes, flight numbers, and handling instructions, and they verify that the tag matches your boarding pass and identification before attaching it to your luggage. After your bag is tagged, you'll receive a baggage claim receipt that you should keep safe until you collect your luggage at your destination.","Tag service | Auto-generated"
"156","Please tell me: how much oversize fee will i pay for religious items?","en","baggage","departure","{""item"":""religious items""}","Yes, religious items including the Holy Quran, prayer beads (tasbih), prayer mats (janamaz), Islamic books, and other religious articles are completely allowed in both cabin baggage and checked luggage at Islamabad International Airport and all Pakistani airports. These items are considered personal religious materials and are respected and accommodated under airport security regulations. You can carry your Quran in any format - whether it's a physical book, a digital copy on your tablet or phone, or even audio recordings. Prayer beads of any material including wood, stone, or plastic are permitted without restriction. If you're carrying a prayer mat, the folding type fits easily in cabin baggage, or you can place it in checked luggage. Many Muslim passengers also carry small bottles of zamzam water, attar (fragrance), or miswak, and these are generally allowed following standard liquid restrictions for cabin baggage.","Religious items | Auto-generated"
"157","Hi, Who should I contact if my baby milk powder is damaged during handling?","en","baggage","departure","{""item"":""baby milk powder""}","Yes, baby milk formula powder, infant food, and related feeding supplies are fully permitted in cabin baggage in reasonable quantities necessary for your infant's needs during the journey. Pakistani airport security makes special accommodations for traveling parents with babies, understanding that infant nutrition is essential and time-sensitive. You can carry enough formula to last your entire trip, including extra portions for potential delays. Unlike regular powder restrictions which apply to adult passengers on some international routes, baby formula is exempt from powder quantity limits when traveling with an infant. It's helpful to keep the formula in its original branded container with labels visible, as this speeds up security screening. Along with formula powder, you're also allowed to carry pre-made liquid formula, baby food jars, breast milk, and sterilized water in quantities exceeding the normal 100ml liquid limit for cabin baggage.","Baby feeding items | Auto-generated"
"158","How much oversize fee will I pay for perfume?","en","baggage","departure","{""issue"":""damaged luggage""}","Yes, airlines at Islamabad International Airport will accept luggage with broken wheels or other external damage for check-in, as the primary concern is the contents being properly secured rather than the cosmetic condition of the bag itself. However, it's strongly recommended that you get your damaged luggage wrapped at the professional wrapping service located near the check-in counters, which costs approximately PKR 200-300 per bag. Wrapping provides several benefits: it prevents further damage during baggage handling, keeps broken parts from catching on conveyor belts, protects the bag's contents from exposure if the damage worsens, and prevents items from falling out through damaged areas. The wrapping service uses industrial-grade plastic wrap that's specifically designed for luggage protection. If your wheel is completely detached, inform the check-in staff so they can add a 'fragile' or 'handle with care' tag to your bag.","Damaged bag acceptance | Auto-generated"
"159","Hi, If my hookah is overweight, what are the next steps? [59]","en","baggage","departure","{""item"":""hookah""}","Yes, traditional hookahs (sheesha/huqqa) are permitted in checked baggage at Pakistani airports, as they are recognized cultural items that many travelers transport between cities or take as gifts abroad. However, there are important preparation requirements you must follow. The hookah must be completely clean with absolutely no tobacco residue remaining - clean all chambers, hoses, and the bowl thoroughly before packing. Tobacco, flavored molasses, or charcoal for hookah use cannot be carried in cabin baggage and have restrictions in checked baggage too, so verify specific airline policies. Pack your hookah carefully with adequate cushioning to prevent the glass base from breaking during handling - bubble wrap, foam, or thick clothing works well for padding. If the hookah has multiple parts, consider packing them separately and securing loose components so they don't move around and cause damage.","Traditional items | Auto-generated"
