"id","query","language","intent","terminal","entities","expected_response","notes"
"82","I'm taking gold jewelry for my sister's wedding, any restrictions?","en","baggage","departure","{""item"":""jewelry""}","You can transport gold jewelry and other valuable ornaments for personal or family use such as wedding gifts, but there are important security and customs considerations to keep in mind. For maximum security, always carry expensive jewelry in your cabin baggage rather than checked luggage - this keeps valuable items with you at all times and reduces theft risk. Checked baggage occasionally gets lost, delayed, or tampered with, and airline liability for valuable items in checked bags is very limited. While there's no restriction on the quantity of gold jewelry you can carry domestically within Pakistan, large quantities or high values should be documented with purchase receipts or family ownership records in case questions arise. For international travel, customs regulations become important - if you're carrying jewelry worth more than the duty-free allowance of your destination country, you may need to declare it and potentially pay import duty. Some countries have specific forms for temporarily importing jewelry that you'll take back with you. At Pakistani airports, security may ask to inspect jewelry during X-ray screening to verify it's genuine jewelry and not concealing prohibited items. Keep jewelry in original boxes or soft pouches to prevent damage and tangling.","Valuable jewelry"
"83","My bag smells like biryani from the food I packed, is that a problem?","en","baggage","departure","{""issue"":""odor""}","A mild food odor from sealed food items like biryani in your checked baggage is generally acceptable and won't prevent your bag from being checked in, as many Pakistani travelers transport home-cooked food between cities or to relatives abroad. However, there are practical considerations to keep in mind. Strong, pungent smells that might permeate throughout the baggage hold and affect other passengers' luggage should be avoided out of courtesy. The main concern isn't the smell itself but rather whether the food is properly sealed and won't leak or spill during transit - biryani with gravy can be messy if containers aren't absolutely leakproof. Use rigid, sealed plastic containers rather than thin plastic bags or aluminum foil, and double-wrap them in plastic bags as a precaution. Place food containers in the center of your bag surrounded by clothing to absorb any potential leaks and minimize odor transfer. For cabin baggage, avoid bringing strong-smelling foods as the confined aircraft cabin space makes odors more noticeable and can disturb other passengers. Security personnel might inspect food items to ensure they're indeed food and not concealing prohibited materials. If the smell is extremely strong, check-in staff might suggest additional packaging or plastic wrap to contain the odor.","Food smell"
"84","Can I take my tabla in the cabin instead of checking it?","en","baggage","departure","{""item"":""tabla""}","Yes, you can carry your tabla (traditional drum) as cabin baggage if it fits within the standard cabin baggage size dimensions of approximately 56cm x 45cm x 25cm and doesn't exceed the 7kg weight limit. Tablas, being relatively compact musical instruments, often fit these requirements especially if carried in a properly fitted soft case or bag. Musical instruments are valuable and can be damaged by rough handling in checked baggage, so carrying them in the cabin is actually the preferred option for many musicians. When you arrive at the check-in counter, inform the staff that you're carrying a musical instrument in cabin baggage - they may measure it to confirm it meets size requirements. Once on board, you can place the tabla in the overhead bin or under the seat in front of you, just like regular cabin baggage. If your tabla set is larger than cabin allowance or you have both tabla and other items exceeding combined limits, you'll need to check it. In that case, pack it very carefully with substantial padding, use a hard case if possible, mark it as fragile, and request delicate handling labels from check-in staff. Some airlines allow purchasing an extra seat for musical instruments that are too large for cabin but too valuable to check - inquire if this option interests you.","Traditional instrument"
"85","I bought perfume at duty-free, does it count as hand luggage?","en","baggage","departure","{""item"":""duty-free""}","No, items purchased at airport duty-free shops after passing through security, including perfumes, alcohol, cosmetics, and other products, do not count toward your regular cabin baggage allowance. These duty-free purchases come in special sealed tamper-evident bags with the receipt visible inside, and you can carry these additionally along with your standard cabin baggage and personal item. This exception exists because you purchased these items after security screening in the sterile area of the airport, so they've already cleared security protocols. The duty-free bags can contain liquids exceeding the normal 100ml limit that would otherwise be prohibited in cabin baggage if brought from outside the airport. You can carry multiple duty-free shopping bags without worry. However, if you have a connecting flight, especially an international connection through another country, be aware that you might need to go through security again, and those destination airports might not accept your duty-free liquids if you're transferring. For final destination flights, keep your duty-free purchases in their original sealed bags with receipt visible until you reach your destination. Don't open or tamper with the sealed bags during the flight, as this could cause issues with customs or connecting security screenings.","Duty-free separate"
"86","My flight is at 5 AM, can I check baggage the night before?","en","baggage","departure","{""service"":""early check-in""}","No, Islamabad International Airport does not offer night-before or overnight baggage check-in services. All baggage must be checked in on the same day as your flight departure, regardless of how early the flight is scheduled. For your 5 AM flight, check-in counters typically open 3 hours before departure for international flights and 2 hours before for domestic flights, which means counters open around 2 AM for your international flight or 3 AM for domestic. Yes, this requires arriving at the airport very early in the morning, but this is standard procedure for early morning flights worldwide. The requirement for same-day check-in exists because checked baggage must be continuously monitored for security, and airports cannot store bags overnight due to security protocols and liability concerns. Plan your transportation accordingly - you may need to arrange a taxi, use ride-sharing apps, or have family drive you to reach the airport by 2-3 AM. Some hotels near the airport offer early morning airport shuttle services. If you're traveling from far away, consider staying at an airport hotel the night before your early flight. Once you check in, you can rest in the departure lounge until your flight boards, as the terminal is open 24 hours.","No night check-in"
"87","My 5-year-old has a small school bag, does it count separately?","en","baggage","departure","{""passenger"":""child""}","Children who are 2 years old or above traveling on a purchased ticket (not as an infant on lap) are entitled to their own baggage allowance according to the ticket class they're traveling in, just like adult passengers. So your 5-year-old has their own separate checked baggage allowance (typically 20-23kg for economy class) and cabin baggage allowance (typically 7kg). Their small school bag would count as their personal item or cabin baggage within their allowance. In practice, airlines at Islamabad International Airport are generally flexible about small children's personal items - a small school backpack worn by a 5-year-old is unlikely to be weighed separately or strictly enforced, especially if it just contains toys, snacks, and entertainment for the flight. However, technically, if you're already at your cabin baggage limit with your own bags, the child's school bag is their cabin baggage and should be within the 7kg limit. Many families strategically pack heavier items in children's checked baggage since kids rarely pack 20kg of belongings, leaving capacity to split family items across multiple baggage allowances. If the school bag is truly tiny - just containing a toy and snacks - most airlines won't count it strictly. But if it's a full-size backpack, it counts as cabin baggage under the child's allowance.","Child bags"
"88","I'm diabetic, can I carry insulin injections in hand luggage?","en","baggage","departure","{""item"":""insulin""}","Yes, passengers with diabetes can carry insulin, syringes, insulin pens, blood glucose monitors, test strips, lancets, and all other diabetic supplies in cabin baggage without quantity restrictions at Islamabad International Airport and all Pakistani airports. These are classified as essential medical supplies, and airports make accommodations for passengers who need medications during travel. Insulin actually should be carried in cabin baggage rather than checked luggage because the cargo hold's temperature fluctuations can potentially damage insulin's effectiveness. Carry your diabetic supplies in a clear case or bag for easy identification during security screening. While a prescription or doctor's letter is not legally required for insulin in Pakistan, having this documentation is highly recommended as it quickly verifies your medical need if questioned by security or customs officers. A doctor's letter should state your diagnosis, the prescribed insulin type and dosage, and that you require these supplies for medical purposes. Keep insulin in its original pharmacy packaging with labels showing your name and medication details. For international travel, carry enough insulin for your entire trip plus extra days' supply in case of delays, and research your destination's regulations about importing medications. Some countries require declaring medical supplies at customs.","Diabetes supplies"
"89","How much can I declare for valuable items in my baggage?","en","baggage","departure","{}","The standard liability limit that airlines have for checked baggage under international aviation rules (Montreal Convention) is approximately 1,131 Special Drawing Rights (SDRs), which equals roughly USD 1,500-1,700, or about PKR 400,000-450,000 at current exchange rates. This represents the maximum compensation you can receive if your checked baggage is lost, damaged, or delayed, regardless of the actual value of contents. Importantly, this limit applies per passenger, not per bag, and it's a maximum - compensation is based on actual documented losses up to this limit. The liability for domestic flights within Pakistan may be lower and is governed by Pakistan's domestic aviation regulations. If you're carrying items worth more than this liability limit - such as expensive jewelry, electronics, cameras, antiques, or other valuables - the airline is not responsible for the excess value unless you purchase additional insurance. You have several options: purchase excess valuation insurance directly from the airline at check-in (expensive but possible), buy travel insurance from independent providers that covers baggage loss up to higher amounts, or simply don't check valuable items and carry them in cabin baggage where you maintain physical control. High-value items should really travel in cabin baggage whenever possible rather than checked luggage.","Liability limits"
"90","Can I pack document photocopies in checked luggage?","en","baggage","departure","{""item"":""documents""}","Yes, you can pack photocopies of documents in checked luggage, and in fact it's a good practice to keep backup copies of important documents separate from originals in case of loss or theft. However, never pack original important documents in checked baggage - always keep originals of your passport, national ID card, flight tickets, boarding passes, travel insurance documents, hotel reservations, medical prescriptions, credit cards, and any other critical papers in your cabin baggage where you have direct control and access. Checked bags occasionally get lost, delayed, or stolen, and if your original documents are inside, you'll face serious problems at your destination. The photocopies in checked luggage serve as backups - if something happens to your cabin bag or you lose documents during travel, you have copies that can help with police reports, embassy assistance for replacing passports, or proving identity. Consider also keeping digital scans of all important documents in your email or cloud storage (Google Drive, Dropbox) accessible from your phone - this provides another backup layer. Organize documents in a waterproof document holder or ziplock bag to protect them from potential moisture or spills in your luggage. Some travelers also leave copies of important documents with family members at home who can scan and email them if needed urgently.","Document placement"
"91","My hiking backpack has a metal frame, will security stop me?","en","baggage","departure","{""item"":""backpack""}","Your hiking backpack with a metal frame will pass through security screening at Islamabad International Airport without issues, as metal frames in backpacks are common and not prohibited items. The X-ray machines and metal detectors are sophisticated enough to distinguish between structural metal components like frames and prohibited items like weapons. However, you should expect the screening process to take slightly longer because the metal frame will show up prominently on the X-ray screen, and security officers will want to ensure it's just a backpack frame and not concealing anything suspicious. When you place your backpack on the conveyor belt for X-ray screening, remove it from any protective covers, open all compartments and pockets, and remove any large items like laptops or tablets that need separate screening. The backpack itself can remain assembled with the frame inside. Security personnel may ask you to open the backpack for manual inspection, especially if it's heavily packed and the X-ray image isn't completely clear. Be cooperative and patient - this is routine procedure for bags with metal components. If you have trekking poles, tent stakes, or other hiking equipment with metal parts, these might require additional inspection. Carabiners, camping equipment, and similar metal outdoor gear are allowed in checked baggage but must be in checked luggage, not cabin baggage.","Metal frame screening"
"92","Can I bring clay pottery from Multan in checked baggage?","en","baggage","departure","{""item"":""pottery""}","Yes, you can transport clay pottery, ceramic items, and traditional Multani blue pottery in checked baggage, but extreme care must be taken with packing because these items are very fragile and easily broken during baggage handling. Pakistani handicrafts like Multani pottery, tile work, and ceramic pieces are commonly transported by travelers as gifts or personal items. Each pottery piece should be individually wrapped in multiple layers of bubble wrap, foam, or thick paper. If you don't have professional packing materials, use clothing, towels, or blankets to wrap each item separately. Place wrapped items in the center of your suitcase surrounded by soft items like clothes, never near the edges or corners where impacts are most severe. Fill all empty spaces in the bag with soft materials to prevent items from shifting during transit. Hard-shell suitcases provide better protection than soft bags for fragile items. If transporting multiple pottery pieces, pack them so they don't touch each other directly. Consider buying luggage wrapping service at the airport (PKR 200-300) for extra protection. Critically important: understand that airlines explicitly state they are not liable for damage to fragile items in checked baggage - you pack and check such items at your own risk. If pottery items are very valuable or irreplaceable, consider shipping them separately through a specialized courier service that insures fragile items.","Fragile pottery"
"93","It rained and my bag got wet on the way, will they accept it?","en","baggage","departure","{""issue"":""wet baggage""}","Yes, slightly wet baggage from rain is acceptable for check-in at Islamabad International Airport, as airport staff understand that weather conditions sometimes cause luggage to get damp during transport to the airport. However, it's in your best interest to address the moisture before checking in. If the exterior is just damp, wipe it down with a towel or cloth available at the airport or from your car. If it's very wet, consider using the baggage wrapping service near check-in counters (PKR 200-300), which will seal the wet exterior and prevent moisture from affecting other passengers' bags in the cargo hold or dripping on airport floors. The most critical concern is protecting the contents inside your bag - immediately check that water hasn't seeped into the interior, especially around zippers and seams. Electronics, documents, and clothing inside must stay dry. If water has penetrated inside, try to dry the contents or transfer items to a plastic bag or dry bag to prevent further water damage during the flight. Water damage to baggage contents is typically not covered by airline liability if the exterior moisture was pre-existing and not caused by airline handling. For future trips during monsoon season, consider using waterproof luggage covers, rain bags, or wrapping your luggage in plastic before leaving home. Most modern suitcases have some water resistance, but prolonged rain exposure can lead to seepage.","Rain-wet bag"
"94","I want to take my cricket bat and stumps to Lahore, is that allowed?","en","baggage","departure","{""item"":""cricket equipment""}","Yes, cricket equipment including bats, stumps, pads, helmets, gloves, and protective gear can be transported in checked baggage on flights from Islamabad to Lahore or any other domestic route, and this is very common given Pakistan's passion for cricket. Your cricket equipment will count toward your regular checked baggage weight allowance (typically 20-23kg for economy class), so if you have a full cricket kit bag with bat, pads, helmet, gloves, and stumps, it can be quite heavy - ensure you're within your limit or be prepared to pay excess baggage charges. Cricket bats are considered potential weapons and cannot be carried in cabin baggage under any circumstances - they must be checked in. Pack your bat carefully with padding around it to prevent the blade from being damaged, and ensure it's secured so it doesn't shift and damage other items or the bag itself. Modern English willow bats are expensive and can crack if dropped, so consider a hard case if the bat is valuable. Stumps with sharp ends should be wrapped or covered so they don't tear through the bag or injure baggage handlers. For international flights, cricket equipment is generally not restricted, though very large items like practice nets or bowling machines might require special cargo arrangements. If you're a serious player traveling for tournaments, many team managers check full kit bags as group baggage.","Cricket gear"
"95","Can I leave my bags here if I'm coming back through ISB in 3 days?","en","baggage","departure","{""service"":""long-term storage""}","No, Islamabad International Airport does not offer multi-day or long-term baggage storage facilities for passengers who are traveling onward and returning later. The left luggage service available at the airport is designed only for same-day or overnight storage during flight delays, layovers, or short visits, not for storage spanning multiple days between separate trips. For storing luggage for 3 days or longer, you'll need to use commercial storage facilities in Rawalpindi or Islamabad city. Some options include self-storage companies that offer secure locker services, certain hotels that provide luggage storage for guests (even after checkout, for a fee), or private luggage storage businesses near popular tourist areas. If you're staying at a hotel before your departure or after your return, ask if they can store your bags for a few days - many hotels offer this service to their guests for a minimal fee or sometimes free. The reason airports don't provide extended storage is due to security protocols - bags cannot be left unattended for multiple days due to security concerns, and airports lack the infrastructure to manage long-term storage with proper tracking and liability. For future planning, if you need to leave items between trips, arrange advance booking with a city storage facility, which is more secure and reliable than airport options anyway.","No long-term storage"
"96","I'm taking an electric iron to my hostel, can I check it?","en","baggage","departure","{""item"":""electric iron""}","Yes, electric irons and other household electrical appliances are completely allowed in checked baggage at Islamabad International Airport. Students and professionals frequently transport small appliances like irons, kettles, immersion heaters, and fans when moving to hostels, universities, or new accommodation. Before packing your electric iron in checked luggage, ensure it has completely cooled down if it was recently used - hot appliances can damage other items in your bag or pose a safety risk. Empty any water from steam iron reservoirs, as water can leak during baggage handling and damage clothing or electronics in your bag. If the iron has a detachable power cord, pack it separately or wrap it securely around the iron to prevent tangling with other items. Remove any batteries if your iron has battery backup, as loose lithium batteries are restricted in checked baggage - though corded irons typically don't have batteries. Pack the iron in the center of your suitcase surrounded by clothing or soft items for cushioning, as irons can be heavy and might damage other items if they shift during transit. The iron will count toward your checked baggage weight allowance, and irons can be several kilograms, so account for this weight. For international travel, verify your destination's voltage standards - Pakistan uses 220V, and your iron should be compatible with your destination's electrical system.","Electric iron"
"97","My company bag has logo stickers all over, is that acceptable?","en","baggage","departure","{}","Yes, luggage with company logos, brand stickers, and decorative labels is completely acceptable and actually quite common at Islamabad International Airport. Many passengers use stickers to personalize their bags, making them easily identifiable on the baggage carousel and reducing the chance of another passenger accidentally taking your bag since many suitcases look similar. Company-branded bags from corporations, promotional bags from events, or luggage covered in travel stickers are all standard sights at airports. The only restriction would be if stickers or logos contain offensive content, hate symbols, or inappropriate imagery - these would violate airport conduct standards and might prompt staff to ask you to remove or cover them. Otherwise, corporate logos, sports team emblems, university badges, travel destination stickers, and brand names are all fine. In fact, travel experts recommend making your bag distinctive through stickers, colored ribbons, or unique tags because it speeds up identification at baggage claim and deters theft since a highly recognizable bag is harder to steal unnoticed. If your company bag is particularly distinctive with unique colors or design, you're less likely to experience the common problem of bag mix-ups where passengers accidentally take similar-looking bags. Just ensure stickers are firmly attached and won't peel off and potentially jam baggage handling equipment.","Logo stickers okay"
"98","Can I pack climbing rope and carabiners in my checked bag?","en","baggage","departure","{""item"":""climbing equipment""}","Yes, mountain climbing and rock climbing equipment including ropes, carabiners, harnesses, belay devices, ascenders, descenders, and climbing shoes are all permitted in checked baggage at Pakistani airports. Pakistan has a strong mountaineering community with many climbers heading to northern areas like Gilgit-Baltistan, Hunza, and K2 base camp, so climbing gear is commonly transported. Your equipment counts toward your regular checked baggage weight allowance, and climbing gear can be quite heavy especially with ropes, so watch your weight limits to avoid excess charges. Pack metal equipment like carabiners carefully so they don't damage the bag interior or other contents - consider a dedicated climbing gear bag or duffel. Coil ropes neatly and secure them to prevent tangling and make the bag easier to handle. Climbing harnesses and soft gear can go anywhere in the bag. Remove any sharp items like ice axes, crampons, or pitons from checked bags and pack them very carefully wrapped and secured, as truly sharp items may require additional security clearance. For international mountaineering expeditions, your equipment faces no restrictions, though commercial quantities of gear might raise questions. If you're part of a climbing expedition, coordinate with your team about distributing group equipment across multiple bags to avoid overweight issues. Consider gear insurance as airline liability for sports equipment is limited.","Climbing gear"
