#,User Query,Chatbot Response,Intent,Terminal,Language
132,Can I check in with damaged luggage?,"Yes, but inform the airline staff to mark the condition on your baggage receipt to avoid confusion later.",Check_in_info,departure,English
133,Can I bring sealed liquids like juice bottles?,"Only if they’re under 100 ml in carry-on or sealed properly in checked bags. Otherwise, they may be discarded at security.",Check_in_info,departure,English
134,Are there ATMs near check-in?,"Yes, multiple ATMs are available near the entrance and beside Row B for passenger convenience.",Check_in_info,departure,English
135,What happens if my printed ticket is blurred?,Staff can verify your booking using the PNR or CNIC number and issue a new boarding pass instantly.,Check_in_info,departure,English
136,Is there a separate check-in counter for VIPs?,"Yes, diplomatic and VIP passengers are assisted at dedicated counters with private waiting areas.",Check_in_info,departure,English
137,Can I check in power banks in luggage?,"No, power banks must be in your hand luggage due to airline safety regulations.",Check_in_info,departure,English
138,Can I check in sharp items like scissors?,"No, sharp items are prohibited in hand luggage. Place them in checked baggage.",Check_in_info,departure,English
139,Is there an emergency medical service near check-in?,"Yes, an airport medical unit operates 24/7 near Gate 3 for emergencies and first aid.",Check_in_info,departure,English
140,Can I keep extra bags in storage before check-in?,"Yes, you can store items temporarily at the baggage service counter beside Row C for a small hourly charge.",Check_in_info,departure,English
141,Are there smoking areas before check-in?,Smoking zones are available outside the terminal building only. The inside is a smoke-free area.,Check_in_info,departure,English
142,Can I check in fragile glass items?,"Yes, but label them clearly and request a “FRAGILE” tag from the counter staff.",Check_in_info,departure,English
143,Can I bring electronics like laptops and tablets?,"Yes, but remove them from your bags during security screening. Carry them in hand luggage.",Check_in_info,departure,English
144,Is there any charge for reissuing a lost boarding pass?,"Generally no, but some airlines charge a small administrative fee. Confirm with your airline staff.",Check_in_info,departure,English
145,Can I use digital payment apps to pay baggage fees?,"Yes, most airlines accept debit/credit cards and Pakistani digital wallets like Easypaisa or JazzCash for baggage payments.",Check_in_info,departure,English
146,How do I identify international vs domestic counters?,"International counters are marked in blue boards, while domestic are shown in green. Both have visible airline logos overhead.",Check_in_info,departure,English
147,Is check-in available for transit passengers?,"Yes, passengers arriving on connecting flights can recheck baggage at the Transit Help Desk near Gate 6.",Check_in_info,departure,English
148,Can I carry gifts wrapped in boxes?,"Avoid wrapping gifts before check-in. Security might need to inspect inside, so it’s better to wrap them after screening.",Check_in_info,departure,English
149,Can I check in a bicycle?,"Yes, bicycles must be partially dismantled and packed in boxes. Check your airline’s sports equipment policy for charges.",Check_in_info,departure,English
150,Can I check in without showing my ticket?,"No, you must show either a printed or digital ticket along with CNIC or passport at the counter.",Check_in_info,departure,English
151,What is the procedure for checking in a musical instrument like a guitar?,"It can be checked in as fragile, oversized baggage. Some airlines may allow smaller instruments as hand-carry if they fit in the overhead bin.",Check_in_info,departure,English
152,I am on a standby ticket. Where do I check-in?,Proceed to your airline's ticketing counter. Standby check-in is handled directly by the airline and is subject to seat availability before departure.,Check_in_info,departure,English
153,Can I check-in if my passport is expiring in less than six months?,Most countries require at least six months of passport validity for entry. Airlines will likely deny boarding. Please check your destination's requirements.,Check_in_info,departure,English
154,What happens if the airport's check-in system is down?,Airlines will switch to a manual check-in process. Please expect delays and listen for announcements from the staff for guidance.,Check_in_info,departure,English
155,"Is there a student baggage allowance, and how do I claim it?",Many airlines offer extra baggage for students. You must present your valid student ID and mention it at the counter during check-in.,Check_in_info,departure,English
156,Can I volunteer to give up my seat on an overbooked flight at the check-in desk?,"Yes, you can inform the check-in staff. Airlines often provide compensation or benefits to passengers who volunteer on overbooked flights.",Check_in_info,departure,English
157,What is the process for checking in human ashes (cremated remains)?,You must carry a death certificate and a letter from the crematorium. Inform the airline in advance as rules differ for carrying them in cabin or checked baggage.,Check_in_info,departure,English
158,I've checked my bag in but realized I left my passport inside it. What can I do?,"Immediately inform the airline supervisor at the counter. If the bag has not been loaded, they may be able to retrieve it for you.",Check_in_info,departure,English
159,Can I get a seat with extra legroom at the check-in counter?,"Yes, you can request an extra legroom seat, such as an exit row seat. It is subject to availability and may incur an additional charge.",Check_in_info,departure,English
160,My flight is a codeshare flight. Which airline counter do I go to?,"Go to the check-in counter of the airline operating the flight, not the one you booked with. The operating carrier is mentioned on your ticket.",Check_in_info,departure,English
161,Are there any porter services available to help with luggage before check-in?,"Yes, porter services are available at the entrance of the departure hall for a nominal fee. They can assist you with your luggage up to the check-in counter.",Check_in_info,departure,English
162,Can I check in a wedding dress? How should I pack it?,Yes. It's best to carry it as hand luggage in a proper garment bag. Inform the check-in staff; they may ask the cabin crew to store it carefully.,Check_in_info,departure,English
163,Do I need to declare high-value items like jewelry or electronics at check-in?,"You don't declare them at check-in, but it's advisable to keep high-value items in your hand luggage. For customs purposes, you may need to declare them upon arrival.",Check_in_info,departure,English
164,My baggage tag receipt was lost right after check-in. Is that a problem?,"Keep your boarding pass safe, as it has your baggage information. You can also request a copy of the baggage receipt from the airline counter before you proceed.",Check_in_info,departure,English
165,Can I use my airline loyalty points to get an upgrade at the check-in counter?,"Yes, this is often possible. Inform the staff of your request; they will check for availability and process the upgrade using your frequent flyer points.",Check_in_info,departure,English
166,I'm pregnant. Is there any special procedure or priority during check-in?,"Yes, please inform the staff. They may guide you to a priority lane. For late-stage pregnancies, you might need a ""fit to fly"" certificate from your doctor.",Check_in_info,departure,English
167,Can I check-in and then exit the terminal building to meet someone?,"No, once you enter the check-in hall, you are not permitted to exit and re-enter for security reasons.",Check_in_info,departure,English
168,Are there any post office or mailing services available before security?,"Currently, there are no post office facilities available in the departure check-in hall.",Check_in_info,departure,English
169,Can I check in a child's car seat for free?,"Yes, most airlines allow you to check in one car seat or stroller per infant free of charge. Confirm with your airline for their specific policy.",Check_in_info,departure,English
170,What does the 'SEQ NO' on my boarding pass mean?,"It stands for ""Sequence Number,"" which indicates the order in which you checked in for that flight.",Check_in_info,departure,English
171,"If I am denied boarding, where can I get assistance?",The airline check-in supervisor will assist you. They are required to provide you with an explanation and information on compensation or rebooking options.,Check_in_info,departure,English
172,Can I check in perishable food items like frozen meat?,"Yes, but they must be properly packed in a sealed, leak-proof container. The airline is not responsible for spoilage.",Check_in_info,departure,English
173,My QR code for the mobile boarding pass is not scanning. What should I do?,Don't worry. The airline staff can manually enter your booking reference (PNR) or scan your passport to issue you a printed boarding pass.,Check_in_info,departure,English
174,Is there a limit to the amount of cash I can carry?,"There is no limit to carry cash within the airport, but you must declare amounts over a certain limit to customs before departing on an international flight.",Check_in_info,departure,English
175,Can I check in with a damaged passport?,"If the damage is minor, it might be accepted for domestic flights. For international travel, a damaged passport, especially the photo page, will likely be rejected.",Check_in_info,departure,English
176,What should I do if a family member and I are seated apart after check-in?,"You can request the check-in agent to seat you together. If not possible, you can also ask the gate agent or the cabin crew for assistance.",Check_in_info,departure,English
177,Is it possible to check in a television or a computer monitor?,"Yes, it is checked in as fragile, oversized baggage. It must be in its original sealed box with proper padding. Charges will apply.",Check_in_info,departure,English
178,How do I know if my checked bag has been screened?,All checked baggage goes through mandatory security screening after you drop it off. You will not be notified unless a physical inspection is required.,Check_in_info,departure,English
179,Can I check in my baggage and receive my boarding pass a day before my flight?,"No, check-in and baggage drop-off are only permitted on the same day as your flight, typically starting 3-4 hours before departure.",Check_in_info,departure,English
180,What is the 'Final Boarding Call' and what should I do when I hear it?,"It is the last announcement for passengers to go to the boarding gate. If you hear your flight announced, you must proceed to the gate immediately.",Check_in_info,departure,English
181,"Can I request a specific meal (e.g., vegan, gluten-free) during check-in?",Meal requests should be made at least 24 hours before the flight through the airline's website or call center. It is not possible to request it at the check-in counter.,Check_in_info,departure,English
182,Is there a place to get my documents photocopied near the check-in area?,"Yes, a photocopying and printing facility is available at the service desk located in the main concourse area for a small fee.",Check_in_info,departure,English
183,What happens if I have a connecting flight with a very short layover?,Inform the check-in staff. They can add a 'priority' or 'short transit' tag to your luggage to ensure it's transferred quickly to the next flight.,Check_in_info,departure,English
184,Can I bring my own wheelchair and check it in at the gate?,"Yes, you can use your own wheelchair up to the boarding gate. The staff will then check it in for you, and it will be returned to you upon arrival.",Check_in_info,departure,English
185,My bag is slightly overweight by 1-2 kgs. Will the airline waive the fee?,"This is at the discretion of the check-in staff. They may sometimes allow a small margin, but it is not guaranteed. It's best to be within the limit.",Check_in_info,departure,English
186,What do the different colored tags on checked baggage mean?,"The main tag is for routing. Other tags can indicate 'Priority' for premium passengers, 'Heavy' for bags over 15 kg, or 'Fragile' for delicate items.",Check_in_info,departure,English
187,Can I use a digital copy of my CNIC on my phone for domestic check-in?,"No, only the original, physical CNIC card is accepted for identity verification at the check-in counter.",Check_in_info,departure,English
188,Is there a specific counter for armed forces personnel?,"While there isn't always a dedicated counter, airline staff often provide priority assistance to armed forces personnel upon seeing their ID.",Check_in_info,departure,English
189,Can I check in a box instead of a suitcase?,"Yes, you can check in a sturdy, well-sealed cardboard box. Ensure it is properly taped and labeled with your name and contact information.",Check_in_info,departure,English
190,How do I get my baggage back if I decide to cancel my trip after check-in?,Inform the airline supervisor immediately. The process to offload your baggage can take a significant amount of time.,Check_in_info,departure,English
191,Is there a dress code for passengers? Can an airline deny check-in based on attire?,"There is no official dress code, but airlines reserve the right to deny boarding to passengers wearing offensive or inappropriate clothing.",Check_in_info,departure,English
192,"If I am traveling with a pet, do I need to arrive at the airport earlier than usual?","Yes, it is highly recommended to arrive at least one extra hour early, as checking in with pets involves additional paperwork and verification.",Check_in_info,departure,English
193,Can I ask the check-in staff to put a 'Fragile' sticker on my bag even if it has clothes?,"You can, but it is meant for items that are actually fragile. Overuse can diminish its effectiveness, so only use it when necessary.",Check_in_info,departure,English
194,Is there a "quiet" or 'silent' area near the check-in hall to wait?,"The main check-in hall is generally busy. For a quieter environment, you can use the seating areas away from the main counters or visit a caf茅.",Check_in_info,departure,English
195,"What should I do if the name on my ticket is slightly different from my passport (e.g., missing middle name)?","Minor differences are usually acceptable. Point it out to the check-in agent. For major discrepancies, you would need to contact the airline before your flight.",Check_in_info,departure,English
196,Can I pay for extra baggage with a foreign credit card?,"Yes, major international credit cards like Visa and Mastercard are accepted at the excess-baggage payment counters.",Check_in_info,departure,English
197,Are all counters for the same airline in one place?,"Yes, each airline has its set of counters grouped together in a specific row. Look for the airline's logo on the screens above the counters.",Check_in_info,departure,English
198,"Can I check in if my visa for the destination country is in my old, expired passport?","Yes, provided you are carrying both your old passport (with the valid visa) and your new, valid passport. Present both at the check-in counter.",Check_in_info,departure,English
199,"If I have a medical implant, do I need to declare it at check-in?","You do not need to declare it at check-in, but you should inform the security screening staff before passing through the metal detector.",Check_in_info,departure,English
200,"After checking in my luggage, what is the very next step?","After you receive your boarding pass and baggage receipts, your next step is to proceed towards the immigration and security screening area.",Check_in_info,departure,English

