#,Intent,Language,User Query,Chatbot Response,Context,
131,Check_in_info,English,Are face masks still required at check-in?,Masks are optional but recommended in crowded areas. Sanitizer dispensers are placed throughout the hall for public use.,departure,
132,Check_in_info,English,Can I check in with damaged luggage?,"Yes, but inform the airline staff to mark the condition on your baggage receipt to avoid confusion later.",departure,
133,Check_in_info,English,Can I bring sealed liquids like juice bottles?,"Only if they’re under 100 ml in carry-on or sealed properly in checked bags. Otherwise, they may be discarded at security.",departure,
134,Check_in_info,English,Are there ATMs near check-in?,"Yes, multiple ATMs are available near the entrance and beside Row B for passenger convenience.",departure,
135,Check_in_info,English,What happens if my printed ticket is blurred?,Staff can verify your booking using the PNR or CNIC number and issue a new boarding pass instantly.,departure,
136,Check_in_info,English,Is there a separate check-in counter for VIPs?,"Yes, diplomatic and VIP passengers are assisted at dedicated counters with private waiting areas.",departure,
137,Check_in_info,English,Can I check in power banks in luggage?,"No, power banks must be in your hand luggage due to airline safety regulations.",departure,
138,Check_in_info,English,Can I check in sharp items like scissors?,"No, sharp items are prohibited in hand luggage. Place them in checked baggage.",departure,
139,Check_in_info,English,Is there an emergency medical service near check-in?,"Yes, an airport medical unit operates 24/7 near Gate 3 for emergencies and first aid.",departure,
140,Check_in_info,English,Can I keep extra bags in storage before check-in?,"Yes, you can store items temporarily at the baggage service counter beside Row C for a small hourly charge.",departure,
141,Check_in_info,English,Are there smoking areas before check-in?,Smoking zones are available outside the terminal building only. The inside is a smoke-free area.,departure,
142,Check_in_info,English,Can I check in fragile glass items?,"Yes, but label them clearly and request a “FRAGILE” tag from the counter staff.",departure,
143,Check_in_info,English,Can I bring electronics like laptops and tablets?,"Yes, but remove them from your bags during security screening. Carry them in hand luggage.",departure,
144,Check_in_info,English,Is there any charge for reissuing a lost boarding pass?,"Generally no, but some airlines charge a small administrative fee. Confirm with your airline staff.",departure,
145,Check_in_info,English,Can I use digital payment apps to pay baggage fees?,"Yes, most airlines accept debit/credit cards and Pakistani digital wallets like Easypaisa or JazzCash for baggage payments.",departure,
146,Check_in_info,English,How do I identify international vs domestic counters?,"International counters are marked in blue boards, while domestic are shown in green. Both have visible airline logos overhead.",departure,
147,Check_in_info,English,Is check-in available for transit passengers?,"Yes, passengers arriving on connecting flights can recheck baggage at the Transit Help Desk near Gate 6.",departure,
148,Check_in_info,English,Can I carry gifts wrapped in boxes?,"Avoid wrapping gifts before check-in. Security might need to inspect inside, so it’s better to wrap them after screening.",departure,
149,Check_in_info,English,Can I check in a bicycle?,"Yes, bicycles must be partially dismantled and packed in boxes. Check your airline’s sports equipment policy for charges.",departure,
150,Check_in_info,English,Can I check in without showing my ticket?,"No, you must show either a printed or digital ticket along with CNIC or passport at the counter.",departure,
151,Check_in_info,Urdu,میرا چیک ان کاؤنٹر کہاں ہے؟,براہ کرم اپنی ایئرلائن کے چیک ان کاؤنٹر پر جائیں، روانگی ہال میں نشانات موجود ہیں۔,Departure,
152,Check_in_info,Urdu,پی آئی اے کا کاؤنٹر کس قطار میں ہے؟,پی آئی اے کے کاؤنٹر قطار سی میں گیٹ ۴ کے قریب واقع ہیں۔,Departure,
153,Check_in_info,Urdu,سیریں ایئر کا چیک ان کہاں ہوتا ہے؟,سیریں ایئر کے کاؤنٹر قطار بی میں ہیں، وہاں عملہ آپ کی رہنمائی کرے گا۔,Departure,
154,Check_in_info,Urdu,کیا میں آن لائن چیک ان کے بعد بیگ جمع کرا سکتا ہوں؟,جی ہاں، بیگیج ڈراپ کاؤنٹر پر جائیں جہاں “Online Check-In” لکھا ہے۔,Departure,
155,Check_in_info,Urdu,میں نے آن لائن بورڈنگ پاس نکالا ہے، کیا کافی ہے؟,جی ہاں، موبائل یا پرنٹ دونوں منظور ہیں۔,Departure,
156,Check_in_info,Urdu,چیک ان کب کھلتا ہے؟,بین الاقوامی پروازوں کے لیے ۳ گھنٹے پہلے اور ملکی پروازوں کے لیے ۲ گھنٹے پہلے کھلتا ہے۔,Departure,
157,Check_in_info,Urdu,چیک ان کب بند ہوتا ہے؟,ملکی پروازوں کے لیے ۴۵ منٹ اور بین الاقوامی کے لیے ۶۰ منٹ پہلے بند ہوتا ہے۔,Departure,
158,Check_in_info,Urdu,کیا اسلام آباد ایئرپورٹ پر خودکار چیک ان مشین ہے؟,جی ہاں، ہال بی کے داخلی دروازے کے قریب سیلف چیک-ان کاؤنٹر موجود ہیں۔,Departure,
159,Check_in_info,Urdu,بورڈنگ پاس کہاں سے ملے گا؟,ایئرلائن کے کاؤنٹر سے چیک ان مکمل کرنے پر بورڈنگ پاس جاری کیا جاتا ہے۔,Departure,
160,Check_in_info,Urdu,کیا کارگو بیگ بھی یہی جمع ہوتا ہے؟,نہیں، کارگو کے لیے علیحدہ کاؤنٹر ہے، نشانیاں موجود ہیں۔,Departure,
161,Check_in_info,Urdu,میرا سامان زیادہ وزن کا ہے، کہاں جاؤں؟,اضافی وزن کی ادائیگی کے لیے قطار ڈی کے قریب ایکسٹرابیگیج ڈیسک پر جائیں۔,Departure,
162,Check_in_info,Urdu,کیا فیملی کے لیے علیحدہ کاؤنٹر ہے؟,جی ہاں، بچوں والی فیملیز کے لیے ترجیحی لائن دستیاب ہے۔,Departure,
163,Check_in_info,Urdu,خصوصی معاونت والے مسافر کہاں جائیں؟,کاؤنٹر ۱ خصوصی معاونت والے مسافروں کے لیے مخصوص ہے۔,Departure,
164,Check_in_info,Urdu,فاسٹ ٹریک چیک ان کیا ہے؟,یہ بزنس یا پریمیئم مسافروں کے لیے تیز رفتار سروس ہے۔,Departure,
165,Check_in_info,Urdu,کیا میں دو بیگ جمع کرا سکتا ہوں؟,جی ہاں، وزن ایئرلائن کی حد میں ہو تو اجازت ہے۔,Departure,
166,Check_in_info,Urdu,ہاتھ کے سامان کی زیادہ سے زیادہ حد کیا ہے؟,۷ کلوگرام تک، لیکن اپنی ایئرلائن سے تصدیق کر لیں۔,Departure,
167,Check_in_info,Urdu,بیگیج ریپنگ کہاں ہوتی ہے؟,گیٹ ۳ کے قریب بیگیج ریپنگ سروس دستیاب ہے۔,Departure,
168,Check_in_info,Urdu,کیا میں اپنا سامان پہلے دن جمع کرا سکتا ہوں؟,نہیں، چیک ان صرف پرواز کے دن ہی ممکن ہے۔,Departure,
169,Check_in_info,Urdu,کیا میں واپس جانے والی فلائٹ کے لیے بھی چیک ان کر سکتا ہوں؟,عام طور پر صرف موجودہ پرواز کے لیے چیک ان کیا جاتا ہے۔,Departure,
170,Check_in_info,Urdu,بورڈنگ پاس پر کیا معلومات لکھی ہوتی ہیں؟,اس پر گیٹ نمبر، نشست، اور بورڈنگ ٹائم درج ہوتا ہے۔,Departure,
171,Check_in_info,Urdu,کیا میں بیگ کے ساتھ پلاسٹک ریپنگ کروا سکتا ہوں؟,جی ہاں، ہال کے اندر یہ سہولت موجود ہے۔,Departure,
172,Check_in_info,Urdu,کیا چیک ان کے بعد باہر جا سکتا ہوں؟,نہیں، سکیورٹی چیک کے بعد دوبارہ داخلہ ممنوع ہے۔,Departure,
173,Check_in_info,Urdu,اگر میری پرواز تاخیر کا شکار ہے تو کیا کاؤنٹر کھلا رہے گا؟,جی ہاں، فلائٹ شیڈول کے مطابق کاؤنٹر ایڈجسٹ کیا جاتا ہے۔,Departure,
174,Check_in_info,Urdu,میرا بورڈنگ پاس گم گیا ہے، کیا دوبارہ مل سکتا ہے؟,جی ہاں، اپنی ایئرلائن کے کاؤنٹر سے نیا پاس حاصل کریں۔,Departure,
175,Check_in_info,Urdu,کیا میں کسی اور کا بیگ جمع کرا سکتا ہوں؟,نہیں، ہر مسافر کو اپنا سامان خود جمع کرانا ہوتا ہے۔,Departure,
176,Check_in_info,Urdu,میں نے ای ٹکٹ خریدا ہے، کیا پرنٹ ضروری ہے؟,نہیں، موبائل پر دکھانا کافی ہے۔,Departure,
177,Check_in_info,Urdu,بین الاقوامی مسافروں کے لیے کاؤنٹر کہاں ہیں؟,قطار اے میں، امیگریشن انٹری کے قریب۔,Departure,
178,Check_in_info,Urdu,ملکی پروازوں کے لیے کون سا ہال ہے؟,روانگی ہال بی ملکی پروازوں کے لیے مخصوص ہے۔,Departure,
179,Check_in_info,Urdu,کیا میں اپنی سیٹ بدل سکتا ہوں؟,بعض ایئرلائنز چیک ان پر سیٹ چینج کی اجازت دیتی ہیں۔,Departure,
180,Check_in_info,Urdu,میرا فلائٹ نمبر پی کے ۳۰۱ ہے، کہاں جاؤں؟,پی کے ۳۰۱ کا چیک ان کاؤنٹر قطار سی میں ہے۔,Departure,
181,Check_in_info,Urdu,کیا معذور مسافروں کے لیے ویل چئیر دستیاب ہے؟,جی ہاں، درخواست پر عملہ فراہم کرتا ہے۔,Departure,
182,Check_in_info,Urdu,کیا چیک ان کے وقت پاسپورٹ ضروری ہے؟,جی ہاں، بین الاقوامی پروازوں کے لیے لازمی ہے۔,Departure,
183,Check_in_info,Urdu,ایئرپورٹ کا عملہ کتنے بجے آتا ہے؟,زیادہ تر کاؤنٹر پرواز سے تین گھنٹے پہلے کھلتے ہیں۔,Departure,
184,Check_in_info,Urdu,میں دیر سے پہنچا ہوں، کیا بورڈنگ ہو سکتی ہے؟,اگر کاؤنٹر بند نہ ہوا ہو تو عملہ مدد کرے گا۔,Departure,
185,Check_in_info,Urdu,کیا چیک ان کے لیے کوئی فیس ہے؟,نہیں، یہ مفت عمل ہے۔,Departure,
186,Check_in_info,Urdu,کیا میں آن لائن چیک ان کینسل کر سکتا ہوں؟,جی ہاں، ایئرلائن کی ویب سائٹ پر تبدیلی ممکن ہے۔,Departure,
187,Check_in_info,Urdu,کیا اسلام آباد ایئرپورٹ ۲۴ گھنٹے کھلا ہے؟,جی ہاں، تمام بین الاقوامی پروازوں کے لیے۔,Departure,
188,Check_in_info,Urdu,کسٹم چیک کہاں ہوتا ہے؟,سکیورٹی کے بعد روانگی زون میں۔,Departure,
189,Check_in_info,Urdu,کیا میں ہینڈ بیگ میں دو پانی کی بوتلیں لے جا سکتا ہوں؟,نہیں، صرف ۱۰۰ ملی لیٹر کی بوتلیں قابلِ اجازت ہیں۔,Departure,
190,Check_in_info,Urdu,کیا وزن تولنے کے لیے مشین دستیاب ہے؟,جی ہاں، ہر قطار کے قریب وزن اسکیل نصب ہیں۔,Departure,
191,Check_in_info,Urdu,میرا سامان کھو گیا تو کیا ہوگا؟,ایئرلائن کے بیگیج کلیم کاؤنٹر سے رپورٹ کریں۔,Departure,
192,Check_in_info,Urdu,میں نے ٹرالی کہاں سے لینی ہے؟,ہر داخلی دروازے پر ٹرالیاں دستیاب ہیں۔,Departure,
193,Check_in_info,Urdu,کیا میں چیک ان سے پہلے کھانا کھا سکتا ہوں؟,جی ہاں، فوڈ کورٹ داخلی حصے میں موجود ہے۔,Departure,
194,Check_in_info,Urdu,کیا اسلام آباد ایئرپورٹ پر بزنس لاؤنج ہے؟,جی ہاں، ہال اے کے قریب۔,Departure,
195,Check_in_info,Urdu,اگر نظام بند ہو گیا تو کیا دستی چیک ان ممکن ہے؟,جی ہاں، عملہ دستی طریقے سے مدد کرے گا۔,Departure,
196,Check_in_info,Urdu,کیا میں اپنے دوست کو ساتھ لا سکتا ہوں؟,صرف مسافر روانگی زون میں داخل ہو سکتا ہے۔,Departure,
197,Check_in_info,Urdu,کیا میں ادویات بیگ میں رکھ سکتا ہوں؟,جی ہاں، لیکن ہاتھ کے بیگ میں رکھنا بہتر ہے۔,Departure,
198,Check_in_info,Urdu,چیک ان کے بعد بورڈنگ گیٹ کہاں ہے؟,گیٹ نمبر آپ کے بورڈنگ پاس پر درج ہے۔,Departure,
199,Check_in_info,Urdu,اسلام آباد سے دبئی فلائٹ کے لیے کون سا ہال ہے؟,بین الاقوامی ہال اے سے دبئی کی پروازیں روانہ ہوتی ہیں۔,Departure,
200,Check_in_info,Urdu,کیا سامان پلاسٹک میں لپیٹنا لازمی ہے؟,نہیں، مگر حفاظت کے لیے مفید ہے۔,Departure,
201,Check_in_info,Urdu,کیا چیک ان کے بعد انٹری دوبارہ ممکن ہے؟,نہیں، ایک بار باہر نکلنے کے بعد نیا پاس درکار ہوتا ہے۔,Departure,
202,Check_in_info,Urdu,کیا میرا پاور بینک بیگ میں جا سکتا ہے؟,نہیں، صرف ہینڈ کیر میں رکھیں۔,Departure,
203,Check_in_info,Urdu,کیا میں اپنی پرواز کا وقت یہاں چیک کر سکتا ہوں؟,جی ہاں، ہال کے اندر نصب فلائٹ اسکرینز پر روانگی اوقات دیکھے جا سکتے ہیں۔,Departure,
204,Check_in_info,Urdu,کیا چیک ان کے دوران فون استعمال کر سکتا ہوں؟,جی ہاں، لیکن سکیورٹی یا اسکیننگ کے وقت موبائل استعمال نہ کریں۔,Departure,
205,Check_in_info,Urdu,کیا چیک ان سے پہلے سکیورٹی چیک ہوتا ہے؟,نہیں، سکیورٹی چیک بورڈنگ کے مرحلے پر ہوتا ہے۔,Departure,
206,Check_in_info,Urdu,کیا میں ایئرپورٹ سے ویزا کاپی پر سفر کر سکتا ہوں؟,نہیں، اصل پاسپورٹ لازمی ہے۔,Departure,
207,Check_in_info,Urdu,اگر میں چیک ان مس کر دوں تو کیا ہو گا؟,آپ کی نشست منسوخ ہو سکتی ہے، فوری طور پر ایئرلائن کاؤنٹر سے رابطہ کریں۔,Departure,
208,Check_in_info,Urdu,کیا عملہ میرے ساتھ سامان اٹھانے میں مدد کرے گا؟,جی ہاں، پورٹر سروس دستیاب ہے، آپ فیس ادا کر کے مدد لے سکتے ہیں۔,Departure,
209,Check_in_info,Urdu,کیا چیک ان کے وقت بچے کی عمر کا ثبوت درکار ہے؟,جی ہاں، پیدائش سرٹیفیکیٹ یا پاسپورٹ دکھانا ضروری ہے۔,Departure,
210,Check_in_info,Urdu,میں نے پالتو جانور لانا ہے، کیا طریقہ ہے؟,ایئرلائن کے پالتو جانوروں کے قوانین کے مطابق کیج اور ٹکٹ لازمی ہے۔,Departure,
211,Check_in_info,Urdu,کیا ہینڈ کیری میں لیپ ٹاپ لے جا سکتا ہوں؟,جی ہاں، لیپ ٹاپ ہینڈ بیگ میں لے جانے کی اجازت ہے۔,Departure,
212,Check_in_info,Urdu,اگر میرا بیگ کھل گیا ہو تو کیا شکایت کر سکتا ہوں؟,جی ہاں، ایئرلائن کے بیگیج سپروائزر سے فوراً رابطہ کریں۔,Departure,
213,Check_in_info,Urdu,کیا اسلام آباد ایئرپورٹ پر مفت وائی فائی ہے؟,جی ہاں، چیک ان ایریا میں “IIAP Free WiFi” دستیاب ہے۔,Departure,
214,Check_in_info,Urdu,کیا میں کسی اور فلائٹ کے لیے بھی یہاں چیک ان کر سکتا ہوں؟,نہیں، صرف اپنی مخصوص فلائٹ کے لیے۔,Departure,
215,Check_in_info,Urdu,کیا بزنس کلاس کے لیے الگ کاؤنٹر ہے؟,جی ہاں، عام کاؤنٹرز کے ساتھ خصوصی کاؤنٹر موجود ہیں۔,Departure,
216,Check_in_info,Urdu,میں نے گھر سے چیک ان کیا ہے، اب کیا کرنا ہے؟,ایئرپورٹ پہنچ کر صرف بیگیج ڈراپ کاؤنٹر پر سامان جمع کرائیں۔,Departure,
217,Check_in_info,Urdu,کیا عملہ انگریزی بولتا ہے؟,جی ہاں، عملہ اردو اور انگریزی دونوں میں رہنمائی فراہم کرتا ہے۔,Departure,
218,Check_in_info,Urdu,کیا میں دوست کے ساتھ لائن میں کھڑا ہو سکتا ہوں؟,صرف اگر دونوں ایک ہی فلائٹ کے مسافر ہوں۔,Departure,
219,Check_in_info,Urdu,اگر فلائٹ کا گیٹ بدل جائے تو کیسے پتا چلے گا؟,فلائٹ اسکرین پر گیٹ نمبر اپڈیٹ ہوتا ہے، اعلانات بھی کیے جاتے ہیں۔,Departure,
220,Check_in_info,Urdu,کیا میں ڈالرز ساتھ لے جا سکتا ہوں؟,جی ہاں، اسٹیٹ بینک کی مقررہ حد کے اندر۔,Departure,
221,Check_in_info,Urdu,کیا ایئرپورٹ پر کرنسی ایکسچینج ہے؟,جی ہاں، چیک ان ہال کے قریب دو ایکسچینج ڈیسک ہیں۔,Departure,
222,Check_in_info,Urdu,کیا میں سامان میں کھانے کی چیزیں رکھ سکتا ہوں؟,جی ہاں، اگر ممنوعہ اشیاء نہ ہوں۔,Departure,
223,Check_in_info,Urdu,کیا میں دو الگ ایئرلائنز کی فلائٹ لے سکتا ہوں؟,جی ہاں، مگر ہر فلائٹ کا الگ چیک ان ہوگا۔,Departure,
224,Check_in_info,Urdu,کیا میں ہینڈ بیگ میں پاور بینک رکھ سکتا ہوں؟,جی ہاں، صرف ہینڈ بیگ میں رکھیں، چیکڈ بیگ میں نہیں۔,Departure,
225,Check_in_info,Urdu,کیا اسٹالر یا وہیل چیئر کا بندوبست چیک ان پر ہو گا؟,جی ہاں، عملہ درخواست پر فوری مدد فراہم کرتا ہے۔,Departure,
226,Check_in_info,Urdu,کیا میں کسی اور کے لیے بورڈنگ پاس لے سکتا ہوں؟,نہیں، ہر مسافر کو خود موجود ہونا ضروری ہے۔,Departure,
227,Check_in_info,Urdu,کیا چیک ان کے بعد ٹیکس ریفنڈ کا کاؤنٹر ہے؟,نہیں، اسلام آباد ایئرپورٹ پر ٹیکس ریفنڈ سہولت نہیں ہے۔,Departure,
228,Check_in_info,Urdu,کیا میں اپنا بیگ لاک کر سکتا ہوں؟,جی ہاں، اپنی حفاظت کے لیے لاک استعمال کریں۔,Departure,
229,Check_in_info,Urdu,اگر بیگیج ٹیگ گم جائے تو کیا ہو گا؟,ایئرلائن عملہ فلائٹ تفصیلات سے بیگ تلاش کر سکتا ہے۔,Departure,
230,Check_in_info,Urdu,کیا سامان کی تاخیر پر کوئی معاوضہ ہے؟,جی ہاں، ایئرلائن کے قواعد کے مطابق معاوضہ دیا جا سکتا ہے۔,Departure,
231,Check_in_info,Urdu,کیا چیک ان کے بعد میں خریداری کر سکتا ہوں؟,جی ہاں، سکیورٹی چیک کے بعد ڈیوٹی فری شاپس دستیاب ہیں۔,Departure,
232,Check_in_info,Urdu,کیا میں ٹرالی ایریا میں لے جا سکتا ہوں؟,نہیں، ٹرالیاں مخصوص ایریا تک محدود ہیں۔,Departure,
233,Check_in_info,Urdu,کیا میں اپنے بیگ پر اسٹیکر لگا سکتا ہوں؟,جی ہاں، شناخت کے لیے یہ مفید ہے۔,Departure,
234,Check_in_info,Urdu,کیا سامان اسکیننگ کے دوران کھولا جا سکتا ہے؟,ہاں، ضرورت پڑنے پر سکیورٹی اسٹاف کھول سکتا ہے۔,Departure,
235,Check_in_info,Urdu,کیا میں بیگ میں پرفیوم رکھ سکتا ہوں؟,صرف ۱۰۰ ملی لیٹر یا اس سے کم مقدار۔,Departure,
236,Check_in_info,Urdu,کیا میں بورڈنگ پاس میں تبدیلی کر سکتا ہوں؟,نہیں، بورڈنگ پاس جاری ہونے کے بعد تبدیلی ممکن نہیں۔,Departure,
237,Check_in_info,Urdu,کیا اسلام آباد ایئرپورٹ میں پارکنگ ہے؟,جی ہاں، چیک ان ہال کے سامنے وسیع پارکنگ موجود ہے۔,Departure,
238,Check_in_info,Urdu,کیا میں سامان کی رسید ایئرپورٹ پر دوبارہ لے سکتا ہوں؟,جی ہاں، ایئرلائن کے کسٹمر سروس کاؤنٹر سے۔,Departure,
239,Check_in_info,Urdu,کیا بچوں کے لیے علیحدہ لائن ہے؟,جی ہاں، فیملی لائنز دستیاب ہیں۔,Departure,
240,Check_in_info,Urdu,کیا اسلام آباد ایئرپورٹ پر لاؤنج ہے؟,جی ہاں، پی آئی اے بزنس لاؤنج گیٹ ۵ کے قریب ہے۔,Departure,
241,Check_in_info,Urdu,کیا میں ہینڈ بیگ میں چھری رکھ سکتا ہوں؟,نہیں، یہ سکیورٹی ضابطے کی خلاف ورزی ہے۔,Departure,
242,Check_in_info,Urdu,کیا میں اپنا پاسپورٹ اسکین کروا سکتا ہوں؟,جی ہاں، کاؤنٹر پر عملہ اسکین کرے گا۔,Departure,
243,Check_in_info,Urdu,کیا سامان جمع کرانے کے بعد میں باتھ روم جا سکتا ہوں؟,جی ہاں، روانگی ہال میں واش رومز موجود ہیں۔,Departure,
244,Check_in_info,Urdu,کیا اسلام آباد ایئرپورٹ پر پانی دستیاب ہے؟,جی ہاں، پینے کا پانی ہر ہال میں موجود ہے۔,Departure,
245,Check_in_info,Urdu,کیا میں اضافی بیگ ساتھ لے جا سکتا ہوں؟,ایئرلائن کی فیس ادا کر کے ممکن ہے۔,Departure,
246,Check_in_info,Urdu,کیا میں گیٹ پر پہنچ کر سیٹ بدل سکتا ہوں؟,نہیں، یہ صرف چیک ان پر ممکن ہوتا ہے۔,Departure,
247,Check_in_info,Urdu,کیا اسلام آباد ایئرپورٹ پر پورٹر دستیاب ہیں؟,جی ہاں، داخلے کے قریب موجود ہیں۔,Departure,
248,Check_in_info,Urdu,کیا میں ہال کے اندر فوٹو لے سکتا ہوں؟,ہاں، مگر سکیورٹی یا امیگریشن ایریا میں نہیں۔,Departure,
249,Check_in_info,Urdu,کیا ایئرپورٹ پر ہیلپ ڈیسک ہے؟,جی ہاں، روانگی ہال کے مرکز میں۔,Departure,
250,Check_in_info,Urdu,کیا میں چیک ان کے دوران مسافر معلومات بدل سکتا ہوں؟,نہیں، صرف ایئرلائن دفتر سے ممکن ہے۔,Departure,
251,Check_in_info,Urdu,کیا میں اپنا بیگ وزن کم کر سکتا ہوں؟,جی ہاں، اضافی چیزیں نکال کر۔,Departure,
252,Check_in_info,Urdu,کیا ایئرپورٹ پر اے ٹی ایم ہے؟,جی ہاں، روانگی ہال کے داخلی دروازے کے قریب۔,Departure,
253,Check_in_info,Urdu,کیا میں اپنے موبائل سے بورڈنگ پاس دکھا سکتا ہوں؟,جی ہاں، اسکرین پر دکھانا کافی ہے۔,Departure,
254,Check_in_info,Urdu,کیا میں سفری دستاویزات فوٹو کاپی کر سکتا ہوں؟,جی ہاں، انفارمیشن ڈیسک کے قریب سہولت موجود ہے۔,Departure,
255,Check_in_info,Urdu,کیا میں آن لائن چیک ان کے بعد سیٹ بدل سکتا ہوں؟,صرف اگر ایئرلائن اجازت دے۔,Departure,
256,Check_in_info,Urdu,کیا چیک ان کے بعد مجھے کہاں جانا ہے؟,سکیورٹی چیک کے لیے آگے بڑھیں اور پھر گیٹ پر جائیں۔,Departure,
257,Check_in_info,Urdu,کیا میں چیک ان کے وقت ویکسین سرٹیفکیٹ دکھانا ہے؟,بعض ممالک کے لیے لازمی ہے۔,Departure,
258,Check_in_info,Urdu,کیا میں آن لائن چیک ان بند کر سکتا ہوں؟,جی ہاں، ایئرلائن ویب سائٹ سے ممکن ہے۔,Departure,
259,Check_in_info,Urdu,کیا چیک ان کے دوران عملہ میرا بیگ کھولے گا؟,صرف سکیورٹی وجوہات کی صورت میں۔,Departure,
260,Check_in_info,Urdu,کیا میں کرنسی بیگ میں رکھ سکتا ہوں؟,بہتر ہے کہ ہاتھ کے بیگ میں رکھیں۔,Departure,
261,Check_in_info,Urdu,کیا میں ائیرپورٹ پر کسی کو رخصت کرنے جا سکتا ہوں؟,صرف ٹکٹ ہولڈر مسافروں کو اجازت ہے۔,Departure,
262,Check_in_info,Urdu,کیا اسلام آباد ایئرپورٹ پر فری چارجنگ پوائنٹ ہے؟,جی ہاں، بیٹھنے کے قریب USB پورٹس دستیاب ہیں۔,Departure,
263,Check_in_info,Urdu,کیا میں عملے سے سیٹ اپگریڈ کی درخواست کر سکتا ہوں؟,جی ہاں، اگر بزنس کلاس خالی ہو تو ممکن ہے۔,Departure,
264,Check_in_info,Urdu,کیا میں پرواز کا بورڈنگ ٹائم جان سکتا ہوں؟,بورڈنگ پاس پر وقت درج ہوتا ہے۔,Departure,
265,Check_in_info,Urdu,کیا چیک ان کے وقت سفر انشورنس دکھانی ہے؟,نہیں، صرف ٹکٹ اور شناختی دستاویز کافی ہیں۔,Departure,
