#,Intent,Language,User Query,Chatbot Response,Context,
437,Check_in_info,Roman Urdu,Kya koi separate counter hai female passengers ke liye?,"Kuch airlines ladies counter rakhti hain, staff se confirm karein.",Departure,
438,Check_in_info,Roman Urdu,Kya luggage belt departure pe bhi hoti hai?,"Nahi, luggage belt sirf arrival area mein hoti hai.",Departure,
439,Check_in_info,Roman Urdu,Kya main boarding ke baad phone use kar sakta hoon?,"Haan, jab tak flight boarding start na kare.",Departure,
440,Check_in_info,Roman Urdu,Kya check-in counters subha jaldi khul jaate hain?,"Haan, first flights ke liye subha 4 bajay tak open hote hain.",Departure,
441,Check_in_info,Roman Urdu,Kya koi baggage size limit hoti hai?,"Haan, 158 cm se zyada size allowed nahi hota.",Departure,
442,Check_in_info,Roman Urdu,Kya late night flights ke liye staff available hota hai?,"Haan, international flights ke liye 24 ghante staff maujood hota hai.",Departure,
443,Check_in_info,Roman Urdu,Kya check-in ke dauran selfie le sakta hoon?,"Haan, lekin staff aur system ke paas photo lena avoid karein.",Departure,
444,Check_in_info,Roman Urdu,Kya check-in ke time boarding gate assign hota hai?,"Haan, gate number aapke boarding pass pe likha hota hai.",Departure,
445,Check_in_info,Roman Urdu,Kya check-in ke waqt vaccination certificate zaroori hai?,"Kuch countries ke liye required hota hai, better hai sath rakhein.",Departure,
,,,,,,
446,Check_in_info,Roman Urdu,Kya fragile items ke liye extra charge hota hai?,"Nahi, lekin handling careful hoti hai aur fragile tag lagta hai.",Departure,
447,Check_in_info,Roman Urdu,Kya Islamabad Airport pe baggage scale free hai?,"Haan, weight check karne ke liye machines free hain.",Departure,
448,Check_in_info,Roman Urdu,Kya boarding gate tak wheelchairs jati hain?,"Haan, staff help karta hai wheelchair ko gate tak le jane mein.",Departure,
449,Check_in_info,Roman Urdu,Kya duty free shop departure pe hai?,"Haan, immigration ke baad duty free outlets milte hain.",Departure,
450,Check_in_info,Roman Urdu,Kya koi area hai jahan se flights dekh sakte hain?,"Haan, departure lounge ke glass area se flights visible hoti hain.",Departure,
