"id","query","language","intent","terminal","entities","expected_response","notes"
"171","If my hookah is overweight, what are the next steps? Please advise.","en","facilities","departure","{""facility"":""restaurant"",""dietary"":""halal meat""}","Yes, absolutely! All meat served at restaurants and food outlets in Islamabad International Airport is 100% halal-certified, as this is a mandatory requirement for all food establishments in Pakistan. This includes KFC's chicken products, Subway's meat options, and all dishes at Taste of Pakistan restaurant. Pakistani law requires halal certification for all meat products sold and served in public establishments, and the airport strictly enforces these regulations. You can confidently order any meat-containing dish knowing it meets Islamic dietary laws. The restaurants display their halal certificates prominently, and staff can provide additional confirmation if requested. This applies to all forms of meat including chicken, beef, and lamb. The food outlets source their meat from certified halal suppliers who follow proper Islamic slaughter methods (zabiha). Even international chain restaurants operating in Pakistan, like KFC and Subway, adapt their supply chains to use halal-certified ingredients to comply with local requirements and cater to the predominantly Muslim population and international Muslim travelers.","Halal certification | Auto-generated"
"172","What are the packing recommendations for hookah — can you confirm?","en","facilities","departure","{""facility"":""workspace"",""service"":""quiet""}","For a quiet workspace to use your laptop at Islamabad International Airport, your best options are: The Premium Lounge on the first floor near Gate 6 offers dedicated work areas with comfortable seating, power outlets, good lighting, and minimal noise—ideal for productive work. Access requires business class tickets, lounge membership, or day pass purchase (3,000-4,000 rupees). The upper level seating areas near the prayer rooms (second floor) tend to be quieter than the main departure hall and have some desk-style seating with power outlets. Gate seating areas during off-peak hours, particularly Gates 8-10, can provide relatively quiet spaces, though noise levels vary depending on nearby flight activity. Some corners of the food court have individual table seating where you can work while having access to refreshments. All these areas have free WiFi coverage (ISB_Airport_Free network). For important work calls or video conferences, note that the terminal can be noisy during peak hours, so noise-cancelling headphones are highly recommended. The Premium Lounge offers the most professional and quiet environment if you need extended focus time for work. Power outlets are available at most seating areas throughout the terminal for charging laptops and devices.","Work environment | Auto-generated"
"173","Hi, Is laptop allowed in cabin baggage or must it be checked?","en","facilities","departure","{""service"":""fax"",""facility"":""business""}","While fax services are becoming increasingly rare due to modern communication alternatives, limited fax capabilities may be available through the business center in the Premium Lounge (first floor, near Gate 6). However, fax machines are not commonly maintained anymore as most business communication has transitioned to email, scanning, and digital document sharing. If you specifically need to send or receive a fax, your best options are: Contact the Premium Lounge business center to inquire about availability (access requires lounge entry), approach your airline's customer service desk to explain your urgent situation—they may have fax capabilities for special circumstances, use the airport information desk which might be able to direct you to alternative solutions, or consider using online fax services (e-fax) which allow sending faxes via email using the free airport WiFi with your smartphone or laptop. Given that fax usage has declined dramatically, it's advisable to plan ahead for important document transmissions by using email with scanned attachments or cloud-based document sharing services instead. If you absolutely need fax services, some business hotels near the airport offer this facility and can be contacted for assistance.","Legacy communication | Auto-generated"
"174","What is the economy class allowance for passengers?","en","facilities","departure","{""facility"":""family restroom"",""passenger"":""family""}","Family restrooms are strategically located throughout the departure terminal at Islamabad International Airport to accommodate parents traveling with young children or individuals requiring assistance. These spacious facilities are available near: Gate 3 adjacent to the children's play area, the main departure hall near the food court, and near the prayer rooms on the second floor. Family restrooms are larger than standard restrooms and include: extra space for strollers, luggage, and multiple family members, baby changing tables with necessary supplies, lower sinks accessible for children, grab bars and support rails for elderly or disabled family members, and private, lockable space for family comfort and safety. These facilities are clearly marked with signage showing parent-and-child symbols. The family restrooms are kept clean and well-maintained by housekeeping staff who perform regular checks. They're particularly useful for parents who need to assist children of the opposite gender, grandparents helping young grandchildren, or families with members who require special assistance. During peak travel times, there may be a short wait for family restrooms due to high demand, so plan accordingly. All family restrooms in the terminal are cleaned regularly and stocked with soap, paper towels, and other essentials.","Family facilities | Auto-generated"
"175","Who should I contact if my laptop is damaged during handling? Please advise.","en","facilities","departure","{""facility"":""TV lounge"",""entertainment"":""television""}","Television screens displaying news, sports, and general programming are available throughout Islamabad International Airport's departure terminal. You'll find TV screens at: all gate seating areas, which primarily show news channels and flight information, the food court area where multiple screens display news and sometimes sports, the Premium Lounge (first floor, near Gate 6) which offers the most comprehensive TV viewing options including multiple international news channels, sports networks, and entertainment programs with comfortable seating—though this requires lounge access. The screens in public areas mainly feature Pakistani and international news channels such as Geo News, ARY News, Dawn News, BBC World News, CNN International, and Al Jazeera. During major sporting events like cricket matches (particularly when Pakistan is playing), many screens throughout the terminal will broadcast the games given Pakistan's passion for cricket. The audio for public area TVs is typically muted to avoid disturbing passengers, though the Premium Lounge has sound available. If you're interested in watching specific programming, the Premium Lounge is your best option as it offers the widest channel selection and most comfortable viewing environment. Some restaurants may also have TVs showing popular programs during meal times.","Television viewing | Auto-generated"
"176","Please tell me: is charger allowed in cabin baggage or must it be checked?","en","facilities","departure","{""service"":""power bank rental"",""item"":""charger""}","Power bank rental services are not currently available at Islamabad International Airport in the traditional sense of renting and returning devices. However, you have several alternatives to keep your devices charged: Purchase disposable or reusable portable power banks at convenience stores, electronics shops, or phone accessory shops near the entrance and in the terminal (prices range from 1,500-4,000 rupees depending on capacity and brand). Utilize the numerous free charging stations located at gate seating areas throughout the terminal—these feature both standard electrical outlets and USB ports. The Premium Lounge (first floor, near Gate 6) offers wireless charging pads and ample power outlets for lounge-access passengers. Many restaurant and café seating areas have power outlets at tables where you can charge while dining. Information desks may occasionally have courtesy chargers available for temporary loan in emergency situations, though availability varies. For future travel, consider investing in a personal portable power bank, which has become an essential travel accessory. If you're in urgent need of charging and don't want to purchase a power bank, look for the charging stations with USB ports throughout the terminal where you can charge your device while sitting nearby, or visit one of the many seating areas with built-in power outlets.","Device charging | Auto-generated"
"177","Is camera allowed in cabin baggage or must it be checked — can you confirm?","en","facilities","departure","{""facility"":""complaints desk"",""service"":""feedback""}","Passenger complaints and feedback about airport services can be filed at several locations within Islamabad International Airport. The primary venue is the Customer Service and Complaints Office located in the main departure hall, clearly marked with signage. This office is staffed during business hours (approximately 8 AM to 8 PM) and handles all service-related complaints, suggestions, and feedback. For issues outside these hours, information desks throughout the terminal can accept written complaints or direct you to emergency contacts for urgent matters. Additionally, feedback forms and complaint boxes are available at: customer service counters, information desks, and the main entrance area. When filing a complaint, provide specific details including date, time, location, nature of the issue, and any staff involved. Keep copies of any documentation for your records. For serious issues or if you're unsatisfied with the airport's response, you can escalate complaints to the Pakistan Civil Aviation Authority (PCAA) through their official channels. Many complaints can also be submitted online through the airport's official website or the PCAA's website, which may be more convenient for issues discovered after departure. The airport management takes passenger feedback seriously and investigates all complaints thoroughly. Response times typically range from a few days to 2-3 weeks depending on the complexity of the issue.","Customer service | Auto-generated"
"178","Please tell me: how much excess baggage fee will i pay for baby formula?","en","facilities","departure","{""facility"":""art display"",""cultural"":""exhibitions""}","Islamabad International Airport features several cultural and artistic displays throughout the terminal that showcase Pakistani heritage, art, and culture. These installations are part of the airport's effort to provide travelers with a glimpse of Pakistan's rich cultural tapestry. You'll find: Permanent art installations in the main departure hall featuring contemporary and traditional Pakistani art, including paintings, sculptures, and digital displays highlighting Pakistan's diverse landscapes from the Karakoram mountains to coastal areas. Cultural exhibit areas near the gate lounges displaying traditional crafts, textiles, and handicrafts from various regions of Pakistan. The departure lounge features large photographic displays showcasing Pakistan's UNESCO World Heritage sites, including Mohenjo-Daro, Lahore Fort, and Taxila. Near the shopping areas, you'll find displays of truck art (the colorful decorative style seen on Pakistani trucks and buses) and traditional calligraphy. These artistic elements are integrated throughout the terminal rather than concentrated in a single museum-style space. The displays are changed periodically to feature different themes and artists. While not as extensive as dedicated museum exhibitions, these cultural presentations offer travelers, especially international visitors, an introduction to Pakistani culture and artistic traditions. Information plaques near displays provide context and background about the featured art and cultural elements.","Cultural displays | Auto-generated"
"179","How early should I get to the airport to drop off gifts?","en","facilities","departure","{""facility"":""flower shop"",""item"":""gifts""}","Fresh flower bouquets are not typically sold within the departure terminal at Islamabad International Airport, as most gift shops focus on packaged goods, souvenirs, and travel items rather than perishable fresh flowers. However, you have several options for gifts suitable for arriving passengers: The souvenir shops near Gates 4 and 7 offer beautifully packaged Pakistani handicrafts, traditional items, sweets, and gift sets that make excellent welcome presents. Chocolate shops and confectionery stores sell premium chocolates and Pakistani sweets like packaged mithai that serve as thoughtful gifts. The duty-free shops carry perfumes, cosmetics, and luxury items suitable as gifts. If you specifically need fresh flowers, you may need to arrange delivery from flower shops in Islamabad or Rawalpindi city to the airport arrivals area, coordinating the timing with the expected arrival. Some passengers pre-arrange flowers through hotel concierge services or local florists who deliver to the airport arrivals terminal at specified times. Gift baskets and food items available at the convenience stores can also serve as welcome gifts. For last-minute greeting arrangements, consider purchasing attractive packaged gifts from the airport shops and combining them with a handwritten note or greeting card (also available at shops) to create a personalized welcome package. The souvenir shops can often arrange gift wrapping services for purchased items.","Gift shopping | Auto-generated"
"180","Hi, Who should I contact if my hookah is damaged during handling?","en","facilities","departure","{""service"":""overnight storage"",""duration"":""long-term""}","Yes, overnight luggage storage is available at the left luggage facility located near the main entrance of the departure hall at Islamabad International Airport. This service operates 24/7 and can accommodate bags for hours, overnight, or even several days. The storage facility is secure, monitored by CCTV cameras, and staffed by trained personnel who will issue you a claim ticket that you must present to retrieve your luggage. Charges are typically calculated per bag per day (or per 24-hour period), with rates approximately 300-500 rupees per standard-sized bag, and higher rates for larger items or extended storage periods—exact pricing should be confirmed at the facility. When storing luggage, bring valid identification (passport or national ID card) as this is required for all storage transactions. The facility will tag and record your items, and you'll need your claim ticket and ID to retrieve them. For extended storage periods, inform the staff of your expected retrieval date and time. The service is particularly useful for travelers with long layovers who want to explore Islamabad without carrying luggage, passengers with connecting flights on different days, or people who arrive early but have later flights. Note that the facility won't accept items containing prohibited or dangerous materials. For valuable items, consider using the airport's safe deposit services or keeping valuables with you rather than in stored luggage.","Long-term storage | Auto-generated"
"181","Where can I find the COVID testing in the departure hall? Please advise.","en","facilities","departure","{""service"":""COVID testing"",""facility"":""health""}","COVID-19 testing facilities at Islamabad International Airport are located in the health screening area near the main entrance and sometimes near certain international departure gates, though availability and requirements have changed significantly as pandemic restrictions have evolved. As of current guidelines, many countries have relaxed or eliminated COVID testing requirements for travelers, but services remain available for destinations that still require them or for passengers who prefer testing for personal health reasons. The testing facility can provide: PCR tests (results typically within 24-48 hours, though express services may be available for additional fees), rapid antigen tests (results within 30-60 minutes), and official health certificates required by certain countries. It's highly advisable to check your destination country's current entry requirements well before your flight, as many nations have updated their policies. Testing fees vary but generally range from 3,000-8,000 rupees depending on the test type and turnaround time requested. For international travelers requiring COVID testing, arrive at the airport well in advance of your flight (4-5 hours for international flights) to allow time for testing and results. Some airlines also partner with specific testing providers and may have designated facilities or expedited services. Contact your airline or check the airport's official website for current COVID testing locations, hours, pricing, and requirements. Always verify destination-specific entry requirements including test timing (many countries require tests within 48-72 hours of departure) and accepted test types.","Health screening | Auto-generated"
"182","What are the packing recommendations for cricket bat?","en","facilities","departure","{""facility"":""prayer room"",""religious"":""Jummah""}","Yes, the prayer rooms at Islamabad International Airport (second floor, near Gate 5) accommodate Jummah (Friday) prayers. Given that Pakistan is an Islamic country and Islamabad is the capital, the airport is well-equipped to facilitate Islamic religious observances including the special Friday congregational prayer. The prayer rooms are spacious enough to accommodate larger gatherings typical of Jummah prayers. The men's prayer room is particularly sizeable and can hold 30-40 worshippers comfortably. The timing of Jummah prayer (which replaces the regular Friday Zuhr prayer) varies by season according to solar calculations but typically falls between noon and 2:30 PM. The airport prayer rooms remain open 24/7, and on Fridays, the facility may see increased attendance during Jummah time. While a formal khutbah (sermon) and congregation led by an imam may not be regularly organized by the airport, worshippers often gather informally for Jummah prayer, and sometimes a qualified person among the travelers leads the service. The prayer rooms are oriented towards the Qibla with clear direction markings. Separate prayer spaces are maintained for men and women with appropriate privacy. Adjacent ablution facilities allow worshippers to perform wudu before prayers. If you plan to attend Jummah prayer at the airport, arrive at the prayer room 15-20 minutes before the expected time to ensure you don't miss the congregation.","Friday prayer | Auto-generated"
"183","Hi, What are the packing recommendations for laptop? [83]","en","facilities","departure","{""service"":""currency"",""location"":""departure""}","Yes, you can obtain Pakistani rupees at Islamabad International Airport even if you forgot to exchange money beforehand. Currency exchange counters are located near the main entrance of the departure terminal and within the departure lounge area after security screening. These authorized forex dealers and bank counters can exchange major international currencies including US Dollars, British Pounds, Euros, UAE Dirhams, Saudi Riyals, and other commonly traded currencies into Pakistani rupees. The counters typically operate from early morning (around 6 AM) until late evening (around 11 PM), with extended hours during peak international flight times. Additionally, numerous ATMs throughout the terminal accept international debit and credit cards (Visa, Mastercard, American Express, UnionPay) and dispense Pakistani rupees—this is often the most convenient option and may offer competitive exchange rates, though your home bank may charge foreign transaction fees (typically 1-3%). When using airport exchange services, the rates are generally reasonable but may include a small premium compared to banks in the city. It's wise to compare rates between different exchange counters before completing large transactions. Always keep your exchange receipts as you may need them later, especially if you want to reconvert unused rupees back to your original currency when departing Pakistan. For your immediate needs upon arriving in Pakistan, exchanging $50-100 or equivalent is usually sufficient to cover transportation, meals, and initial expenses.","Currency exchange | Auto-generated"
"184","Are there special counters for families at check-in? Please advise. [84]","en","facilities","departure","{""facility"":""barber"",""service"":""grooming""}","Professional barbershop and salon services are typically limited at Islamabad International Airport. Such services are not commonly found in the main departure terminal areas accessible to all passengers. However, grooming services may be available in the Premium Lounge (first floor, near Gate 6) which sometimes offers basic grooming services like shaving or beard trimming as part of their amenities—this requires lounge access through business class tickets, eligible frequent flyer status, or day pass purchase. Some airport lounges globally include barber services, though availability at Islamabad's specific lounges should be confirmed. For quick grooming needs, the restrooms throughout the terminal have adequate facilities and mirrors for basic self-grooming. The pharmacy and convenience stores sell travel-sized grooming products, disposable razors, combs, and other personal care items if you need to freshen up. If you specifically need a professional haircut or extensive grooming services, there are several options in the nearby areas of Islamabad and Rawalpindi, though this would require leaving the airport terminal (only feasible if you haven't yet checked in or passed through security). Some hotels near the airport have in-house salons that might accommodate airport passengers. For future international travel, many major international hub airports offer premium services including barber shops and spas, but these facilities are less common in Pakistan's airports currently. Consider scheduling grooming appointments before arriving at the airport for your departure.","Personal grooming | Auto-generated"
"185","Please tell me: are there special counters for families at check-in?","en","facilities","departure","{""facility"":""clothing shop"",""item"":""traditional""}","Traditional Pakistani clothing and fashion items are available at the clothing and fashion shops in the departure terminal, particularly in the shopping area near Gates 4-7. While the selection at airport shops is more limited than dedicated clothing bazaars in the city, you can typically find: women's dupattas and shawls (both casual and embroidered), men's shalwar kameez sets (Pakistan's traditional outfit), ladies' kurtas and tunics suitable for travel, embroidered stoles and scarves, traditional accessories like jewelry and bangles, and sometimes children's traditional outfits. The souvenir shops also carry some textile items including smaller traditional garments and accessories. For higher-end traditional clothing or more extensive selection, the duty-free and premium shops may have designer Pakistani clothing brands. Prices vary significantly based on quality, fabric, and embroidery work—simple items might start around 1,500-3,000 rupees while premium embroidered pieces can cost significantly more. The advantage of purchasing traditional clothing at the airport is the convenience and the assurance of quality, though prices are generally higher than in city markets. If you're looking for authentic, intricate traditional Pakistani fashion with extensive variety, the markets in Rawalpindi and Islamabad offer much better selection at more competitive prices. However, for last-minute purchases or gifts, the airport shops provide reasonable options. Staff can assist with sizing and offer recommendations based on your preferences and budget.","Traditional fashion | Auto-generated"
