"id","query","language","intent","terminal","entities","expected_response","notes"
"1","Where is the nearest restroom?","en","facilities","departure","{}","Restrooms are located near Gate 3 and Gate 8 in the departure lounge","Common query"
"2","Is there free WiFi at the airport?","en","facilities","departure","{""service"":""WiFi""}","Yes, free WiFi is available throughout the airport. Connect to 'ISB_Airport_Free' network","Connectivity query"
"3","Where can I find a prayer room?","en","facilities","departure","{""facility"":""prayer room""}","Prayer rooms are located on the second floor near Gate 5 with separate areas for men and women","Religious facility"
"4","Are there any restaurants in the departure lounge?","en","facilities","departure","{""facility"":""restaurant""}","Yes, we have Gloria Jean's, Subway, KFC, and traditional Pakistani cuisine at Taste of Pakistan restaurant","Dining options"
"5","Where is the airport lounge?","en","facilities","departure","{""facility"":""lounge""}","The Premium Lounge is located on the first floor near Gate 6, accessible with lounge passes or business class tickets","Lounge access"
"6","Is there a pharmacy in the airport?","en","facilities","departure","{""facility"":""pharmacy""}","Yes, there's a 24-hour pharmacy near the main entrance of the departure hall","Medical facility"
"7","Where can I charge my phone?","en","facilities","departure","{""service"":""charging""}","Charging stations are available at all gate seating areas and near the food court","Power access"
"8","Are there ATMs in the departure terminal?","en","facilities","departure","{""facility"":""ATM""}","ATMs are located near the entrance, food court, and in the main departure hall","Banking service"
"9","Where can I buy souvenirs?","en","facilities","departure","{""facility"":""shop""}","Souvenir shops are located in the departure lounge near Gates 4 and 7","Shopping query"
"10","Is there a smoking area in the airport?","en","facilities","departure","{""facility"":""smoking area""}","Yes, designated smoking areas are available in the outdoor section accessible from the departure lounge","Smoking policy"
"11","Where is the information desk?","en","facilities","departure","{""facility"":""information""}","Information desks are located at the main entrance and in the center of the departure hall","Help desk"
"12","Are there baby changing facilities?","en","facilities","departure","{""facility"":""baby changing""}","Baby changing stations are available in all restrooms and a dedicated nursing room near Gate 3","Family facility"
"13","Where can I get coffee?","en","facilities","departure","{""facility"":""cafe""}","Coffee shops including Gloria Jean's and Espresso are located in the food court area","Beverage query"
"14","Is there a currency exchange service?","en","facilities","departure","{""service"":""currency exchange""}","Currency exchange counters are near the main entrance and in the departure lounge","Financial service"
"15","Where are the wheelchair accessible facilities?","en","facilities","departure","{""service"":""wheelchair""}","Wheelchair accessible restrooms and ramps are available throughout the terminal, and wheelchairs can be requested at information desks","Accessibility"
"16","Are there any duty-free shops?","en","facilities","departure","{""facility"":""duty-free""}","Duty-free shops are located after security in the departure lounge offering cosmetics, perfumes, and electronics","Tax-free shopping"
"17","Where is the first aid center?","en","facilities","departure","{""facility"":""first aid""}","Medical and first aid center is located on the ground floor near Gate 2","Emergency service"
"18","Is there a children's play area?","en","facilities","departure","{""facility"":""play area""}","Yes, a kids' play zone is available near Gate 5 in the departure lounge","Child-friendly"
"19","Where can I store my luggage?","en","facilities","departure","{""service"":""luggage storage""}","Left luggage storage facility is available near the main entrance for a fee","Storage service"
"20","Are there any bookstores in the airport?","en","facilities","departure","{""facility"":""bookstore""}","A bookshop offering newspapers, magazines, and books is located near Gate 6","Reading material"
"21","Where is the business center?","en","facilities","departure","{""facility"":""business center""}","Business center with internet, printing, and meeting rooms is available in the Premium Lounge","Corporate facility"
"22","Can I get travel insurance at the airport?","en","facilities","departure","{""service"":""travel insurance""}","Travel insurance counters are available near the check-in area","Insurance service"
"23","Where are the water fountains?","en","facilities","departure","{""facility"":""water fountain""}","Water fountains and refill stations are located throughout the terminal near all gate areas","Hydration"
"24","Is there a baggage wrapping service?","en","facilities","departure","{""service"":""baggage wrap""}","Baggage wrapping service is available near check-in counters for a small fee","Packaging service"
"25","Where can I find a taxi service counter?","en","facilities","departure","{""service"":""taxi""}","Taxi booking counters are in the arrival area, but you can inquire at information desks","Transport pre-booking"
"26","Are there any clothing stores?","en","facilities","departure","{""facility"":""clothing store""}","Fashion and accessory shops are located in the departure lounge shopping area","Retail query"
"27","Where is the lost and found office?","en","facilities","departure","{""facility"":""lost and found""}","Lost and found office is near the main information desk in the departure hall","Lost items"
"28","Is there a VIP meet and greet service?","en","facilities","departure","{""service"":""VIP service""}","VIP meet and greet services are available through advance booking with PAA","Premium service"
"29","Where can I buy SIM cards?","en","facilities","departure","{""facility"":""SIM card shop""}","Mobile phone SIM cards are available at telecom shops near the entrance","Connectivity"
"30","Are there any hotels near the airport?","en","facilities","departure","{""facility"":""hotel""}","Airport hotels and nearby accommodations can be found via information desks or booking counters","Lodging query"
"31","Where is the shoeshine service?","en","facilities","departure","{""service"":""shoeshine""}","Shoeshine stands are available in the departure lounge near the premium shops","Personal service"
"32","Can I access the internet for free?","en","facilities","departure","{""service"":""internet""}","Yes, free WiFi is available throughout; internet kiosks are in the business center","Web access"
"33","Where are the public telephones?","en","facilities","departure","{""facility"":""telephone""}","Public telephone booths are located near the entrance and in the departure lounge","Communication"
"34","Is there a post office at the airport?","en","facilities","departure","{""facility"":""post office""}","A small postal service counter is available near the main entrance during business hours","Postal service"
"35","Where can I watch TV while waiting?","en","facilities","departure","{""facility"":""TV area""}","TV screens showing news and flight information are in all gate seating areas","Entertainment"
"36","Are there any massage services?","en","facilities","departure","{""service"":""massage""}","Chair massage services are available in the Premium Lounge","Relaxation service"
"37","Where is the customer service center?","en","facilities","departure","{""facility"":""customer service""}","Customer service and complaint office is located in the main departure hall","Support desk"
"38","Can I buy snacks and drinks?","en","facilities","departure","{""facility"":""convenience store""}","Convenience stores selling snacks and beverages are near all gate clusters","Quick shopping"
"39","Where are the elevator and escalators?","en","facilities","departure","{""facility"":""elevator""}","Elevators and escalators are located at both ends of the terminal connecting all floors","Vertical transport"
"40","Is there a health screening area?","en","facilities","departure","{""facility"":""health screening""}","Health screening and temperature check stations are at the entrance and after security","COVID measures"
"41","Where can I print my boarding pass?","en","facilities","departure","{""service"":""printing""}","Self-service kiosks for printing boarding passes are near check-in counters","Check-in service"
"42","Are there any luxury brand shops?","en","facilities","departure","{""facility"":""luxury shop""}","Luxury and premium brand stores are in the duty-free area after security","High-end shopping"
"43","Where is the airline ticket office?","en","facilities","departure","{""facility"":""ticket office""}","Airline ticket counters and offices are in the check-in area","Ticketing"
"44","Can I get my shoes repaired?","en","facilities","departure","{""service"":""shoe repair""}","Quick shoe repair services are occasionally available near shoeshine stands","Repair service"
"45","Where are the vending machines?","en","facilities","departure","{""facility"":""vending machine""}","Vending machines for snacks and drinks are located throughout the terminal","Automated service"
"46","Is there a nursery room for mothers?","en","facilities","departure","{""facility"":""nursery""}","A dedicated mother and baby room is available near Gate 3 with privacy and facilities","Maternal care"
"47","Where can I find flight information displays?","en","facilities","departure","{""facility"":""display board""}","Flight information display screens are throughout the terminal and at all gates","Flight info"
"48","Are there any jewelry shops?","en","facilities","departure","{""facility"":""jewelry shop""}","Jewelry and accessories shops are in the departure shopping area","Luxury items"
"49","Where is the complaint and feedback box?","en","facilities","departure","{""facility"":""feedback""}","Feedback forms and complaint boxes are at customer service desks and information counters","Passenger feedback"
"50","Can I access the VIP lounge with my credit card?","en","facilities","departure","{""facility"":""lounge"",""payment"":""credit card""}","Some premium credit cards offer complimentary lounge access; check with lounge reception","Card benefits"
"51","Where can I find halal food options?","en","facilities","departure","{""facility"":""restaurant"",""dietary"":""halal""}","All food outlets at Islamabad International Airport serve halal-certified food, as this is standard practice in Pakistan. Popular options include KFC, Subway, and Taste of Pakistan restaurant which offers traditional Pakistani cuisine including biryani, nihari, and kebabs. Gloria Jean's Coffee serves halal-certified snacks and beverages. The food court area features multiple dining establishments, all adhering to Islamic dietary requirements. You'll also find convenience stores selling packaged halal snacks, sandwiches, and beverages throughout the terminal. For vegetarian options, Subway offers extensive customizable salads and sandwiches, while Taste of Pakistan has vegetarian curries and lentil dishes.","Halal dining"
"52","Is there a place to perform wudu before prayers?","en","facilities","departure","{""facility"":""ablution area"",""religious"":""wudu""}","Yes, dedicated ablution (wudu) facilities are available adjacent to both the men's and women's prayer rooms on the second floor near Gate 5. These areas are specifically designed for Islamic ritual washing before prayers, featuring low-level water taps and seating areas. The facilities are kept clean and well-maintained with continuous water supply. The prayer rooms themselves are spacious, carpeted, and oriented towards the Qibla direction with clear markings. Separate prayer spaces are provided for men and women with appropriate privacy measures. The prayer rooms can accommodate approximately 30-40 worshippers at a time and are open 24/7 for all five daily prayers.","Religious facilities"
"53","Can I get a wheelchair for my elderly parent?","en","facilities","departure","{""service"":""wheelchair"",""passenger"":""elderly""}","Absolutely! Wheelchair assistance is available free of charge at Islamabad International Airport. You can request a wheelchair at any of these locations: the main entrance assistance desk, airline check-in counters, or information desks throughout the terminal. It's highly recommended to request wheelchair service in advance when booking your flight or at least call your airline 24-48 hours before departure. Airport staff will provide trained personnel to assist your elderly parent from the check-in area through security screening, to the boarding gate, and onto the aircraft. The service includes help with baggage handling and navigating the terminal. Wheelchairs are also available for connecting flights and can be arranged to wait at the arrival gate.","Mobility assistance"
"54","Where is the medical clinic if someone feels unwell?","en","facilities","departure","{""facility"":""medical clinic""}","The airport medical center is located on the ground floor near Gate 2 in the departure terminal. This facility is staffed with qualified medical professionals including doctors and nurses who can handle minor medical emergencies, provide first aid, and offer basic medical consultations. The clinic is equipped with essential medical equipment, oxygen supply, automated external defibrillators (AED), and common medications. Services include blood pressure monitoring, glucose testing, wound dressing, and treatment for common ailments like headaches, nausea, or minor injuries. For serious medical emergencies, the clinic can coordinate with nearby hospitals and ambulance services. The medical center operates 24/7 to ensure passenger safety and wellbeing. Paramedics are also stationed throughout the terminal and can be quickly summoned through any information desk or by approaching security personnel.","Emergency medical care"
"55","Are there any quiet areas where I can rest or sleep during a long layover?","en","facilities","departure","{""facility"":""quiet area"",""purpose"":""rest""}","While Islamabad International Airport doesn't have dedicated sleeping pods or rest capsules, there are several quiet seating areas where passengers can rest during layovers. The best options include: the gate seating areas near Gates 8-10 which tend to be less crowded and have reclining seats, the upper level near the prayer rooms which offers a calmer environment, and the Premium Lounge (available for business class passengers or with paid access) which provides comfortable seating, dim lighting, and a quieter atmosphere. The lounge also offers shower facilities and rest areas. For passengers on extended layovers (8+ hours), some nearby hotels offer day-use rooms that can be booked through the airport information desk. The terminal maintains 24-hour lighting, so if you're sensitive to light, consider bringing an eye mask. Security is present throughout the terminal, making it safe to rest, though it's advised to keep your belongings secure and valuables on your person.","Rest facilities"
"56","Where can I buy traditional Pakistani handicrafts as gifts?","en","facilities","departure","{""facility"":""souvenir shop"",""item"":""handicrafts""}","Traditional Pakistani handicrafts and souvenirs are available at several locations in the departure terminal. The main souvenir shops near Gates 4 and 7 offer an excellent selection of authentic Pakistani products including: hand-embroidered textiles and shawls, miniature truck art replicas, blue pottery from Multan, onyx and marble handicrafts, traditional jewelry featuring semi-precious stones, Peshawar chappal (traditional footwear), pashmina shawls from northern areas, brass and copper decorative items, and packaged Pakistani spices and teas. The duty-free shops also carry some Pakistani handicraft items. Prices range from small items at 500-1,000 rupees to premium crafts costing several thousand rupees. Shop staff can provide certificates of authenticity for higher-value items and arrange appropriate packaging for fragile handicrafts. These make excellent gifts representing Pakistani culture and craftsmanship.","Cultural shopping"
"57","Is there a place to shower before my flight?","en","facilities","departure","{""facility"":""shower"",""service"":""hygiene""}","Shower facilities are available in the Premium Lounge located on the first floor near Gate 6. Access to the lounge and its shower facilities is available for business class passengers, first class ticket holders, eligible frequent flyer program members, or passengers who purchase a day pass (approximately 3,000-4,000 rupees). The shower rooms are private, clean, and well-maintained, equipped with hot water, toiletries, towels, and hair dryers. Each shower room includes a changing area and basic amenities. For passengers without lounge access, some nearby airport hotels offer shower facilities that can be used for a fee even without booking a room. Unfortunately, there are no pay-per-use public shower facilities in the main terminal area. If you need to freshen up without a full shower, the restrooms throughout the terminal have wash basins, and you can purchase toiletries at the convenience stores or pharmacy.","Personal hygiene"
"58","Can I buy a local SIM card for my trip in Pakistan?","en","facilities","departure","{""facility"":""SIM shop"",""service"":""mobile""}","Yes, several telecom provider shops are located near the main entrance of the departure terminal and in the arrival area. The major Pakistani mobile networks represented include Jazz, Telenor, Zong, and Ufone. These shops sell prepaid SIM cards specifically designed for tourists and visitors, offering various data and calling packages. To purchase a SIM card, you'll need to present your passport and may need to provide biometric verification as per Pakistani regulations. Typical tourist SIM packages range from 500-2,000 rupees and include data allowances from 5GB to unlimited, plus local calling minutes. Staff can help you choose an appropriate package based on your travel duration and usage needs. The SIM cards are activated immediately or within a few hours. Some shops also sell mobile phone accessories, portable chargers, and international calling cards. Remember that certain areas in northern Pakistan may have limited network coverage regardless of provider.","Mobile connectivity"
"59","Where can I exchange foreign currency to Pakistani rupees?","en","facilities","departure","{""facility"":""currency exchange"",""service"":""forex""}","Currency exchange services are available at multiple locations throughout Islamabad International Airport. The main exchange counters are located near the main entrance of the departure terminal and within the departure lounge after security. These counters are operated by authorized money exchangers and banks, typically offering competitive rates for major currencies including US Dollars, British Pounds, Euros, UAE Dirhams, Saudi Riyals, and other common international currencies. The exchange counters usually operate from early morning (around 6 AM) until late evening (around 11 PM), with some offering 24-hour service depending on flight schedules. Additionally, several ATMs throughout the terminal accept international cards (Visa, Mastercard, UnionPay) and dispense Pakistani rupees directly, though your bank may charge foreign transaction fees. It's advisable to compare rates between different counters and ATMs to get the best value. Keep your exchange receipts as you may need them when departing Pakistan to reconvert unused rupees.","Financial services"
"60","Is there a children's entertainment area or toys shop?","en","facilities","departure","{""facility"":""kids zone"",""passenger"":""children""}","Yes, a dedicated children's play area is located near Gate 5 in the departure lounge. This colorful, safe play zone features age-appropriate equipment including slides, climbing structures, soft play elements, and interactive games suitable for children aged 2-10 years. The area is carpeted with soft flooring to prevent injuries and is designed with parents' supervision in mind, allowing clear visibility from surrounding seating. While there isn't a specialized toy store, the souvenir shops near Gates 4 and 7 carry a selection of toys, stuffed animals, coloring books, and children's activities that can keep kids entertained during waits. The convenience stores also stock children's snacks, juice boxes, and small toys. Additionally, many gate areas have charging stations where children can use tablets or devices. The Premium Lounge, if accessible, offers additional child-friendly amenities and quieter spaces for families. Restrooms near the play area include baby changing facilities and family restrooms with extra space for parents with multiple children.","Family facilities"
"61","Where can I report lost items or baggage?","en","facilities","departure","{""facility"":""lost and found"",""service"":""lost items""}","The Lost and Found office is located near the main information desk in the central area of the departure hall on the ground floor. This office handles all inquiries related to lost personal items, misplaced baggage, and found property within the airport terminal. Staff maintain a comprehensive database and storage system for recovered items. If you've lost something before security screening, report it immediately to the Lost and Found office. For items lost after security or at boarding gates, contact the office but also inform your airline's customer service desk as they maintain separate records for gate areas. To claim lost baggage that didn't arrive with you, you must file a Property Irregularity Report (PIR) at your airline's baggage service counter in the arrival area. The Lost and Found office operates during regular business hours (approximately 8 AM to 8 PM) but after-hours reports can be filed with airport security or information desks who will forward the information. When reporting lost items, provide detailed descriptions including brand, color, contents, and exact location where you last saw the item. The office typically holds found items for 30-90 days depending on value and type.","Lost property"
"62","Can I rent a portable WiFi device or get better internet?","en","facilities","departure","{""service"":""WiFi rental"",""tech"":""internet""}","While Islamabad International Airport provides free WiFi throughout the terminal (network name: ISB_Airport_Free), portable WiFi device rentals are not directly available at the airport. However, the telecom shops near the entrance sell mobile WiFi hotspot devices and prepaid SIM cards with substantial data packages that can serve the same purpose. For improved internet access beyond the free WiFi, consider these options: purchase a local Pakistani SIM card with a data package from Jazz, Telenor, or Zong shops (4G LTE coverage is available in major cities), use the business center in the Premium Lounge which offers dedicated high-speed wired internet connections, or contact the information desk about temporary internet access passes for business travelers. The free airport WiFi is generally adequate for email, messaging, and light browsing but may have bandwidth limitations during peak hours. For video streaming, large file downloads, or video calls, a personal data connection is recommended. Many cafes and restaurants in the terminal also offer their own WiFi networks which may have better speeds.","Enhanced connectivity"
"63","Where can I buy power adapters or phone chargers?","en","facilities","departure","{""facility"":""electronics shop"",""item"":""adapter""}","Electronics accessories including power adapters, phone chargers, and travel converters are available at several locations in Islamabad International Airport. The convenience stores near the gate clusters stock basic phone charging cables (USB-C, Lightning, and Micro-USB), portable power banks, and international power adapters. The electronics shops in the duty-free area after security offer a wider selection of premium brands and universal travel adapters suitable for various countries. Pakistan uses Type C and Type D electrical outlets (230V, 50Hz), so if you're arriving from countries using different standards, you'll need an adapter. Prices range from 500 rupees for basic charging cables to 2,000-4,000 rupees for quality universal adapters or power banks. The mobile phone accessory shops near the telecom stores at the entrance also carry these items. If you forgot your charger, remember that many gate seating areas have USB charging ports built into the seats, and wireless charging pads are available in the Premium Lounge. In emergencies, you can ask at information desks if they have loaner chargers available.","Travel electronics"
