ID,Question,Answer,intent,terminal,language
108,Flight me turbulence ke waqt safety measures kya hain?,Seat belt bandhe rakhein. Calm aur composed rahen. Food aur drinks secure rakhein. Staff instructions follow karein. Emergency info aur personal belongings safe rakhein.,flight_info,departure,roman
109,Airport par baggage wrapping aur security tips kya hain?,Wrapping counters par luggage wrap karwa sakte hain. Tags aur receipts attach karein. Sharp items secure rakhein. Security aur airline instructions follow karein. Damage aur theft se protection milegi.,flight_info,departure,roman
110,Flight me oxygen masks kaise use karein?,"Emergency announcement par mask deploy hota hai. Nose aur mouth cover karein. Strap adjust karein aur self pehle fit karein, phir bachon ko help karein. Calm aur composed rahen. Staff instructions strictly follow karein.",flight_info,departure,roman
111,Flight me onboard meal preferences kaise request karein?,"Online booking ya app se special meals select karein. Allergy, vegetarian ya vegan options request karein. Seat aur meal confirm karein boarding ke waqt. Staff serve karega. Pre-planning se comfort milega.",flight_info,departure,roman
112,Airport me connecting flight ke liye tips kya hain?,Arrival aur departure gates check karein. Transfer time ka calculation karein. Baggage transfer aur immigration process plan karein. Staff se guidance lein. Mobile app notifications enable karein.,flight_info,departure,roman
113,Flight me personal electronic devices kaise charge karein?,Power ports ya USB outlets check karein. Staff instructions follow karein. Devices secure rakhein. Portable charger saath rakhein. Devices airplane mode me rakhein take safety ensure ho.,flight_info,departure,roman
114,Airport me shuttle services kaise use karein?,Shuttle counters ya info desk se schedule aur routes check karein. Boarding area aur timing confirm karein. Tickets ya passes ready rakhein. Safety aur convenience ke liye licensed service prefer karein.,flight_info,departure,roman
115,Flight me kids aur infants ke liye special assistance kaise request karein?,"Airline ko advance inform karein. Wheelchair, stroller ya unaccompanied minor services request karein. Boarding aur luggage handling me staff assist karega. Seat allocation aur meal preferences confirm karein. Comfortable aur safe journey ensure hoti hai.",flight_info,departure,roman
116,Airport par Wi-Fi kaise use karein?,Airport Wi-Fi network select karein. Login ya sign-up page complete karein. Free or paid packages available hote hain. Personal data secure rakhein. Devices airplane mode me rakhein during flight.,flight_info,departure,roman
117,Flight me pet travel ke rules kya hain?,Advance booking karein. Pet carrier airline standards ke mutabiq ho. Health certificates aur vaccination records ready rakhein. Cabin ya cargo rules follow karein. Staff assist karega. Boarding aur arrival instructions confirm karein.,flight_info,departure,roman
118,Airport me currency exchange kaise karein?,Official counters ya kiosks use karein. Rates aur fees check karein. Passport aur boarding pass ready rakhein. Receipts safe rakhein. Time aur queues plan karein.,flight_info,departure,roman
119,Flight me exit row ya emergency seats kaise book karein?,"Airline website ya counter se. Adults ke liye available, special needs ya kids restricted. Legroom aur safety info available. Staff instructions strictly follow karein. Boarding ke waqt verify karein.",flight_info,departure,roman
120,Airport me lounge kaise use karein?,"Membership, premium ticket ya airline packages se. Comfortable seating, snacks, drinks aur Wi-Fi available hote hain. Flight updates aur announcements available. Long waits me rest aur refreshment ka fayda. Staff assistance le sakte hain.",flight_info,departure,roman
121,Flight me onboard entertainment kaise use karein?,Seat-back screens ya personal devices connect karein. Headphones use karein. Content options aur timings check karein. Staff instructions follow karein. Leisure aur comfort ke liye plan karein.,flight_info,departure,roman
122,Flight me carry-on luggage ke rules kya hain?,Weight aur size limit airline rules ke mutabiq. Extra items par fees. Security aur boarding ke liye ready rakhein. Liquids aur prohibited items restrictions follow karein. Smooth boarding ke liye plan karein.,flight_info,departure,roman
123,Airport par travel insurance kaise avail karein?,"Airline, travel agent ya online. Coverage aur terms check karein. Documents aur receipts safe rakhein. Emergencies me claims process follow karein. Travel safety ensure hoti hai.",flight_info,departure,roman
124,Flight me seat reclining aur comfort tips kya hain?,Seat belt bandhe rakhein. Recline gently aur neighbor disturb na karein. Pillow ya blanket use karein. Staff instructions follow karein. Comfortable aur safe journey ensure hoti hai.,flight_info,departure,roman
125,Airport me fast-track security kaise avail karein?,"Premium tickets, membership ya pay service se. Signage aur info desk se guidance lein. Documents ready rakhein. Queue fast-track lane me join karein. Boarding efficiently hoti hai.",flight_info,departure,roman
126,Flight me onboard announcements kaise follow karein?,Headphones ya seat speakers use karein. Staff instructions aur emergency info dhyan se sunain. Safety aur guidance ke liye announcements important hote hain.,flight_info,departure,roman
127,Flight me unaccompanied minors ke rules kya hain?,Advance inform airline. Staff escort aur supervision provide karega. Boarding aur deboarding me assistance milegi. Parent/guardian contact details ready rakhein. Safety ensure hoti hai.,flight_info,departure,roman
128,Airport me immigration aur customs process kaise hoti hai?,"Passport, visa aur customs declaration ready rakhein. Lines follow karein aur documents present karein. Staff instructions strictly follow karein. Security aur rules comply karna zaruri hai.",flight_info,departure,roman
129,Flight me emergency landing kaise handle karein?,Calm aur composed rahen. Seat belt bandhe rakhein. Oxygen mask aur life jacket use karein. Staff instructions strictly follow karein. Kids aur elders assist karein. Emergency procedures dhyan se follow karein.,flight_info,departure,roman
130,Airport par VIP services kaise avail karein?,"Premium tickets, membership ya airline packages se. Lounge, fast-track security aur personal assistance available hote hain. Pre-book aur staff confirm karein. Comfortable aur stress-free journey ke liye faydemand.",flight_info,departure,roman
131,Flight me seat allocation aur changes kaise request karein?,"Online check-in, airline website ya counter se. Special needs aur preferences inform karein. Confirm seat assignment boarding ke waqt verify karein. Staff assist karega. Comfortable journey ensure hoti hai.",flight_info,departure,roman
132,Airport par taxi ya transport kaise arrange karein?,Official airport taxi counters ya ride-sharing apps use karein. Fare aur route confirm karein. Designated pickup area me wait karein. Staff aur signage follow karein. Safety aur convenience ke liye licensed transport prefer karein.,flight_info,departure,roman
133,Flight ke delay hone par compensation kaise lein?,Airline policies check karein. Customer service ya app se refund/rebooking request karein. Vouchers ya alternate flights available ho sakte hain. Documentation ready rakhein. Calm rahen aur instructions follow karein.,flight_info,departure,roman
134,Airport me parking options aur charges kaise pata karein?,Short-term aur long-term parking options check karein. Website ya info desk se charges lein. Parking area aur shuttle services verify karein. Receipt aur ticket safe rakhein. Timing aur distance plan karein.,flight_info,departure,roman
135,Flight me turbulence ke waqt food aur drinks kaise handle karein?,Secure aur cover karein. Seat belt bandhe rakhein. Staff instructions follow karein. Drinks aur hot food cautious handle karein. Calm aur composed rahen.,flight_info,departure,roman
136,Airport par connecting flights me baggage kaise manage karein?,Arrival aur departure gates check karein. Transfer time ka calculation karein. Staff guidance aur baggage tags verify karein. Immigration aur customs process plan karein. Mobile app notifications enable karein.,flight_info,departure,roman
137,Flight me onboard Wi-Fi kaise use karein?,Airline Wi-Fi service activate karein. Login credentials enter karein. Payment ya free plan check karein. Devices safe rakhein. Airplane mode rules follow karein.,flight_info,departure,roman
138,Flight me onboard pets ke liye rules kya hain?,Advance booking karein. Pet carrier airline standards ke mutabiq ho. Health certificates ready rakhein. Cabin ya cargo rules follow karein. Staff assist karega. Boarding aur arrival instructions confirm karein.,flight_info,departure,roman
139,Airport par duty-free shopping kaise karein?,Passport aur boarding pass ready rakhein. Purchase limits aur airline rules check karein. Liquids aur restricted items limits follow karein. Shopping bags carry-on ya check-in ke rules follow karein. Payment aur receipts safe rakhein.,flight_info,departure,roman
140,Flight me kids ke liye bassinet kaise request karein?,Airline advance inform karein. Staff allocate karega aur proper seat provide karega. Bedding aur safety check karein. Boarding ke waqt staff assist karega. Comfortable aur safe journey ensure hoti hai.,flight_info,departure,roman
141,Airport me mobile boarding pass kaise use karein?,Airline app se download karein. QR code gate par scan hoga. Screen brightness high rakhein. Backup ke liye print copy rakhein. ID proof ready rakhein.,flight_info,departure,roman
142,Flight me seat belt aur safety card kaise use karein?,Take-off aur landing me seat belt bandhein. Safety card instructions dhyan se padhein. Kids aur elders ke liye assist karein. Turbulence aur emergency situations me follow karein.,flight_info,departure,roman
143,Airport par fast-track lanes kaise use karein?,"Premium tickets, elderly, disabled ya families ke liye. Signage aur staff guidance follow karein. Documents aur boarding pass ready rakhein. Efficient aur fast boarding ke liye lane join karein.",flight_info,departure,roman
144,Flight me personal comfort items kaise manage karein?,"Pillow, blanket aur entertainment devices use karein. Seat aur belongings organized rakhein. Staff assistance lein agar zarurat ho. Comfortable aur stress-free journey ensure hoti hai.",flight_info,departure,roman
145,Airport par special assistance counters kaise locate karein?,"Signage aur info desks follow karein. Airline staff guide karega. Wheelchair, senior citizens aur disabled passengers ke liye assistance available hai. Prior request submit karein.",flight_info,departure,roman
146,Flight me liquids aur gels kaise manage karein?,100 ml se zyada na ho. Transparent resealable bag me rakhein. Security check ke liye separate tray. Prohibited items avoid karein. Smooth boarding ke liye ready rakhein.,flight_info,departure,roman
147,Airport me boarding gate change hone par kya karein?,Display boards aur announcements follow karein. Mobile notifications check karein. Staff se confirm karein. Time pe naya gate reach karein. Boarding smooth hoti hai.,flight_info,departure,roman
148,Flight me seat comfort aur reclining tips kya hain?,Seat belt bandhe rakhein. Recline gently aur neighbor disturb na karein. Pillow ya blanket use karein. Staff instructions follow karein. Comfortable aur safe journey ensure hoti hai.,flight_info,departure,roman
149,Airport par baggage claim aur lost luggage procedure kya hai?,Arrival hall me baggage carousel check karein. Agar luggage missing ho to airline counter report karein. Receipt aur tag details ready rakhein. Staff form fill karne me assist karega. Claim process follow karein aur updates receive karein.,flight_info,departure,roman
150,Flight me emergency landing ke waqt kids kaise secure karein?,Calm rahen aur seat belt bandhein. Oxygen mask aur life jacket use karein. Kids ko close rakhein. Staff instructions strictly follow karein. Emergency procedures dhyan se follow karein.,flight_info,departure,roman
151,Flight me emergency exit ke liye safety instructions kya hain?,Emergency exit seats par instructions board aur crew se milti hain. Seat belt bandhe rakhein aur exit handle operate karna seekhein. Children aur elders ko assist karein. Calm aur composed rahen. Crew instructions strictly follow karein.,flight_info,departure,roman
152,Airport par baggage drop ke liye tips kya hain?,Online check-in ke baad luggage counter par jaayein. ID aur boarding pass ready rakhein. Staff baggage weigh aur tag karega. Receipts safe rakhein. Lines aur timing ka dhyan rakhein. Smooth boarding ke liye early arrive karein.,flight_info,departure,roman
153,Flight me in-flight announcements kaise dhyan se sunain?,Headphones ya seat speakers use karein. Staff instructions aur emergency info dhyan se sunain. Boarding aur safety ke liye important hote hain. Calm aur prepared rahen. Devices properly secure rakhein.,flight_info,departure,roman
154,Airport me lounge facilities kaise use karein?,"Premium ticket, membership ya airline packages se access milega. Comfortable seating, snacks, drinks aur Wi-Fi available hain. Flight updates aur announcements lounge me milti hain. Long waits me rest aur refreshment ka chance milta hai. Staff assistance le sakte hain.",flight_info,departure,roman
155,Flight me turbulence ke waqt drinks aur meals kaise handle karein?,Secure aur cover karein. Seat belt bandhe rakhein. Staff instructions follow karein. Hot food aur beverages cautiously handle karein. Calm aur composed rahen. Safety ensure hoti hai.,flight_info,departure,roman
156,Airport par connecting flight ke liye kitna time chahiye?,"Arrival aur departure gates check karein. Minimum transfer time calculate karein. Immigration, security aur baggage process plan karein. Staff guidance aur mobile notifications follow karein. Smooth connection ke liye early planning zaruri hai.",flight_info,departure,roman
157,Flight me kids ke liye onboard assistance kaise request karein?,"Airline ko advance inform karein. Staff boarding, luggage handling aur seat allocation me assist karega. Special meals aur amenities confirm karein. Comfortable aur safe journey ensure hoti hai.",flight_info,departure,roman
158,Airport me mobile boarding pass kaise use karein?,Airline app se download karein. QR code gate par scan hoga. Screen brightness high rakhein. Backup ke liye print copy rakhein. ID proof ready rakhein.,flight_info,departure,roman
159,Flight me seat belt aur safety card kaise follow karein?,Take-off aur landing me seat belt bandhein. Safety card instructions dhyan se padhein. Kids aur elders ke liye assist karein. Turbulence aur emergency situations me follow karein.,flight_info,departure,roman
160,Airport par fast-track security lanes kaise use karein?,"Premium tickets, elderly, disabled ya families ke liye. Signage aur staff guidance follow karein. Documents aur boarding pass ready rakhein. Efficient aur fast boarding ke liye lane join karein.",flight_info,departure,roman
161,Flight me personal comfort items kaise manage karein?,"Pillow, blanket aur entertainment devices use karein. Seat aur belongings organized rakhein. Staff assistance lein agar zarurat ho. Comfortable aur stress-free journey ensure hoti hai.",flight_info,departure,roman
162,Airport par special assistance counters kaise locate karein?,"Signage aur info desks follow karein. Airline staff guide karega. Wheelchair, senior citizens aur disabled passengers ke liye assistance available hai. Prior request submit karein.",flight_info,departure,roman
163,Flight me liquids aur gels kaise manage karein?,100 ml se zyada na ho. Transparent resealable bag me rakhein. Security check ke liye separate tray. Prohibited items avoid karein. Smooth boarding ke liye ready rakhein.,flight_info,departure,roman
164,Airport me boarding gate change hone par kya karein?,Display boards aur announcements follow karein. Mobile notifications check karein. Staff se confirm karein. Time pe naya gate reach karein. Boarding smooth hoti hai.,flight_info,departure,roman
165,Flight me seat comfort aur reclining tips kya hain?,Seat belt bandhe rakhein. Recline gently aur neighbor disturb na karein. Pillow ya blanket use karein. Staff instructions follow karein. Comfortable aur safe journey ensure hoti hai.,flight_info,departure,roman
166,Airport par baggage claim aur lost luggage procedure kya hai?,Arrival hall me baggage carousel check karein. Agar luggage missing ho to airline counter report karein. Receipt aur tag details ready rakhein. Staff form fill karne me assist karega. Claim process follow karein aur updates receive karein.,flight_info,departure,roman
167,Flight me emergency landing ke waqt kids kaise secure karein?,Calm rahen aur seat belt bandhein. Oxygen mask aur life jacket use karein. Kids ko close rakhein. Staff instructions strictly follow karein. Emergency procedures dhyan se follow karein.,flight_info,departure,roman
168,Flight me onboard entertainment options kya hain?,"Seat-back screens ya personal devices connect karein. Headphones use karein. Movies, music aur games available hote hain. Staff instructions follow karein. Leisure aur comfort ke liye plan karein.",flight_info,departure,roman
169,Airport me duty-free shopping kaise karein?,Passport aur boarding pass ready rakhein. Purchase limits aur airline rules check karein. Liquids aur restricted items limits follow karein. Shopping bags carry-on ya check-in rules follow karein. Payment aur receipts safe rakhein.,flight_info,departure,roman
170,Flight me kids ke liye bassinet kaise request karein?,Airline advance inform karein. Staff allocate karega aur proper seat provide karega. Bedding aur safety check karein. Boarding ke waqt staff assist karega. Comfortable aur safe journey ensure hoti hai.,flight_info,departure,roman
171,Airport par travel insurance kaise avail karein?,"Airline, travel agent ya online buy karein. Coverage aur terms check karein. Documents aur receipts safe rakhein. Emergencies me claims process follow karein. Travel safety ensure hoti hai.",flight_info,departure,roman
172,Flight me personal electronic devices kaise charge karein?,Power ports ya USB outlets check karein. Staff instructions follow karein. Devices secure rakhein. Portable charger saath rakhein. Airplane mode rules follow karein.,flight_info,departure,roman
173,Airport me parking options aur charges kaise pata karein?,Short-term aur long-term parking options check karein. Website ya info desk se charges lein. Parking area aur shuttle services verify karein. Receipt aur ticket safe rakhein. Timing aur distance plan karein.,flight_info,departure,roman
174,Flight ke delay hone par kya steps lene chahiye?,Airline staff ya display screens se latest update lein. Connecting flight miss ho rahi ho to airline se alternate arrangements discuss karein. Lounge ya waiting area me comfortable wait karein. Boarding gate announcements sunte rahen. Compensation policies ke liye airline website check karein.,flight_info,departure,roman
175,Flight me seat selection tips kya hain?,Window ya aisle preference select karein. Exit rows aur legroom available check karein. Online check-in se better seats mil sakti hain. Special needs ya kids ke liye preferred seating request karein. Boarding ke waqt staff se verify karein.,flight_info,departure,roman
176,Airport par health protocols kya follow karne chahiye?,Masks aur sanitizer use karein. Social distancing maintain karein. Agar fever ya illness ho to airline ko inform karein. Security aur boarding area me hygiene guidelines follow karein. Travel documents aur health certificates ready rakhein. Safe aur comfortable departure ke liye planning zaruri hai.,flight_info,departure,roman
177,Flight me onboard pets ke liye rules kya hain?,Advance booking karein. Pet carrier airline standards ke mutabiq ho. Health certificates ready rakhein. Cabin ya cargo rules follow karein. Staff assist karega. Boarding aur arrival instructions confirm karein.,flight_info,departure,roman
178,Airport par shuttle services kaise use karein?,Shuttle counters ya info desk se schedule aur routes check karein. Boarding area aur timing confirm karein. Tickets ya passes ready rakhein. Safety aur convenience ke liye licensed service prefer karein.,flight_info,departure,roman
179,Flight me unaccompanied minors ke rules kya hain?,Airline ko advance inform karein. Staff escort aur supervision provide karega. Boarding aur deboarding me assistance milegi. Parent/guardian contact details ready rakhein. Safety ensure hoti hai.,flight_info,departure,roman
180,Airport me immigration aur customs process kya hai?,"Passport, visa aur customs declaration form ready rakhein. Lines follow karein aur documents present karein. Staff instructions strictly follow karein. Security aur rules comply karna zaruri hai.",flight_info,departure,roman
181,Flight me emergency oxygen masks kaise use karein?,Announcement par mask deploy hota hai. Nose aur mouth cover karein. Strap adjust karein aur self pehle fit karein phir bachon ko help karein. Calm rahen aur staff instructions strictly follow karein.,flight_info,departure,roman
182,Airport par VIP services kaise avail karein?,"Premium tickets, membership ya airline packages se. Lounge, fast-track security aur personal assistance available hote hain. Pre-book aur staff confirm karein. Comfortable aur stress-free journey ke liye faydemand.",flight_info,departure,roman
183,Flight me seat allocation aur changes kaise request karein?,"Online check-in, airline website ya counter se. Special needs aur preferences inform karein. Confirm seat assignment boarding ke waqt verify karein. Staff assist karega. Comfortable journey ensure hoti hai.",flight_info,departure,roman
184,Airport par taxi ya transport services kaise arrange karein?,Official airport taxi counters ya ride-sharing apps use karein. Fare aur route confirm karein. Designated pickup area me wait karein. Staff aur signage follow karein. Safety aur convenience ke liye licensed transport prefer karein.,flight_info,departure,roman
185,Flight ke delay ya cancellation par refund ya rebooking kaise milega?,Airline policies check karein. Customer service ya app se refund/rebooking request karein. Vouchers ya alternate flights available ho sakte hain. Documentation aur receipts ready rakhein. Calm rahen aur instructions follow karein.,flight_info,departure,roman
186,Flight me seat reclining aur comfort tips kya hain?,Seat belt bandhe rakhein. Recline gently aur neighbor disturb na karein. Pillow ya blanket use karein. Staff instructions follow karein. Comfortable aur safe journey ensure hoti hai.,flight_info,departure,roman
187,Airport par baggage wrapping aur safety tips kya hain?,Wrapping counters use karein. Tags aur receipts attach karein. Sharp items secure karein. Security instructions follow karein. Damage aur theft se protection milegi.,flight_info,departure,roman
188,Flight me onboard announcements kaise follow karein?,Headphones ya seat speakers use karein. Staff instructions aur emergency info dhyan se sunain. Safety aur guidance ke liye announcements important hote hain.,flight_info,departure,roman
189,Airport par travel insurance kaise avail karein?,"Airline, travel agent ya online buy karein. Coverage aur terms check karein. Documents aur receipts safe rakhein. Emergencies me claims process follow karein. Travel safety ensure hoti hai.",flight_info,departure,roman
190,Flight me kids ke liye bassinet kaise request karein?,Airline advance inform karein. Staff allocate karega aur proper seat provide karega. Bedding aur safety check karein. Boarding ke waqt staff assist karega. Comfortable aur safe journey ensure hoti hai.,flight_info,departure,roman
191,Airport me mobile boarding pass kaise use karein?,Airline app se download karein. QR code gate par scan hoga. Screen brightness high rakhein. Backup ke liye print copy rakhein. ID proof ready rakhein.,flight_info,departure,roman
192,Flight me seat belt aur safety instructions kyun follow karna zaruri hai?,Turbulence aur emergency situations me safety ke liye. Crew announcements aur safety card guide follow karein. Kids aur elders ke liye assist karein. Accidents aur injuries se bachne ke liye.,flight_info,departure,roman
193,Airport par fast-track security kaise avail karein?,"Premium tickets, membership ya pay service se. Signage aur info desk se guidance lein. Documents ready rakhein. Queue fast-track lane me join karein. Boarding efficiently hoti hai.",flight_info,departure,roman
194,Flight me personal comfort items kaise manage karein?,"Pillow, blanket aur entertainment devices use karein. Seat aur belongings organized rakhein. Staff assistance lein agar zarurat ho. Comfortable aur stress-free journey ensure hoti hai.",flight_info,departure,roman
195,Airport par special assistance counters kaise locate karein?,"Signage aur info desks follow karein. Airline staff guide karega. Wheelchair, senior citizens aur disabled passengers ke liye assistance available hai. Prior request submit karein.",flight_info,departure,roman
196,Flight me liquids aur gels kaise manage karein?,100 ml se zyada na ho. Transparent resealable bag me rakhein. Security check ke liye separate tray. Prohibited items avoid karein. Smooth boarding ke liye ready rakhein.,flight_info,departure,roman
197,Airport me boarding gate change hone par kya karein?,Display boards aur announcements follow karein. Mobile notifications check karein. Staff se confirm karein. Time pe naya gate reach karein. Boarding smooth hoti hai.,flight_info,departure,roman
