ID,Question,Answer,intent,terminal,language
198,Flight me seat comfort aur reclining tips kya hain?,Seat belt bandhe rakhein. Recline gently aur neighbor disturb na karein. Pillow ya blanket use karein. Staff instructions follow karein. Comfortable aur safe journey ensure hoti hai.,flight_info,departure,roman
199,Airport par baggage claim aur lost luggage procedure kya hai?,Arrival hall me baggage carousel check karein. Agar luggage missing ho to airline counter report karein. Receipt aur tag details ready rakhein. Staff form fill karne me assist karega. Claim process follow karein aur updates receive karein.,flight_info,departure,roman
200,Flight me emergency landing ke waqt kids kaise secure karein?,Calm rahen aur seat belt bandhein. Oxygen mask aur life jacket use karein. Kids ko close rakhein. Staff instructions strictly follow karein. Emergency procedures dhyan se follow karein.,flight_info,departure,roman
,,,,,
ID,Question,Answer,,,
1,Check-in area kahan hai?,Check-in area departure floor ke main entrance ke foran baad hai. Har airline ka apna counter hota hai jahan staff aapki madad karta hai.,intent,terminal,language
2,Parking se terminal kaise jaun?,Parking area se “Departures” ke boards follow karein. Lift aur ramp dono available hain taake aap asani se saman le ja sakein.,guidance,departure,roman
3,Baggage wrapping service kahan milti hai?,Baggage wrapping service check-in counter ke paas hoti hai. Ye service aapke bag ko flight ke dauran safe rakhti hai.,guidance,departure,roman
4,Information desk kahan hai?,"Information desk entrance ke paas hai jahan staff flights, gates aur facilities ke bare mein madad karta hai.",guidance,departure,roman
5,Trolley kahan se milegi?,Trolley har entrance aur check-in area ke paas mil jati hai. Ye free hoti hai aur har waqt available rehti hai.,guidance,departure,roman
6,Gate 8 kahan hai?,Gate 8 security check ke baad right side par hai. Wahan clear boards lage hue hain jo direction batate hain.,guidance,departure,roman
7,Washroom kahan hai?,"Har 2 gates ke darmiyan washroom hai. Gate 3, 6 aur 9 ke paas washrooms sabse qareeb hain.",guidance,departure,roman
8,Lounge available hai?,"Haan, business class aur VIP passengers ke liye lounge hai. Paid entry bhi mil sakti hai agar aap chahen.",guidance,departure,roman
9,Khana kahan milta hai?,Departure hall mein coffee aur snacks ke liye cafes aur fast food counters available hain. Gloria Jeans aur Cinnabon famous hain.,guidance,departure,roman
10,Namaz kahan par parh sakta hoon?,Namaz ke liye alag kamra gate 5 ke paas hai. Mardon aur khawateen ke liye alag jagah banai gayi hai.,guidance,departure,roman
11,Security check kahan hota hai?,Check-in ke baad security area aata hai jahan saman aur ticket dono check kiye jate hain.,guidance,departure,roman
12,Samaan ka weight kahan check hota hai?,Airline counter par weight machine hoti hai jahan aap apne bags weigh karwa sakte hain.,guidance,departure,roman
13,Wheelchair service milti hai?,"Haan, wheelchair service available hai. Information desk se madad mang sakte hain.",guidance,departure,roman
14,Gate tak kitna time lagta hai?,Security check ke baad aam tor par gate tak 5 se 10 minutes lagte hain.,guidance,departure,roman
15,Charging point kahan milta hai?,Har waiting area ke paas charging points aur USB ports lage hue hain.,guidance,departure,roman
16,Free WiFi milta hai?,"Haan, “IIAP-FreeWiFi” network se connect karke free internet use kar sakte hain.",guidance,departure,roman
17,Agar gate change ho jaye to?,Screen par updated information aati hai aur loudspeaker se announce bhi hoti hai.,guidance,departure,roman
18,Staff madad karta hai?,"Bilkul, airport staff har section mein maujood hota hai madad ke liye.",guidance,departure,roman
19,Shopping kar sakte hain?,"Haan, duty free shops aur gift stores lounges ke andar available hain.",guidance,departure,roman
20,Family andar aa sakti hai?,Sirf ticket holders andar ja sakte hain. Family farewell area tak aa sakti hai.,guidance,departure,roman
21,Security ke baad wapas ja sakte hain?,"Nahi, security ke baad wapas jana allowed nahi hota.",guidance,departure,roman
22,ATM machine hai?,"Haan, ATM machines main hall aur departure lounge dono jagah par hain.",guidance,departure,roman
23,Bachon ke liye play area hai?,"Haan, gate 7 ke paas chhota play area bana hua hai bachon ke liye.",guidance,departure,roman
24,Pani ki bottle le ja sakta hoon?,Security ke baad pani le jane ki ijazat nahi hoti. Andar se bottles mil jati hain.,guidance,departure,roman
25,Prayer room mein announcement sunai deti hai?,"Haan, prayer room mein speakers lage hain taake aap announcements miss na karein.",guidance,departure,roman
26,Smoking area hai?,"Haan, gate 10 ke paas smoking zone hai jo ventilated hai.",guidance,departure,roman
27,Immigration process mushkil hai?,"Nahi, staff helpful hai. Passport aur ticket ready rakhein taake process asaan ho.",guidance,departure,roman
28,Gate change ho jaye to kya karun?,Nearby staff se confirm karein ya digital screen dekhein for latest update.,guidance,departure,roman
29,Shopping available hai?,"Haan, perfumes, chocolates aur souvenirs duty free shops mein milte hain.",guidance,departure,roman
30,Medical help mil sakti hai?,"Haan, emergency clinic departure floor par hai jo 24 ghante khula rehta hai.",guidance,departure,roman
31,Gate ke paas seats hain?,"Haan, har gate ke paas comfortable seats hain jahan aap araam kar sakte hain.",guidance,departure,roman
32,Announcements English mein bhi hote hain?,"Haan, announcements Urdu aur English dono languages mein hoti hain.",guidance,departure,roman
33,Charging free hai?,"Haan, saare charging stations free hain sab passengers ke liye.",guidance,departure,roman
34,Pani ka dispenser kahan hai?,Water dispensers har gate ke paas lage hue hain. Aap apni bottle fill kar sakte hain.,guidance,departure,roman
35,Bag kho jaye to kya karun?,Lost & Found desk par report karein. Staff turant madad karta hai.,guidance,departure,roman
36,Kya apna khana la sakta hoon?,"Haan, lekin liquid ya strong smell wala food allowed nahi hota.",guidance,departure,roman
37,Dawaiyan kahin se milengi?,"Haan, ek pharmacy lounge ke paas hai jahan basic medicines milti hain.",guidance,departure,roman
38,SIM stall kahan hai?,"Entrance ke paas Jazz, Zong aur Ufone ke stalls maujood hain.",guidance,departure,roman
39,Boarding ke baad wapas ja sakta hoon?,"Nahi, boarding ke baad sirf authorized staff hi gate open kar sakta hai.",guidance,departure,roman
40,Lounge mein newspaper milta hai?,"Haan, lounge mein daily newspapers aur travel magazines milte hain.",guidance,departure,roman
41,Intercom system hai?,"Haan, har zone mein intercom lagay hue hain for quick communication.",guidance,departure,roman
42,Mobile use kar sakte hain?,"Haan, lekin security area mein mobile band rakhein.",guidance,departure,roman
43,Card payment hoti hai?,"Haan, saare cafes aur shops card payments accept karte hain.",guidance,departure,roman
44,Old passengers ke sath koi ja sakta hai?,"Haan, special permission ke sath ek person unke sath ja sakta hai.",guidance,departure,roman
45,Boarding ke time announcements hote hain?,"Haan, clear aur loud announcements hoti hain boarding ke waqt.",guidance,departure,roman
46,Flight updates SMS par milte hain?,"Haan, agar number register ho to SMS updates automatically milte hain.",guidance,departure,roman
47,Return flight info mil sakti hai?,"Haan, information desk par sab flights ka schedule available hai.",guidance,departure,roman
48,Mask pehna zaroori hai?,"Abhi wajib nahi, lekin health ke liye recommend kiya jata hai.",guidance,departure,roman
49,Power bank le ja sakta hoon?,"Haan, lekin sirf hand carry bag mein rakhna allowed hai.",guidance,departure,roman
50,International flights ke liye alag area hai?,"Haan, international flights ke liye alag security aur lounge zone hota hai. Staff wahan guide karta hai.",guidance,departure,roman
51,Airport par boarding gate tak kaise pohonchein?,"Apne boarding pass aur display boards check karein, sahi gate identify karein aur waqt se pehle wahan pohonchein. Staff ki guidance follow karein.",guidance,departure,roman
52,Check-in ke baad luggage kaise organize karein?,"Luggage tag check karein, hand luggage overhead compartment ya seat ke neeche rakhein, aur prohibited items alag karein. Staff ki guidance follow karein.",guidance,departure,roman
53,Flight delay hone par kya steps lene chahiye?,"Airline notifications aur display board check karein, waiting area me relax karein, aur staff se alternate options aur estimated time confirm karein.",guidance,departure,roman
54,Children ke sath flight me comfort kaise ensure karein?,"Pillow aur blanket use karein, peaceful environment banayein, headphone ya eye mask use karein, aur bachon ke qareeb rahen.",guidance,departure,roman
55,Lost luggage ki situation me kya karein?,"Information desk ya airline counter se contact karein, report file karein, receipt aur details safe rakhein, aur staff instructions follow karein.",guidance,departure,roman
56,Flight me mobile aur wifi kaise use karein?,"Mobile flight mode par rakhein, wifi available ho to airline services use karein, calls aur data restricted hain, aur staff instructions follow karein.",guidance,departure,roman
57,Boarding ke waqt line me patience kaise maintain karein?,"Boarding group ke according line me pohonchein, boarding pass ready rakhein, respectfully wait karein, aur staff instructions follow karein.",guidance,departure,roman
58,Flight me children ke entertainment kaise arrange karein?,"Stories, games aur movies arrange karein, headphone use karein, snacks aur water sath rakhein, aur staff instructions follow karein.",guidance,departure,roman
59,Airport par priority service kaise avail karein?,"Premium ticket ya reservation ke mutabiq dedicated lane use karein, aur staff instructions follow karein taake boarding easy ho.",guidance,departure,roman
60,Flight me comfortable sleep ke liye kya karein?,"Pillow aur blanket use karein, seat recline karein, headphone ya eye mask use karein, water regular piyein, aur staff instructions follow karein.",guidance,departure,roman
61,Flight me health aur hygiene kaise maintain karein?,"Hands wash karein ya sanitizer use karein, mask pehnein agar required ho, water regular piyein, aur staff instructions follow karein.",guidance,departure,roman
62,Airport shopping ke liye kya steps follow karein?,"Time pehle se plan karein, official shops use karein, receipts safe rakhein, boarding ke pehle shopping complete karein, aur staff instructions follow karein.",guidance,departure,roman
63,Flight me personal electronics ki safety kaise ensure karein?,"Laptop, mobile aur devices close rakhein, security check me separate karein, charger aur battery rules follow karein, aur staff instructions follow karein.",guidance,departure,roman
64,Airport emergency me kya steps follow karein?,"Staff instructions par instantly act karein, boarding pass aur ID ready rakhein, calm rahen, aur exit routes use karein.",guidance,departure,roman
65,Flight me children ki safety ke liye kya precautions hain?,"Seat belt always bandhein, mask ya life jacket use karein, calm rahen, aur bachon ke qareeb rahen.",guidance,departure,roman
66,Boarding ke waqt documents ready kaise rakhein?,"Passport, boarding pass aur ID ready rakhein, extra receipt ya print sath rakhein, aur staff instructions follow karein.",guidance,departure,roman
67,Flight me children ke liye meals kaise provide karein?,"Light aur easy-to-digest meals provide karein, water sath rakhein, calm rahen, aur staff instructions follow karein.",guidance,departure,roman
68,Airport lost & found ke liye kya steps hain?,"Information desk ya airline counter contact karein, report file karein, receipt aur details safe rakhein, aur staff instructions follow karein.",guidance,departure,roman
69,Flight me seat selection kaise optimize karein?,"Airline website ya app se pre-select karein, window ya isolated seat prefer karein, children ya elderly ke liye comfortable seat choose karein, aur staff help lein.",guidance,departure,roman
70,Flight emergency me kya actions lene chahiye?,"Staff instructions follow karein, seat belt bandhein, exit routes aur oxygen mask use karein, aur children ya elderly ki help karein.",guidance,departure,roman
71,Check-in ke baad next steps kya hain?,"Boarding pass collect karein, baggage drop karein, security check complete karein, gate aur boarding time check karein, aur waiting area me relax karein.",guidance,departure,roman
72,Flight me noise aur disturbance se kaise bacha jaaye?,"Headphone ya earplugs use karein, calm rahen, staff instructions follow karein, aur dusre passengers ko disturb na karein.",guidance,departure,roman
73,Flight me children ke liye activities kaise ensure karein?,"Stories, games aur movies available rakhein, headphones use karein, snacks aur water sath rakhein, aur staff instructions follow karein.",guidance,departure,roman
74,Airport par wheelchair ya special assistance kaise avail karein?,"Request pehle se karein, information desk ya airline counter contact karein, staff instructions follow karein, aur travel easy aur safe ho jayega.",guidance,departure,roman
75,Flight me comfort aur relaxation ke liye kya facilities hain?,"Pillow, blanket, headphone, eye mask, water aur snacks available hain, calm environment me staff support available hai.",guidance,departure,roman
76,Boarding ke waqt personal items kaise arrange karein?,"Cabin bag aur essential items easily accessible rakhein, prohibited items separate rakhein, aur staff instructions follow karein.",guidance,departure,roman
77,Flight me meals aur snacks kaise manage karein?,"Healthy aur light meals rakhein, children aur elderly ke liye proper quantity maintain karein, staff instructions follow karein, aur tray aur seat clean rakhein.",guidance,departure,roman
78,Airport special assistance counter kahan hai?,"Signs aur information desk follow karein, staff wheelchair aur disabled assistance provide karega, request pehle se karein, aur guidance ke liye staff cooperation lein.",guidance,departure,roman
79,Flight me children ki sleep ke liye kya arrangements hain?,"Pillow aur blanket provide karein, calm environment maintain karein, headphone ya eye mask use karein, aur children ke paas rahein.",guidance,departure,roman
80,Comfortable clothing ke liye kya suggestions hain?,"Light aur comfortable clothes pehnein, shoes easy-to-remove ho, aur movement-friendly attire select karein.",guidance,departure,roman
81,Boarding line me patience aur order kaise maintain karein?,"Boarding group ke according pohonchein, boarding pass ready rakhein, politely wait karein, staff instructions follow karein, aur dusron ko disturb na karein.",guidance,departure,roman
82,Airport lounge use kaise karein?,"Premium ticket ya membership required, boarding pass ready rakhein, comfortable seats, snacks aur wifi available, aur time pe pohonchein.",guidance,departure,roman
83,Flight me noise aur disturbance se kaise bacha jaaye?,"Headphones ya earplugs use karein, calm rahen, staff instructions follow karein, aur dusre passengers ko disturb na karein.",guidance,departure,roman
84,Flight me seat use kaise optimize karein?,"Seat recline karein, headphones aur eye mask use karein, water aur snacks available rakhein, calm rahen, aur staff instructions follow karein.",guidance,departure,roman
85,Children aur elderly ke liye available facilities kya hain?,"Special seats, headphones, meals aur water provide kiye jate hain, staff assistance lein, aur safety instructions follow karein.",guidance,departure,roman
86,Airport emergency aur first aid kaise avail karein?,"Information desk ya airline counter se contact karein, staff instructions follow karein, first aid kit available hai, emergency me immediate help lein.",guidance,departure,roman
87,Flight me personal items ka loss kaise prevent karein?,"Cabin bag aur valuables close rakhein, overhead compartment secure karein, items organized rakhein, staff instructions follow karein, aur assistance lein agar needed ho.",guidance,departure,roman
88,Check-in ke waqt line me kya precautions follow karein?,"Line me patience rakhein, documents ready rakhein, staff instructions follow karein, aur dusre passengers ko disturb na karein.",guidance,departure,roman
89,Children safety ke liye flight me kya precautions hain?,"Seat belt bandhein, mask ya life jacket use karein, calm rahen, staff instructions follow karein, aur children ke pass rahen.",guidance,departure,roman
90,Personal electronics kaise safe rakhein?,"Laptop, mobile aur devices close rakhein, security check me separate karein, charger aur battery rules follow karein, staff instructions follow karein.",guidance,departure,roman
91,Flight me sleeping environment kaise improve karein?,"Seat recline karein, headphones aur eye mask use karein, calm environment maintain karein, staff instructions follow karein.",guidance,departure,roman
92,Children ke liye extra facilities kaise avail karein?,"Wheelchair, special seat ya headphone request pehle se karein, staff instructions follow karein, aur travel easy aur comfortable ho jayega.",guidance,departure,roman
93,Meal quantity aur selection kaise decide karein?,"Healthy aur light meals select karein, children aur elderly ke liye proper quantity rakhein, staff instructions follow karein.",guidance,departure,roman
94,Boarding se pehle water aur snacks kaise arrange karein?,"Airport cafe ya shops use karein, boarding se pehle purchase karein, staff assistance lein agar needed ho.",guidance,departure,roman
95,Flight emergency me kya actions lene chahiye?,"Staff instructions follow karein, seat belt bandhein, exit routes use karein, children aur elderly ki help karein.",guidance,departure,roman
96,Comfortable clothing ke liye kya tips hain?,"Light aur comfortable clothes pehnein, easy-to-remove shoes, aur movement-friendly attire select karein.",guidance,departure,roman
97,Boarding line me order aur discipline kaise maintain karein?,"Boarding group ke according pohonchein, documents ready rakhein, politely wait karein, staff instructions follow karein.",guidance,departure,roman
98,Children ke sleep aur comfort ke liye kya facilities hain?,"Pillow aur blanket available hain, calm environment maintain karein, headphones ya eye mask use karein, children ke pass rahen.",guidance,departure,roman
99,Airport lost luggage ke case me kya karein?,"Information desk ya airline counter contact karein, report file karein, receipt aur details safe rakhein, staff instructions follow karein.",guidance,departure,roman
100,Children aur elderly ke liye water aur meal kaise arrange karein?,"Water aur light meals available rakhein, children aur elderly ke liye proper quantity maintain karein, staff instructions follow karein, aur comfortable travel ensure karein.",guidance,departure,roman
101,Airport par check-in ke baad next steps kya hain?,"Boarding pass collect karein, baggage drop karein, security check complete karein, gate aur boarding time check karein, aur waiting area me relax karein.",guidance,departure,roman
102,Flight me mobile aur electronics ka safe use kaise karein?,"Devices close rakhein, security check ke liye alag karein, charger aur battery rules follow karein, aur staff instructions follow karein.",guidance,departure,roman
103,Children ke liye flight me comfort aur entertainment kaise provide karein?,"Stories, games, movies aur snacks arrange karein, headphones use karein, calm environment maintain karein, aur staff guidance follow karein.",guidance,departure,roman
104,Airport par emergency medical assistance kaise avail karein?,"Information desk ya airline counter se contact karein, first aid kit available hai, staff instructions follow karein, aur emergency me immediate help lein.",guidance,departure,roman
105,Flight delay hone par kya karna chahiye?,"Airline notifications aur display boards check karein, waiting area me relax karein, staff se alternate options aur updated timings confirm karein.",guidance,departure,roman
106,Airport par priority boarding kaise avail karein?,"Premium ticket ya membership ke mutabiq dedicated lane use karein, aur staff instructions follow karein taake boarding smooth ho.",guidance,departure,roman
107,Flight me comfortable sleep ke liye kya tips hain?,"Pillow aur blanket use karein, seat recline karein, headphone ya eye mask use karein, water regularly piyein, aur staff instructions follow karein.",guidance,departure,roman
108,Children aur elderly ki safety ke liye flight me kya precautions hain?,"Seat belt hamesha bandhein, mask ya life jacket use karein, calm rahen, aur children/elderly ke pass rahen.",guidance,departure,roman
109,Boarding ke waqt documents kaise ready rakhein?,"Passport, boarding pass aur ID ready rakhein, extra print ya receipt sath rakhein, aur staff instructions follow karein.",guidance,departure,roman
110,Flight me snacks aur meals kaise manage karein?,"Healthy aur light meals choose karein, children aur elderly ke liye proper quantity rakhein, staff instructions follow karein, aur tray aur seat clean rakhein.",guidance,departure,roman
111,Lost luggage ke case me kya steps hain?,"Information desk ya airline counter contact karein, report file karein, receipt aur details safe rakhein, aur staff instructions follow karein.",guidance,departure,roman
112,Flight me personal electronics kaise secure rakhein?,"Laptop, mobile aur devices close rakhein, security check ke liye alag karein, chargers aur batteries rules follow karein, staff guidance follow karein.",guidance,departure,roman
113,Boarding ke waqt line me patience kaise maintain karein?,"Boarding group ke according pohonchein, boarding pass ready rakhein, polite wait karein, staff instructions follow karein.",guidance,departure,roman
114,Flight me children ke liye activities aur entertainment kaise provide karein?,"Stories, games aur movies provide karein, headphones use karein, snacks aur water sath rakhein, staff instructions follow karein.",guidance,departure,roman
115,Airport par wheelchair ya special assistance kaise avail karein?,"Request pehle se submit karein, information desk ya airline counter se contact karein, staff instructions follow karein.",guidance,departure,roman
116,Flight me relaxation aur comfort ke liye available facilities kya hain?,"Pillow, blanket, headphone, eye mask, water aur snacks available hain, calm environment me staff assistance milegi.",guidance,departure,roman
117,Boarding ke waqt personal items kaise organize karein?,"Cabin bag aur essentials easily accessible rakhein, prohibited items separate rakhein, staff instructions follow karein.",guidance,departure,roman
118,Flight me meals aur drinks kaise manage karein?,"Healthy aur light meals rakhein, children aur elderly ke liye suitable quantity, staff instructions follow karein, aur tray clean rakhein.",guidance,departure,roman
119,Airport par special assistance counter kahan hai?,"Signs ya information desk follow karein, staff wheelchair aur disabled assistance provide karega, request pehle se submit karein.",guidance,departure,roman
120,Flight me children ki neend ke liye kya arrangements hain?,"Pillow aur blanket provide karein, calm environment maintain karein, headphones ya eye mask use karein, aur children ke pass rahen.",guidance,departure,roman
121,Comfortable clothing ke liye kya suggestions hain?,"Light aur comfortable clothes pehnein, shoes easy-to-remove ho, aur movement-friendly attire select karein.",guidance,departure,roman
122,Boarding line me order aur discipline kaise maintain karein?,"Boarding group ke according pohonchein, documents ready rakhein, politely wait karein, staff instructions follow karein.",guidance,departure,roman
123,Airport lounge kaise use karein?,"Premium ticket ya membership, boarding pass ready rakhein, comfortable seats, snacks aur wifi available, time se pohonchein.",guidance,departure,roman
124,Flight me noise aur disturbance se kaise bacha jaaye?,"Headphones ya earplugs use karein, calm rahen, staff instructions follow karein, aur dusre passengers ko disturb na karein.",guidance,departure,roman
125,Flight me seat ka use kaise optimize karein?,"Seat recline karein, headphones aur eye mask use karein, water aur snacks available rakhein, calm rahen, staff instructions follow karein.",guidance,departure,roman
126,Children aur elderly ke liye available facilities kya hain?,"Special seats, headphones, meals aur water provide kiye jate hain, staff assistance lein, aur safety instructions follow karein.",guidance,departure,roman
127,Airport emergency aur first aid kaise avail karein?,"Information desk ya airline counter se contact karein, staff instructions follow karein, first aid kit available hai, emergency me immediate help lein.",guidance,departure,roman
128,Flight me personal items ka loss kaise prevent karein?,"Cabin bag aur valuables close rakhein, overhead compartment secure karein, items organized rakhein, staff instructions follow karein.",guidance,departure,roman
129,Check-in ke waqt line me kya precautions follow karein?,"Line me patience rakhein, documents ready rakhein, staff instructions follow karein, aur dusre passengers disturb na karein.",guidance,departure,roman
130,Children safety ke liye flight me kya precautions hain?,"Seat belt bandhein, mask ya life jacket use karein, calm rahen, staff instructions follow karein, aur children ke pass rahen.",guidance,departure,roman
131,Personal electronics kaise safe rakhein?,"Laptop, mobile aur devices close rakhein, security check me separate karein, charger aur battery rules follow karein, staff instructions follow karein.",guidance,departure,roman
